[
  {
    "class_name": "classes.CustomerAction",
    "function_name": "find()",
    "analysis": "### Step 1: Summarize the Focal Method\n\nThe `find()` method in the `classes.CustomerAction` class is responsible for retrieving a list of `Customer` objects from a database using Hibernate. It starts by logging the beginning of the operation, then opens a Hibernate session and begins a transaction. It creates a `Criteria` object to query the `Customer` class and applies search conditions based on the `customer` field. If the `customer` object has an ID, it adds an ID restriction to the criteria. The method executes the query to get a list of customers, commits the transaction, and closes the session. The resulting list is stored in a request map, and a task constant is set. Finally, it logs the completion of the operation and returns a constant string `INPUT`.\n\n### Step 2: List Necessary Environment Settings\n\n#### Invoked Parameters and Fields\n- `this.customer`: An instance of `Customer` used to build query criteria.\n- `request`: A map-like object where the result list is stored.\n- `this.task`: A field where a constant value is set.\n\n#### Invoked Methods\n- `HibernateUtil.getSessionFactory()`: Returns a `SessionFactory` to open a session.\n- `sess.openSession()`: Opens a new Hibernate session.\n- `sess.beginTransaction()`: Begins a new transaction.\n- `sess.createCriteria(Customer.class)`: Creates a criteria query for `Customer`.\n- `Example.create(this.customer)`: Creates an example query based on the `customer` object.\n- `criteria.add(...)`: Adds restrictions to the criteria.\n- `criteria.list()`: Executes the query and returns a list of results.\n- `t.commit()`: Commits the transaction.\n- `sess.close()`: Closes the session.\n- `logger.info(...)`: Logs information messages.\n\n### Step 3: Decompose the Focal Method",
    "slices": [
      {
        "id": 1,
        "description": "Log the start of the find operation.",
        "code": "\t\tlogger.info( \"Starting find()\" ); //f:log",
        "start_line": 87,
        "end_line": 87
      },
      {
        "id": 2,
        "description": "Initialize Hibernate session and transaction.",
        "code": "\t\tSession sess = HibernateUtil.getSessionFactory().openSession(); //f:hibernate\n\t\tTransaction t = sess.beginTransaction(); //f:hibernate",
        "start_line": 88,
        "end_line": 89
      },
      {
        "id": 3,
        "description": "Create criteria for querying Customer entities.",
        "code": "\t\tCriteria criteria = sess.createCriteria( Customer.class ); //f:hibernate",
        "start_line": 91,
        "end_line": 91
      },
      {
        "id": 4,
        "description": "Add search conditions to the criteria based on the customer field.",
        "code": "\t\tcriteria.add( Example.create( this.customer ).excludeZeroes().ignoreCase().enableLike( MatchMode.ANYWHERE ) ); //f:hibernate\n\t\tif ( this.customer.getId() != null ) { //f:hibernate\n\t\t\tcriteria.add( Restrictions.idEq( this.customer.getId() ) ); //f:hibernate\n\t\t} //f:hibernate",
        "start_line": 93,
        "end_line": 96
      },
      {
        "id": 5,
        "description": "Execute the query and retrieve the list of customers.",
        "code": "\t\t@SuppressWarnings(\"unchecked\")\n\t\tList<Customer> l = (List<Customer>) criteria.list(); //f:hibernate",
        "start_line": 98,
        "end_line": 99
      },
      {
        "id": 6,
        "description": "Commit the transaction and close the session.",
        "code": "\t\tt.commit(); //f:hibernate\n\t\tsess.close(); //f:hibernate",
        "start_line": 100,
        "end_line": 101
      },
      {
        "id": 7,
        "description": "Store the result list in the request map.",
        "code": "\t\trequest.put( \"list\", l );",
        "start_line": 102,
        "end_line": 102
      },
      {
        "id": 8,
        "description": "Set the task field to a constant value.",
        "code": "\t\tthis.task = SystemConstants.CR_MODE;",
        "start_line": 104,
        "end_line": 104
      },
      {
        "id": 9,
        "description": "Log the completion of the find operation and return a constant string.",
        "code": "\t\tlogger.info( \"Finishing find()\" ); //f:log\n\t\treturn INPUT;",
        "start_line": 105,
        "end_line": 106
      }
    ],
    "full_response": "### Step 1: Summarize the Focal Method\n\nThe `find()` method in the `classes.CustomerAction` class is responsible for retrieving a list of `Customer` objects from a database using Hibernate. It starts by logging the beginning of the operation, then opens a Hibernate session and begins a transaction. It creates a `Criteria` object to query the `Customer` class and applies search conditions based on the `customer` field. If the `customer` object has an ID, it adds an ID restriction to the criteria. The method executes the query to get a list of customers, commits the transaction, and closes the session. The resulting list is stored in a request map, and a task constant is set. Finally, it logs the completion of the operation and returns a constant string `INPUT`.\n\n### Step 2: List Necessary Environment Settings\n\n#### Invoked Parameters and Fields\n- `this.customer`: An instance of `Customer` used to build query criteria.\n- `request`: A map-like object where the result list is stored.\n- `this.task`: A field where a constant value is set.\n\n#### Invoked Methods\n- `HibernateUtil.getSessionFactory()`: Returns a `SessionFactory` to open a session.\n- `sess.openSession()`: Opens a new Hibernate session.\n- `sess.beginTransaction()`: Begins a new transaction.\n- `sess.createCriteria(Customer.class)`: Creates a criteria query for `Customer`.\n- `Example.create(this.customer)`: Creates an example query based on the `customer` object.\n- `criteria.add(...)`: Adds restrictions to the criteria.\n- `criteria.list()`: Executes the query and returns a list of results.\n- `t.commit()`: Commits the transaction.\n- `sess.close()`: Closes the session.\n- `logger.info(...)`: Logs information messages.\n\n### Step 3: Decompose the Focal Method\n\n```json\n[\n  {\n    \"id\": 1,\n    \"description\": \"Log the start of the find operation.\",\n    \"code\": \"\\t\\tlogger.info( \\\"Starting find()\\\" ); //f:log\",\n    \"start_line\": 87,\n    \"end_line\": 87\n  },\n  {\n    \"id\": 2,\n    \"description\": \"Initialize Hibernate session and transaction.\",\n    \"code\": \"\\t\\tSession sess = HibernateUtil.getSessionFactory().openSession(); //f:hibernate\\n\\t\\tTransaction t = sess.beginTransaction(); //f:hibernate\",\n    \"start_line\": 88,\n    \"end_line\": 89\n  },\n  {\n    \"id\": 3,\n    \"description\": \"Create criteria for querying Customer entities.\",\n    \"code\": \"\\t\\tCriteria criteria = sess.createCriteria( Customer.class ); //f:hibernate\",\n    \"start_line\": 91,\n    \"end_line\": 91\n  },\n  {\n    \"id\": 4,\n    \"description\": \"Add search conditions to the criteria based on the customer field.\",\n    \"code\": \"\\t\\tcriteria.add( Example.create( this.customer ).excludeZeroes().ignoreCase().enableLike( MatchMode.ANYWHERE ) ); //f:hibernate\\n\\t\\tif ( this.customer.getId() != null ) { //f:hibernate\\n\\t\\t\\tcriteria.add( Restrictions.idEq( this.customer.getId() ) ); //f:hibernate\\n\\t\\t} //f:hibernate\",\n    \"start_line\": 93,\n    \"end_line\": 96\n  },\n  {\n    \"id\": 5,\n    \"description\": \"Execute the query and retrieve the list of customers.\",\n    \"code\": \"\\t\\t@SuppressWarnings(\\\"unchecked\\\")\\n\\t\\tList<Customer> l = (List<Customer>) criteria.list(); //f:hibernate\",\n    \"start_line\": 98,\n    \"end_line\": 99\n  },\n  {\n    \"id\": 6,\n    \"description\": \"Commit the transaction and close the session.\",\n    \"code\": \"\\t\\tt.commit(); //f:hibernate\\n\\t\\tsess.close(); //f:hibernate\",\n    \"start_line\": 100,\n    \"end_line\": 101\n  },\n  {\n    \"id\": 7,\n    \"description\": \"Store the result list in the request map.\",\n    \"code\": \"\\t\\trequest.put( \\\"list\\\", l );\",\n    \"start_line\": 102,\n    \"end_line\": 102\n  },\n  {\n    \"id\": 8,\n    \"description\": \"Set the task field to a constant value.\",\n    \"code\": \"\\t\\tthis.task = SystemConstants.CR_MODE;\",\n    \"start_line\": 104,\n    \"end_line\": 104\n  },\n  {\n    \"id\": 9,\n    \"description\": \"Log the completion of the find operation and return a constant string.\",\n    \"code\": \"\\t\\tlogger.info( \\\"Finishing find()\\\" ); //f:log\\n\\t\\treturn INPUT;\",\n    \"start_line\": 105,\n    \"end_line\": 106\n  }\n]\n```"
  },
  {
    "class_name": "classes.CustomerAction",
    "function_name": "save()",
    "analysis": "### Step 1: Summarize the Focal Method\n\nThe `save()` method in the `CustomerAction` class is responsible for persisting a `customer` object to the database using Hibernate. It begins by logging the start of the operation, then opens a Hibernate session and begins a transaction. The method saves the `customer` object, commits the transaction, and closes the session. Following the database operations, it updates a task status, adds a success message, logs the completion of the operation, and returns a constant value indicating the input status.\n\n### Step 2: List Necessary Environment Settings to Run the Focal Method\n\n- **Invoked Parameters and Fields:**\n  - `this.customer`: The customer object to be saved.\n  - `this.task`: A field updated to indicate the task status.\n  - `SystemConstants.UD_MODE`: A constant used to update the task status.\n  - `INPUT`: A constant value returned by the method.\n\n- **Invoked Methods:**\n  - `HibernateUtil.getSessionFactory()`: Retrieves the session factory for opening a session.\n  - `sess.beginTransaction()`: Begins a new transaction.\n  - `sess.save(this.customer)`: Saves the customer object to the database.\n  - `t.commit()`: Commits the current transaction.\n  - `sess.close()`: Closes the session.\n  - `this.addActionMessage(this.getText(\"saveSuccessful\", new String[]{\"customer\"}))`: Adds a success message.\n  - `logger.info()`: Logs informational messages.\n\n### Step 3: Decompose the Focal Method into Multiple Problem-Solving Steps",
    "slices": [
      {
        "id": 1,
        "description": "Log the start of the save operation.",
        "code": "\t\tlogger.info( \"Starting save()\" ); //f:log",
        "start_line": 110,
        "end_line": 110
      },
      {
        "id": 2,
        "description": "Open a Hibernate session and begin a transaction.",
        "code": "\t\tSession sess = HibernateUtil.getSessionFactory().openSession(); //f:hibernate\n\t\tTransaction t = sess.beginTransaction(); //f:hibernate",
        "start_line": 111,
        "end_line": 112
      },
      {
        "id": 3,
        "description": "Save the customer object to the database.",
        "code": "\t\tsess.save( this.customer ); //f:hibernate",
        "start_line": 114,
        "end_line": 114
      },
      {
        "id": 4,
        "description": "Commit the transaction and close the session.",
        "code": "\t\tt.commit(); //f:hibernate\n\t\tsess.close(); //f:hibernate",
        "start_line": 116,
        "end_line": 117
      },
      {
        "id": 5,
        "description": "Update the task status and add a success message.",
        "code": "\t\tthis.task = SystemConstants.UD_MODE;\n\t\tthis.addActionMessage( this.getText( \"saveSuccessful\", new String[]{\"customer\"})  );",
        "start_line": 119,
        "end_line": 120
      },
      {
        "id": 6,
        "description": "Log the completion of the save operation and return the input status.",
        "code": "\t\tlogger.info( \"Finishing save()\" ); //f:log\n\t\treturn INPUT;",
        "start_line": 122,
        "end_line": 123
      }
    ],
    "full_response": "### Step 1: Summarize the Focal Method\n\nThe `save()` method in the `CustomerAction` class is responsible for persisting a `customer` object to the database using Hibernate. It begins by logging the start of the operation, then opens a Hibernate session and begins a transaction. The method saves the `customer` object, commits the transaction, and closes the session. Following the database operations, it updates a task status, adds a success message, logs the completion of the operation, and returns a constant value indicating the input status.\n\n### Step 2: List Necessary Environment Settings to Run the Focal Method\n\n- **Invoked Parameters and Fields:**\n  - `this.customer`: The customer object to be saved.\n  - `this.task`: A field updated to indicate the task status.\n  - `SystemConstants.UD_MODE`: A constant used to update the task status.\n  - `INPUT`: A constant value returned by the method.\n\n- **Invoked Methods:**\n  - `HibernateUtil.getSessionFactory()`: Retrieves the session factory for opening a session.\n  - `sess.beginTransaction()`: Begins a new transaction.\n  - `sess.save(this.customer)`: Saves the customer object to the database.\n  - `t.commit()`: Commits the current transaction.\n  - `sess.close()`: Closes the session.\n  - `this.addActionMessage(this.getText(\"saveSuccessful\", new String[]{\"customer\"}))`: Adds a success message.\n  - `logger.info()`: Logs informational messages.\n\n### Step 3: Decompose the Focal Method into Multiple Problem-Solving Steps\n\n```json\n[\n  {\n    \"id\": 1,\n    \"description\": \"Log the start of the save operation.\",\n    \"code\": \"\\t\\tlogger.info( \\\"Starting save()\\\" ); //f:log\",\n    \"start_line\": 110,\n    \"end_line\": 110\n  },\n  {\n    \"id\": 2,\n    \"description\": \"Open a Hibernate session and begin a transaction.\",\n    \"code\": \"\\t\\tSession sess = HibernateUtil.getSessionFactory().openSession(); //f:hibernate\\n\\t\\tTransaction t = sess.beginTransaction(); //f:hibernate\",\n    \"start_line\": 111,\n    \"end_line\": 112\n  },\n  {\n    \"id\": 3,\n    \"description\": \"Save the customer object to the database.\",\n    \"code\": \"\\t\\tsess.save( this.customer ); //f:hibernate\",\n    \"start_line\": 114,\n    \"end_line\": 114\n  },\n  {\n    \"id\": 4,\n    \"description\": \"Commit the transaction and close the session.\",\n    \"code\": \"\\t\\tt.commit(); //f:hibernate\\n\\t\\tsess.close(); //f:hibernate\",\n    \"start_line\": 116,\n    \"end_line\": 117\n  },\n  {\n    \"id\": 5,\n    \"description\": \"Update the task status and add a success message.\",\n    \"code\": \"\\t\\tthis.task = SystemConstants.UD_MODE;\\n\\t\\tthis.addActionMessage( this.getText( \\\"saveSuccessful\\\", new String[]{\\\"customer\\\"})  );\",\n    \"start_line\": 119,\n    \"end_line\": 120\n  },\n  {\n    \"id\": 6,\n    \"description\": \"Log the completion of the save operation and return the input status.\",\n    \"code\": \"\\t\\tlogger.info( \\\"Finishing save()\\\" ); //f:log\\n\\t\\treturn INPUT;\",\n    \"start_line\": 122,\n    \"end_line\": 123\n  }\n]\n```"
  },
  {
    "class_name": "classes.CustomerAction",
    "function_name": "update()",
    "analysis": "### Step 1: Summarize the Focal Method\n\nThe `update()` method in the `classes.CustomerAction` class is responsible for updating a customer record in the database using Hibernate. It begins by logging the start of the update process, then opens a Hibernate session and begins a transaction. The method proceeds to update the customer entity in the database, commits the transaction, and closes the session. After successfully updating the customer, it sets a task mode, adds an action message indicating success, logs the completion of the update process, and returns an input constant.\n\n### Step 2: List Necessary Environment Settings to Run the Focal Method\n\n- **Invoked Parameters and Fields:**\n  - `this.customer`: The customer object that needs to be updated.\n  - `this.task`: A field to set the task mode.\n  \n- **Invoked Methods:**\n  - `HibernateUtil.getSessionFactory()`: Obtains the Hibernate session factory.\n  - `sess.update(this.customer)`: Updates the customer entity in the database.\n  - `t.commit()`: Commits the current transaction.\n  - `sess.close()`: Closes the Hibernate session.\n  - `this.addActionMessage(String)`: Adds a message to the action context.\n  - `this.getText(String, String[])`: Retrieves a localized text message.\n  \n- **Dependent Fields:**\n  - `sessionFactory` in `HibernateUtil`: A static field holding the session factory instance.\n\n### Step 3: Decompose the Focal Method into Multiple Problem-Solving Steps",
    "slices": [
      {
        "id": 1,
        "description": "Log the start of the update process.",
        "code": "\t\tlogger.info( \"Starting update()\" ); //f:log",
        "start_line": 127,
        "end_line": 127
      },
      {
        "id": 2,
        "description": "Initialize a Hibernate session and begin a transaction.",
        "code": "\t\tSession sess = HibernateUtil.getSessionFactory().openSession(); //f:hibernate\n\t\tTransaction t = sess.beginTransaction(); //f:hibernate",
        "start_line": 128,
        "end_line": 129
      },
      {
        "id": 3,
        "description": "Update the customer entity in the database.",
        "code": "\t\tsess.update( this.customer ); //f:hibernate",
        "start_line": 131,
        "end_line": 131
      },
      {
        "id": 4,
        "description": "Commit the transaction and close the session.",
        "code": "\t\tt.commit(); //f:hibernate\n\t\tsess.close(); //f:hibernate",
        "start_line": 133,
        "end_line": 134
      },
      {
        "id": 5,
        "description": "Set the task mode and add a success message.",
        "code": "\t\tthis.task = SystemConstants.UD_MODE;\n\t\tthis.addActionMessage( this.getText( \"updateSuccessful\", new String[]{\"customer\"})  );",
        "start_line": 136,
        "end_line": 137
      },
      {
        "id": 6,
        "description": "Log the completion of the update process and return the input constant.",
        "code": "\t\tlogger.info( \"Finishing update()\" ); //f:log\n\t\treturn INPUT;",
        "start_line": 139,
        "end_line": 140
      }
    ],
    "full_response": "### Step 1: Summarize the Focal Method\n\nThe `update()` method in the `classes.CustomerAction` class is responsible for updating a customer record in the database using Hibernate. It begins by logging the start of the update process, then opens a Hibernate session and begins a transaction. The method proceeds to update the customer entity in the database, commits the transaction, and closes the session. After successfully updating the customer, it sets a task mode, adds an action message indicating success, logs the completion of the update process, and returns an input constant.\n\n### Step 2: List Necessary Environment Settings to Run the Focal Method\n\n- **Invoked Parameters and Fields:**\n  - `this.customer`: The customer object that needs to be updated.\n  - `this.task`: A field to set the task mode.\n  \n- **Invoked Methods:**\n  - `HibernateUtil.getSessionFactory()`: Obtains the Hibernate session factory.\n  - `sess.update(this.customer)`: Updates the customer entity in the database.\n  - `t.commit()`: Commits the current transaction.\n  - `sess.close()`: Closes the Hibernate session.\n  - `this.addActionMessage(String)`: Adds a message to the action context.\n  - `this.getText(String, String[])`: Retrieves a localized text message.\n  \n- **Dependent Fields:**\n  - `sessionFactory` in `HibernateUtil`: A static field holding the session factory instance.\n\n### Step 3: Decompose the Focal Method into Multiple Problem-Solving Steps\n\n```json\n[\n  {\n    \"id\": 1,\n    \"description\": \"Log the start of the update process.\",\n    \"code\": \"\\t\\tlogger.info( \\\"Starting update()\\\" ); //f:log\",\n    \"start_line\": 127,\n    \"end_line\": 127\n  },\n  {\n    \"id\": 2,\n    \"description\": \"Initialize a Hibernate session and begin a transaction.\",\n    \"code\": \"\\t\\tSession sess = HibernateUtil.getSessionFactory().openSession(); //f:hibernate\\n\\t\\tTransaction t = sess.beginTransaction(); //f:hibernate\",\n    \"start_line\": 128,\n    \"end_line\": 129\n  },\n  {\n    \"id\": 3,\n    \"description\": \"Update the customer entity in the database.\",\n    \"code\": \"\\t\\tsess.update( this.customer ); //f:hibernate\",\n    \"start_line\": 131,\n    \"end_line\": 131\n  },\n  {\n    \"id\": 4,\n    \"description\": \"Commit the transaction and close the session.\",\n    \"code\": \"\\t\\tt.commit(); //f:hibernate\\n\\t\\tsess.close(); //f:hibernate\",\n    \"start_line\": 133,\n    \"end_line\": 134\n  },\n  {\n    \"id\": 5,\n    \"description\": \"Set the task mode and add a success message.\",\n    \"code\": \"\\t\\tthis.task = SystemConstants.UD_MODE;\\n\\t\\tthis.addActionMessage( this.getText( \\\"updateSuccessful\\\", new String[]{\\\"customer\\\"})  );\",\n    \"start_line\": 136,\n    \"end_line\": 137\n  },\n  {\n    \"id\": 6,\n    \"description\": \"Log the completion of the update process and return the input constant.\",\n    \"code\": \"\\t\\tlogger.info( \\\"Finishing update()\\\" ); //f:log\\n\\t\\treturn INPUT;\",\n    \"start_line\": 139,\n    \"end_line\": 140\n  }\n]\n```"
  },
  {
    "class_name": "classes.CustomerAction",
    "function_name": "delete()",
    "analysis": "### Step 1: Summarize the Focal Method\n\nThe `delete()` method in the `classes.CustomerAction` class is responsible for deleting a customer record from the database using Hibernate. It initiates a session and transaction, deletes the customer, commits the transaction, and then closes the session. After the deletion, it sets a task mode, adds a success message, logs the completion of the method, and returns the result of an input method.\n\n### Step 2: List Necessary Environment Settings to Run the Focal Method\n\n- **Invoked Fields and Parameters:**\n  - `this.customer`: The customer object to be deleted.\n  - `this.task`: A field to set the task mode.\n  \n- **Invoked Methods:**\n  - `HibernateUtil.getSessionFactory()`: Returns a `SessionFactory` to open a session.\n  - `this.addActionMessage(String)`: Adds a message to be displayed to the user.\n  - `this.getText(String, String[])`: Retrieves a localized text message.\n  - `this.input()`: Returns the input result, presumably a string indicating the next step or view.\n\n### Step 3: Decompose the Focal Method into Multiple Problem-Solving Steps",
    "slices": [
      {
        "id": 1,
        "description": "Initialize logging and start a Hibernate session and transaction.",
        "code": "\t\tlogger.info( \"Starting delete()\" ); //f:log\n\t\tSession sess = HibernateUtil.getSessionFactory().openSession(); //f:hibernate\n\t\tTransaction t = sess.beginTransaction(); //f:hibernate",
        "start_line": 144,
        "end_line": 146
      },
      {
        "id": 2,
        "description": "Delete the customer object from the session.",
        "code": "\t\tsess.delete( this.customer ); //f:hibernate",
        "start_line": 148,
        "end_line": 148
      },
      {
        "id": 3,
        "description": "Commit the transaction and close the session.",
        "code": "\t\tt.commit(); //f:hibernate\n\t\tsess.close(); //f:hibernate",
        "start_line": 150,
        "end_line": 151
      },
      {
        "id": 4,
        "description": "Set the task mode and add a success message.",
        "code": "\t\tthis.task = SystemConstants.CR_MODE;\n\t\tthis.addActionMessage( this.getText( \"deleteSuccessful\", new String[]{\"customer\"})  );",
        "start_line": 153,
        "end_line": 154
      },
      {
        "id": 5,
        "description": "Log the completion of the delete operation and return the input result.",
        "code": "\t\tlogger.info( \"Finishing delete()\" ); //f:log\n\t\treturn this.input();",
        "start_line": 156,
        "end_line": 157
      }
    ],
    "full_response": "### Step 1: Summarize the Focal Method\n\nThe `delete()` method in the `classes.CustomerAction` class is responsible for deleting a customer record from the database using Hibernate. It initiates a session and transaction, deletes the customer, commits the transaction, and then closes the session. After the deletion, it sets a task mode, adds a success message, logs the completion of the method, and returns the result of an input method.\n\n### Step 2: List Necessary Environment Settings to Run the Focal Method\n\n- **Invoked Fields and Parameters:**\n  - `this.customer`: The customer object to be deleted.\n  - `this.task`: A field to set the task mode.\n  \n- **Invoked Methods:**\n  - `HibernateUtil.getSessionFactory()`: Returns a `SessionFactory` to open a session.\n  - `this.addActionMessage(String)`: Adds a message to be displayed to the user.\n  - `this.getText(String, String[])`: Retrieves a localized text message.\n  - `this.input()`: Returns the input result, presumably a string indicating the next step or view.\n\n### Step 3: Decompose the Focal Method into Multiple Problem-Solving Steps\n\n```json\n[\n  {\n    \"id\": 1,\n    \"description\": \"Initialize logging and start a Hibernate session and transaction.\",\n    \"code\": \"\\t\\tlogger.info( \\\"Starting delete()\\\" ); //f:log\\n\\t\\tSession sess = HibernateUtil.getSessionFactory().openSession(); //f:hibernate\\n\\t\\tTransaction t = sess.beginTransaction(); //f:hibernate\",\n    \"start_line\": 144,\n    \"end_line\": 146\n  },\n  {\n    \"id\": 2,\n    \"description\": \"Delete the customer object from the session.\",\n    \"code\": \"\\t\\tsess.delete( this.customer ); //f:hibernate\",\n    \"start_line\": 148,\n    \"end_line\": 148\n  },\n  {\n    \"id\": 3,\n    \"description\": \"Commit the transaction and close the session.\",\n    \"code\": \"\\t\\tt.commit(); //f:hibernate\\n\\t\\tsess.close(); //f:hibernate\",\n    \"start_line\": 150,\n    \"end_line\": 151\n  },\n  {\n    \"id\": 4,\n    \"description\": \"Set the task mode and add a success message.\",\n    \"code\": \"\\t\\tthis.task = SystemConstants.CR_MODE;\\n\\t\\tthis.addActionMessage( this.getText( \\\"deleteSuccessful\\\", new String[]{\\\"customer\\\"})  );\",\n    \"start_line\": 153,\n    \"end_line\": 154\n  },\n  {\n    \"id\": 5,\n    \"description\": \"Log the completion of the delete operation and return the input result.\",\n    \"code\": \"\\t\\tlogger.info( \\\"Finishing delete()\\\" ); //f:log\\n\\t\\treturn this.input();\",\n    \"start_line\": 156,\n    \"end_line\": 157\n  }\n]\n```"
  },
  {
    "class_name": "classes.CustomerAction",
    "function_name": "edit()",
    "analysis": "## Step 1: Summarise the Focal Method\n\nThe `edit()` method in the `classes.CustomerAction` class is responsible for editing a customer's information. It begins by logging the start of the operation and retrieves a customer ID from the parameters. It then opens a Hibernate session and transaction to fetch the customer object from the database using the retrieved ID. After committing the transaction and closing the session, the method sets the fetched customer to the current object, logs the completion of the operation, sets a task mode, and finally returns an input constant.\n\n## Step 2: List Necessary Environment Settings to Run the Focal Method\n\n### Invoked Parameters and Fields\n- `this.parameters`: A map-like structure that holds request parameters, used to extract the customer ID.\n- `this.task`: A field in the class that is set to a constant value at the end of the method.\n\n### Invoked Methods\n- `HibernateUtil.getSessionFactory()`: A static method that returns the session factory for creating Hibernate sessions.\n- `sess.get(Customer.class, id)`: A method to retrieve a customer object from the database using the session.\n- `this.setCustomer(c)`: A method to set the customer object in the current class.\n\n### Dependent Fields and Methods\n- `private static final SessionFactory sessionFactory`: Used within `HibernateUtil` to manage Hibernate sessions.\n- `public static SessionFactory getSessionFactory()`: Returns the session factory for creating sessions.\n\n## Step 3: Decompose the Focal Method into Multiple Problem-Solving Steps",
    "slices": [
      {
        "id": 1,
        "description": "Log the start of the edit operation and retrieve the customer ID from the parameters.",
        "code": "\t\tlogger.info( \"Starting edit()\" ); //f:log\n\t\tInteger id = Integer.valueOf( this.parameters.get( \"id\" )[0] );",
        "start_line": 161,
        "end_line": 162
      },
      {
        "id": 2,
        "description": "Open a Hibernate session and transaction, retrieve the customer object using the ID, commit the transaction, and close the session.",
        "code": "\t\tSession sess = HibernateUtil.getSessionFactory().openSession(); //f:hibernate\n\t\tTransaction t = sess.beginTransaction(); //f:hibernate\n\n\t\tCustomer c = (Customer) sess.get( Customer.class, id ); //f:hibernate\n\t\tt.commit(); //f:hibernate\n\t\tsess.close(); //f:hibernate",
        "start_line": 164,
        "end_line": 169
      },
      {
        "id": 3,
        "description": "Set the retrieved customer object to the current instance.",
        "code": "\t\tthis.setCustomer( c );",
        "start_line": 171,
        "end_line": 171
      },
      {
        "id": 4,
        "description": "Log the completion of the edit operation, set the task mode, and return the input constant.",
        "code": "\t\tlogger.info( \"Finishing edit()\" ); //f:log\n\t\tthis.task = SystemConstants.UD_MODE;\n\t\treturn INPUT;",
        "start_line": 173,
        "end_line": 175
      }
    ],
    "full_response": "## Step 1: Summarise the Focal Method\n\nThe `edit()` method in the `classes.CustomerAction` class is responsible for editing a customer's information. It begins by logging the start of the operation and retrieves a customer ID from the parameters. It then opens a Hibernate session and transaction to fetch the customer object from the database using the retrieved ID. After committing the transaction and closing the session, the method sets the fetched customer to the current object, logs the completion of the operation, sets a task mode, and finally returns an input constant.\n\n## Step 2: List Necessary Environment Settings to Run the Focal Method\n\n### Invoked Parameters and Fields\n- `this.parameters`: A map-like structure that holds request parameters, used to extract the customer ID.\n- `this.task`: A field in the class that is set to a constant value at the end of the method.\n\n### Invoked Methods\n- `HibernateUtil.getSessionFactory()`: A static method that returns the session factory for creating Hibernate sessions.\n- `sess.get(Customer.class, id)`: A method to retrieve a customer object from the database using the session.\n- `this.setCustomer(c)`: A method to set the customer object in the current class.\n\n### Dependent Fields and Methods\n- `private static final SessionFactory sessionFactory`: Used within `HibernateUtil` to manage Hibernate sessions.\n- `public static SessionFactory getSessionFactory()`: Returns the session factory for creating sessions.\n\n## Step 3: Decompose the Focal Method into Multiple Problem-Solving Steps\n\n```json\n[\n  {\n    \"id\": 1,\n    \"description\": \"Log the start of the edit operation and retrieve the customer ID from the parameters.\",\n    \"code\": \"\\t\\tlogger.info( \\\"Starting edit()\\\" ); //f:log\\n\\t\\tInteger id = Integer.valueOf( this.parameters.get( \\\"id\\\" )[0] );\",\n    \"start_line\": 161,\n    \"end_line\": 162\n  },\n  {\n    \"id\": 2,\n    \"description\": \"Open a Hibernate session and transaction, retrieve the customer object using the ID, commit the transaction, and close the session.\",\n    \"code\": \"\\t\\tSession sess = HibernateUtil.getSessionFactory().openSession(); //f:hibernate\\n\\t\\tTransaction t = sess.beginTransaction(); //f:hibernate\\n\\n\\t\\tCustomer c = (Customer) sess.get( Customer.class, id ); //f:hibernate\\n\\t\\tt.commit(); //f:hibernate\\n\\t\\tsess.close(); //f:hibernate\",\n    \"start_line\": 164,\n    \"end_line\": 169\n  },\n  {\n    \"id\": 3,\n    \"description\": \"Set the retrieved customer object to the current instance.\",\n    \"code\": \"\\t\\tthis.setCustomer( c );\",\n    \"start_line\": 171,\n    \"end_line\": 171\n  },\n  {\n    \"id\": 4,\n    \"description\": \"Log the completion of the edit operation, set the task mode, and return the input constant.\",\n    \"code\": \"\\t\\tlogger.info( \\\"Finishing edit()\\\" ); //f:log\\n\\t\\tthis.task = SystemConstants.UD_MODE;\\n\\t\\treturn INPUT;\",\n    \"start_line\": 173,\n    \"end_line\": 175\n  }\n]\n```"
  },
  {
    "class_name": "classes.LoginAction",
    "function_name": "execute()",
    "analysis": "### Step 1: Summarize the Focal Method\n\nThe `execute()` method in the `classes.LoginAction` class is responsible for handling a login action. It starts by logging the beginning of the execution and then initiates a Hibernate session and transaction. The method constructs a Hibernate `Criteria` to query the `User` table, using the username and password provided by the `user` object. If a matching user is found, it commits the transaction, closes the session, and stores the user in the session context, logging a success message and returning a success status. If no user is found, it logs a failure message, adds an action error, and returns an input status.\n\n### Step 2: List Necessary Environment Settings to Run the Focal Method\n\n- **Invoked Parameters and Fields:**\n  - `this.user`: An instance of `User` containing `username` and `password`.\n\n- **Invoked Methods:**\n  - `HibernateUtil.getSessionFactory()`: Returns a `SessionFactory` for creating sessions.\n  - `User.getUsername()`: Retrieves the username from the `User` object.\n  - `User.getPassword()`: Retrieves the password from the `User` object.\n  - `ActionContext.getContext().getSession().put()`: Stores the authenticated user in the session.\n  - `this.addActionError()`: Adds an action error message.\n  - `this.getText()`: Retrieves a localized text message.\n\n### Step 3: Decompose the Focal Method into Multiple Problem-Solving Steps",
    "slices": [
      {
        "id": 1,
        "description": "Initialize logging and Hibernate session/transaction.",
        "code": "\t\tlogger.info( \"Starting execute()\" ); //f:log\n\t\tSession sess = HibernateUtil.getSessionFactory().openSession(); //f:hibernate\n\t\tTransaction t = sess.beginTransaction(); //f:hibernate",
        "start_line": 45,
        "end_line": 47
      },
      {
        "id": 2,
        "description": "Create and configure Hibernate criteria for querying user by username and password.",
        "code": "\t\tCriteria criteria = sess.createCriteria( User.class ); //f:hibernate\n\n\t\tcriteria.add( Restrictions.idEq( this.user.getUsername() ) ); //f:hibernate\n\t\tcriteria.add( Restrictions.eq( \"password\", this.user.getPassword() ) ); //f:hibernate",
        "start_line": 49,
        "end_line": 52
      },
      {
        "id": 3,
        "description": "Execute the query to retrieve the user and commit the transaction.",
        "code": "\t\tUser user = (User) criteria.uniqueResult(); //f:hibernate\n\n\t\tt.commit(); //f:hibernate\n\t\tsess.close(); //f:hibernate",
        "start_line": 54,
        "end_line": 57
      },
      {
        "id": 4,
        "description": "Check if user is found, update session context, log success, and return success status.",
        "code": "\t\tif ( user != null ) {\n\t\t\tActionContext.getContext().getSession().put( SystemConstants.AUTHENTICATED_USER, user );\n\t\t\tlogger.info( \"Finishing execute() -- Success\" ); //f:log\n\t\t\treturn SUCCESS;\n\t\t}",
        "start_line": 59,
        "end_line": 63
      },
      {
        "id": 5,
        "description": "Handle login failure by adding an action error, logging failure, and returning input status.",
        "code": "\t\tthis.addActionError( this.getText( \"login.failure\" ) );\n\t\tlogger.info( \"Finishing execute() -- Failure\" ); //f:log\t\t\n\t\treturn INPUT;",
        "start_line": 65,
        "end_line": 67
      }
    ],
    "full_response": "### Step 1: Summarize the Focal Method\n\nThe `execute()` method in the `classes.LoginAction` class is responsible for handling a login action. It starts by logging the beginning of the execution and then initiates a Hibernate session and transaction. The method constructs a Hibernate `Criteria` to query the `User` table, using the username and password provided by the `user` object. If a matching user is found, it commits the transaction, closes the session, and stores the user in the session context, logging a success message and returning a success status. If no user is found, it logs a failure message, adds an action error, and returns an input status.\n\n### Step 2: List Necessary Environment Settings to Run the Focal Method\n\n- **Invoked Parameters and Fields:**\n  - `this.user`: An instance of `User` containing `username` and `password`.\n\n- **Invoked Methods:**\n  - `HibernateUtil.getSessionFactory()`: Returns a `SessionFactory` for creating sessions.\n  - `User.getUsername()`: Retrieves the username from the `User` object.\n  - `User.getPassword()`: Retrieves the password from the `User` object.\n  - `ActionContext.getContext().getSession().put()`: Stores the authenticated user in the session.\n  - `this.addActionError()`: Adds an action error message.\n  - `this.getText()`: Retrieves a localized text message.\n\n### Step 3: Decompose the Focal Method into Multiple Problem-Solving Steps\n\n```json\n[\n  {\n    \"id\": 1,\n    \"description\": \"Initialize logging and Hibernate session/transaction.\",\n    \"code\": \"\\t\\tlogger.info( \\\"Starting execute()\\\" ); //f:log\\n\\t\\tSession sess = HibernateUtil.getSessionFactory().openSession(); //f:hibernate\\n\\t\\tTransaction t = sess.beginTransaction(); //f:hibernate\",\n    \"start_line\": 45,\n    \"end_line\": 47\n  },\n  {\n    \"id\": 2,\n    \"description\": \"Create and configure Hibernate criteria for querying user by username and password.\",\n    \"code\": \"\\t\\tCriteria criteria = sess.createCriteria( User.class ); //f:hibernate\\n\\n\\t\\tcriteria.add( Restrictions.idEq( this.user.getUsername() ) ); //f:hibernate\\n\\t\\tcriteria.add( Restrictions.eq( \\\"password\\\", this.user.getPassword() ) ); //f:hibernate\",\n    \"start_line\": 49,\n    \"end_line\": 52\n  },\n  {\n    \"id\": 3,\n    \"description\": \"Execute the query to retrieve the user and commit the transaction.\",\n    \"code\": \"\\t\\tUser user = (User) criteria.uniqueResult(); //f:hibernate\\n\\n\\t\\tt.commit(); //f:hibernate\\n\\t\\tsess.close(); //f:hibernate\",\n    \"start_line\": 54,\n    \"end_line\": 57\n  },\n  {\n    \"id\": 4,\n    \"description\": \"Check if user is found, update session context, log success, and return success status.\",\n    \"code\": \"\\t\\tif ( user != null ) {\\n\\t\\t\\tActionContext.getContext().getSession().put( SystemConstants.AUTHENTICATED_USER, user );\\n\\t\\t\\tlogger.info( \\\"Finishing execute() -- Success\\\" ); //f:log\\n\\t\\t\\treturn SUCCESS;\\n\\t\\t}\",\n    \"start_line\": 59,\n    \"end_line\": 63\n  },\n  {\n    \"id\": 5,\n    \"description\": \"Handle login failure by adding an action error, logging failure, and returning input status.\",\n    \"code\": \"\\t\\tthis.addActionError( this.getText( \\\"login.failure\\\" ) );\\n\\t\\tlogger.info( \\\"Finishing execute() -- Failure\\\" ); //f:log\\t\\t\\n\\t\\treturn INPUT;\",\n    \"start_line\": 65,\n    \"end_line\": 67\n  }\n]\n```"
  },
  {
    "class_name": "classes.ProductAction",
    "function_name": "find()",
    "analysis": "### Step 1: Summarise the Focal Method\n\nThe `find()` method in the `classes.ProductAction` class is responsible for retrieving a list of `Product` objects from a database using Hibernate. It starts by logging the beginning of the operation, then opens a Hibernate session and begins a transaction. It creates a criteria query for the `Product` class, applies filters based on the `product` object's properties, and executes the query to retrieve a list of matching products. After committing the transaction and closing the session, it stores the result list in a request map and logs the completion of the operation. Finally, it returns a constant indicating the input view.\n\n### Step 2: List Necessary Environment Settings to Run the Focal Method\n\n#### Invoked Parameters and Fields\n- `this.product`: An instance of `Product` used to filter the query.\n- `request`: A map-like structure where the result list is stored.\n- `this.task`: A field that is set to a constant value during the method execution.\n\n#### Invoked Methods\n- `HibernateUtil.getSessionFactory()`: Returns a `SessionFactory` to open a Hibernate session.\n- `Product.getId()`: Retrieves the ID of the `Product` instance.\n- `logger.info(String)`: Logs informational messages.\n\n### Step 3: Decompose the Focal Method into Multiple Problem-Solving Steps",
    "slices": [
      {
        "id": 1,
        "description": "Log the start of the find operation.",
        "code": "\t\tlogger.info( \"Starting find()\" ); //f:log",
        "start_line": 89,
        "end_line": 89
      },
      {
        "id": 2,
        "description": "Open a Hibernate session and begin a transaction.",
        "code": "\t\tSession sess = HibernateUtil.getSessionFactory().openSession(); //f:hibernate\n\t\tTransaction t = sess.beginTransaction(); //f:hibernate",
        "start_line": 90,
        "end_line": 91
      },
      {
        "id": 3,
        "description": "Create a criteria query for the Product class and configure it with filters based on the product instance.",
        "code": "\t\tCriteria criteria = sess.createCriteria( Product.class ); //f:hibernate\n\n\t\tcriteria.add( Example.create( this.product ).excludeZeroes().ignoreCase().enableLike( MatchMode.ANYWHERE ) ); //f:hibernate\n\t\tif ( this.product.getId() != null ) { //f:hibernate\n\t\t\tcriteria.add( Restrictions.idEq( this.product.getId() ) ); //f:hibernate\n\t\t} //f:hibernate",
        "start_line": 93,
        "end_line": 98
      },
      {
        "id": 4,
        "description": "Execute the criteria query to retrieve a list of matching products.",
        "code": "\t\t@SuppressWarnings(\"unchecked\")\n\t\tList<Product> l = (List<Product>) criteria.list(); //f:hibernate",
        "start_line": 100,
        "end_line": 101
      },
      {
        "id": 5,
        "description": "Commit the transaction and close the Hibernate session.",
        "code": "\t\tt.commit(); //f:hibernate\n\t\tsess.close(); //f:hibernate",
        "start_line": 102,
        "end_line": 103
      },
      {
        "id": 6,
        "description": "Store the retrieved product list in the request map.",
        "code": "\t\trequest.put( \"list\", l );",
        "start_line": 104,
        "end_line": 104
      },
      {
        "id": 7,
        "description": "Set the task field to a constant value and log the completion of the find operation.",
        "code": "\t\tthis.task = SystemConstants.CR_MODE;\n\t\tlogger.info( \"Finishing find()\" ); //f:log",
        "start_line": 106,
        "end_line": 107
      },
      {
        "id": 8,
        "description": "Return the INPUT constant indicating the next view.",
        "code": "\t\treturn INPUT;",
        "start_line": 108,
        "end_line": 108
      }
    ],
    "full_response": "### Step 1: Summarise the Focal Method\n\nThe `find()` method in the `classes.ProductAction` class is responsible for retrieving a list of `Product` objects from a database using Hibernate. It starts by logging the beginning of the operation, then opens a Hibernate session and begins a transaction. It creates a criteria query for the `Product` class, applies filters based on the `product` object's properties, and executes the query to retrieve a list of matching products. After committing the transaction and closing the session, it stores the result list in a request map and logs the completion of the operation. Finally, it returns a constant indicating the input view.\n\n### Step 2: List Necessary Environment Settings to Run the Focal Method\n\n#### Invoked Parameters and Fields\n- `this.product`: An instance of `Product` used to filter the query.\n- `request`: A map-like structure where the result list is stored.\n- `this.task`: A field that is set to a constant value during the method execution.\n\n#### Invoked Methods\n- `HibernateUtil.getSessionFactory()`: Returns a `SessionFactory` to open a Hibernate session.\n- `Product.getId()`: Retrieves the ID of the `Product` instance.\n- `logger.info(String)`: Logs informational messages.\n\n### Step 3: Decompose the Focal Method into Multiple Problem-Solving Steps\n\n```json\n[\n  {\n    \"id\": 1,\n    \"description\": \"Log the start of the find operation.\",\n    \"code\": \"\\t\\tlogger.info( \\\"Starting find()\\\" ); //f:log\",\n    \"start_line\": 89,\n    \"end_line\": 89\n  },\n  {\n    \"id\": 2,\n    \"description\": \"Open a Hibernate session and begin a transaction.\",\n    \"code\": \"\\t\\tSession sess = HibernateUtil.getSessionFactory().openSession(); //f:hibernate\\n\\t\\tTransaction t = sess.beginTransaction(); //f:hibernate\",\n    \"start_line\": 90,\n    \"end_line\": 91\n  },\n  {\n    \"id\": 3,\n    \"description\": \"Create a criteria query for the Product class and configure it with filters based on the product instance.\",\n    \"code\": \"\\t\\tCriteria criteria = sess.createCriteria( Product.class ); //f:hibernate\\n\\n\\t\\tcriteria.add( Example.create( this.product ).excludeZeroes().ignoreCase().enableLike( MatchMode.ANYWHERE ) ); //f:hibernate\\n\\t\\tif ( this.product.getId() != null ) { //f:hibernate\\n\\t\\t\\tcriteria.add( Restrictions.idEq( this.product.getId() ) ); //f:hibernate\\n\\t\\t} //f:hibernate\",\n    \"start_line\": 93,\n    \"end_line\": 98\n  },\n  {\n    \"id\": 4,\n    \"description\": \"Execute the criteria query to retrieve a list of matching products.\",\n    \"code\": \"\\t\\t@SuppressWarnings(\\\"unchecked\\\")\\n\\t\\tList<Product> l = (List<Product>) criteria.list(); //f:hibernate\",\n    \"start_line\": 100,\n    \"end_line\": 101\n  },\n  {\n    \"id\": 5,\n    \"description\": \"Commit the transaction and close the Hibernate session.\",\n    \"code\": \"\\t\\tt.commit(); //f:hibernate\\n\\t\\tsess.close(); //f:hibernate\",\n    \"start_line\": 102,\n    \"end_line\": 103\n  },\n  {\n    \"id\": 6,\n    \"description\": \"Store the retrieved product list in the request map.\",\n    \"code\": \"\\t\\trequest.put( \\\"list\\\", l );\",\n    \"start_line\": 104,\n    \"end_line\": 104\n  },\n  {\n    \"id\": 7,\n    \"description\": \"Set the task field to a constant value and log the completion of the find operation.\",\n    \"code\": \"\\t\\tthis.task = SystemConstants.CR_MODE;\\n\\t\\tlogger.info( \\\"Finishing find()\\\" ); //f:log\",\n    \"start_line\": 106,\n    \"end_line\": 107\n  },\n  {\n    \"id\": 8,\n    \"description\": \"Return the INPUT constant indicating the next view.\",\n    \"code\": \"\\t\\treturn INPUT;\",\n    \"start_line\": 108,\n    \"end_line\": 108\n  }\n]\n```"
  },
  {
    "class_name": "classes.ProductAction",
    "function_name": "save()",
    "analysis": "## Step 1: Summarise the Focal Method\n\nThe `save()` method in the `classes.ProductAction` class is responsible for persisting a `product` object to the database using Hibernate. It begins by logging the start of the save operation, then opens a Hibernate session and begins a transaction. The method saves the `product` object, commits the transaction, and closes the session. Afterward, it sets a task mode, adds a success message, logs the completion of the save operation, and returns an `INPUT` string.\n\n## Step 2: List Necessary Environment Settings to Run the Focal Method\n\n### Invoked Parameters and Fields\n- `this.product`: The product object to be saved.\n- `this.task`: A field that is set to `SystemConstants.UD_MODE`.\n  \n### Invoked Methods\n- `HibernateUtil.getSessionFactory()`: Retrieves the Hibernate `SessionFactory`.\n- `sess.save(this.product)`: Saves the product object to the database.\n- `t.commit()`: Commits the transaction.\n- `sess.close()`: Closes the Hibernate session.\n- `this.addActionMessage(String)`: Adds a message to the action.\n- `this.getText(String, String[])`: Retrieves a localized text message.\n- `logger.info(String)`: Logs information messages.\n\n## Step 3: Decompose the Focal Method into Multiple Problem-Solving Steps",
    "slices": [
      {
        "id": 1,
        "description": "Log the start of the save operation.",
        "code": "\t\tlogger.info( \"Starting save()\" ); //f:log",
        "start_line": 112,
        "end_line": 112
      },
      {
        "id": 2,
        "description": "Open a Hibernate session and begin a transaction.",
        "code": "\t\tSession sess = HibernateUtil.getSessionFactory().openSession(); //f:hibernate\n\t\tTransaction t = sess.beginTransaction(); //f:hibernate",
        "start_line": 113,
        "end_line": 114
      },
      {
        "id": 3,
        "description": "Save the product object to the database.",
        "code": "\t\tsess.save( this.product ); //f:hibernate",
        "start_line": 116,
        "end_line": 116
      },
      {
        "id": 4,
        "description": "Commit the transaction and close the session.",
        "code": "\t\tt.commit(); //f:hibernate\n\t\tsess.close(); //f:hibernate",
        "start_line": 118,
        "end_line": 119
      },
      {
        "id": 5,
        "description": "Set the task mode and add a success message.",
        "code": "\t\tthis.task = SystemConstants.UD_MODE;\n\t\tthis.addActionMessage( this.getText( \"saveSuccessful\", new String[]{\"product\"})  );",
        "start_line": 121,
        "end_line": 122
      },
      {
        "id": 6,
        "description": "Log the completion of the save operation and return INPUT.",
        "code": "\t\tlogger.info( \"Finishing save()\" ); //f:log\n\t\treturn INPUT;",
        "start_line": 124,
        "end_line": 125
      }
    ],
    "full_response": "## Step 1: Summarise the Focal Method\n\nThe `save()` method in the `classes.ProductAction` class is responsible for persisting a `product` object to the database using Hibernate. It begins by logging the start of the save operation, then opens a Hibernate session and begins a transaction. The method saves the `product` object, commits the transaction, and closes the session. Afterward, it sets a task mode, adds a success message, logs the completion of the save operation, and returns an `INPUT` string.\n\n## Step 2: List Necessary Environment Settings to Run the Focal Method\n\n### Invoked Parameters and Fields\n- `this.product`: The product object to be saved.\n- `this.task`: A field that is set to `SystemConstants.UD_MODE`.\n  \n### Invoked Methods\n- `HibernateUtil.getSessionFactory()`: Retrieves the Hibernate `SessionFactory`.\n- `sess.save(this.product)`: Saves the product object to the database.\n- `t.commit()`: Commits the transaction.\n- `sess.close()`: Closes the Hibernate session.\n- `this.addActionMessage(String)`: Adds a message to the action.\n- `this.getText(String, String[])`: Retrieves a localized text message.\n- `logger.info(String)`: Logs information messages.\n\n## Step 3: Decompose the Focal Method into Multiple Problem-Solving Steps\n\n```json\n[\n  {\n    \"id\": 1,\n    \"description\": \"Log the start of the save operation.\",\n    \"code\": \"\\t\\tlogger.info( \\\"Starting save()\\\" ); //f:log\",\n    \"start_line\": 112,\n    \"end_line\": 112\n  },\n  {\n    \"id\": 2,\n    \"description\": \"Open a Hibernate session and begin a transaction.\",\n    \"code\": \"\\t\\tSession sess = HibernateUtil.getSessionFactory().openSession(); //f:hibernate\\n\\t\\tTransaction t = sess.beginTransaction(); //f:hibernate\",\n    \"start_line\": 113,\n    \"end_line\": 114\n  },\n  {\n    \"id\": 3,\n    \"description\": \"Save the product object to the database.\",\n    \"code\": \"\\t\\tsess.save( this.product ); //f:hibernate\",\n    \"start_line\": 116,\n    \"end_line\": 116\n  },\n  {\n    \"id\": 4,\n    \"description\": \"Commit the transaction and close the session.\",\n    \"code\": \"\\t\\tt.commit(); //f:hibernate\\n\\t\\tsess.close(); //f:hibernate\",\n    \"start_line\": 118,\n    \"end_line\": 119\n  },\n  {\n    \"id\": 5,\n    \"description\": \"Set the task mode and add a success message.\",\n    \"code\": \"\\t\\tthis.task = SystemConstants.UD_MODE;\\n\\t\\tthis.addActionMessage( this.getText( \\\"saveSuccessful\\\", new String[]{\\\"product\\\"})  );\",\n    \"start_line\": 121,\n    \"end_line\": 122\n  },\n  {\n    \"id\": 6,\n    \"description\": \"Log the completion of the save operation and return INPUT.\",\n    \"code\": \"\\t\\tlogger.info( \\\"Finishing save()\\\" ); //f:log\\n\\t\\treturn INPUT;\",\n    \"start_line\": 124,\n    \"end_line\": 125\n  }\n]\n```"
  },
  {
    "class_name": "classes.ProductAction",
    "function_name": "update()",
    "analysis": "### Step 1: Summarise the Focal Method\n\nThe `update()` method in the `classes.ProductAction` class is responsible for updating a product in the database using Hibernate. It starts by logging the beginning of the update process, then opens a Hibernate session and begins a transaction. The method updates the product entity in the session, commits the transaction, and closes the session. After the database operations, it sets a task mode, adds an action message indicating a successful update, logs the completion of the update process, and finally returns an input string.\n\n### Step 2: List Necessary Environment Settings to Run the Focal Method\n\n- **Invoked Parameters and Fields:**\n  - `this.product`: The product entity that needs to be updated.\n  - `this.task`: A field that is set to `SystemConstants.UD_MODE` after the update.\n  \n- **Invoked Methods:**\n  - `HibernateUtil.getSessionFactory()`: Retrieves the Hibernate session factory.\n  - `sess.update(this.product)`: Updates the product in the session.\n  - `t.commit()`: Commits the transaction.\n  - `sess.close()`: Closes the session.\n  - `this.addActionMessage(String)`: Adds a message to the action.\n  - `this.getText(String, String[])`: Retrieves a localized text message.\n  - `logger.info(String)`: Logs informational messages.\n\n### Step 3: Decompose the Focal Method into Multiple Problem-Solving Steps",
    "slices": [
      {
        "id": 1,
        "description": "Log the start of the update process.",
        "code": "\t\tlogger.info( \"Starting update()\" ); //f:log",
        "start_line": 129,
        "end_line": 129
      },
      {
        "id": 2,
        "description": "Initialize Hibernate session and transaction for updating the product.",
        "code": "\t\tSession sess = HibernateUtil.getSessionFactory().openSession(); //f:hibernate\n\t\tTransaction t = sess.beginTransaction(); //f:hibernate",
        "start_line": 130,
        "end_line": 131
      },
      {
        "id": 3,
        "description": "Update the product entity in the session.",
        "code": "\t\tsess.update( this.product ); //f:hibernate",
        "start_line": 133,
        "end_line": 133
      },
      {
        "id": 4,
        "description": "Commit the transaction and close the session.",
        "code": "\t\tt.commit(); //f:hibernate\n\t\tsess.close(); //f:hibernate",
        "start_line": 135,
        "end_line": 136
      },
      {
        "id": 5,
        "description": "Set task mode and add a success message.",
        "code": "\t\tthis.task = SystemConstants.UD_MODE;\n\t\tthis.addActionMessage( this.getText( \"updateSuccessful\", new String[]{\"product\"})  );",
        "start_line": 138,
        "end_line": 139
      },
      {
        "id": 6,
        "description": "Log the completion of the update process and return INPUT.",
        "code": "\t\tlogger.info( \"Finishing update()\" ); //f:log\n\t\treturn INPUT;",
        "start_line": 141,
        "end_line": 142
      }
    ],
    "full_response": "### Step 1: Summarise the Focal Method\n\nThe `update()` method in the `classes.ProductAction` class is responsible for updating a product in the database using Hibernate. It starts by logging the beginning of the update process, then opens a Hibernate session and begins a transaction. The method updates the product entity in the session, commits the transaction, and closes the session. After the database operations, it sets a task mode, adds an action message indicating a successful update, logs the completion of the update process, and finally returns an input string.\n\n### Step 2: List Necessary Environment Settings to Run the Focal Method\n\n- **Invoked Parameters and Fields:**\n  - `this.product`: The product entity that needs to be updated.\n  - `this.task`: A field that is set to `SystemConstants.UD_MODE` after the update.\n  \n- **Invoked Methods:**\n  - `HibernateUtil.getSessionFactory()`: Retrieves the Hibernate session factory.\n  - `sess.update(this.product)`: Updates the product in the session.\n  - `t.commit()`: Commits the transaction.\n  - `sess.close()`: Closes the session.\n  - `this.addActionMessage(String)`: Adds a message to the action.\n  - `this.getText(String, String[])`: Retrieves a localized text message.\n  - `logger.info(String)`: Logs informational messages.\n\n### Step 3: Decompose the Focal Method into Multiple Problem-Solving Steps\n\n```json\n[\n  {\n    \"id\": 1,\n    \"description\": \"Log the start of the update process.\",\n    \"code\": \"\\t\\tlogger.info( \\\"Starting update()\\\" ); //f:log\",\n    \"start_line\": 129,\n    \"end_line\": 129\n  },\n  {\n    \"id\": 2,\n    \"description\": \"Initialize Hibernate session and transaction for updating the product.\",\n    \"code\": \"\\t\\tSession sess = HibernateUtil.getSessionFactory().openSession(); //f:hibernate\\n\\t\\tTransaction t = sess.beginTransaction(); //f:hibernate\",\n    \"start_line\": 130,\n    \"end_line\": 131\n  },\n  {\n    \"id\": 3,\n    \"description\": \"Update the product entity in the session.\",\n    \"code\": \"\\t\\tsess.update( this.product ); //f:hibernate\",\n    \"start_line\": 133,\n    \"end_line\": 133\n  },\n  {\n    \"id\": 4,\n    \"description\": \"Commit the transaction and close the session.\",\n    \"code\": \"\\t\\tt.commit(); //f:hibernate\\n\\t\\tsess.close(); //f:hibernate\",\n    \"start_line\": 135,\n    \"end_line\": 136\n  },\n  {\n    \"id\": 5,\n    \"description\": \"Set task mode and add a success message.\",\n    \"code\": \"\\t\\tthis.task = SystemConstants.UD_MODE;\\n\\t\\tthis.addActionMessage( this.getText( \\\"updateSuccessful\\\", new String[]{\\\"product\\\"})  );\",\n    \"start_line\": 138,\n    \"end_line\": 139\n  },\n  {\n    \"id\": 6,\n    \"description\": \"Log the completion of the update process and return INPUT.\",\n    \"code\": \"\\t\\tlogger.info( \\\"Finishing update()\\\" ); //f:log\\n\\t\\treturn INPUT;\",\n    \"start_line\": 141,\n    \"end_line\": 142\n  }\n]\n```"
  },
  {
    "class_name": "classes.ProductAction",
    "function_name": "delete()",
    "analysis": "### Step 1: Summarize the Focal Method\n\nThe `delete()` method in the `classes.ProductAction` class is responsible for deleting a product from the database using Hibernate. It starts by logging the beginning of the operation, opens a Hibernate session, and begins a transaction. It then deletes the product object from the session, commits the transaction, and closes the session. After the database operation, it sets a task constant, adds a success message, logs the completion of the operation, and returns an input view.\n\n### Step 2: List Necessary Environment Settings to Run the Focal Method\n\n- **Invoked Parameters and Fields:**\n  - `this.product`: The product object to be deleted.\n  - `this.task`: A field updated to indicate the current mode.\n  \n- **Invoked Methods:**\n  - `HibernateUtil.getSessionFactory()`: Retrieves the Hibernate `SessionFactory`.\n  - `this.addActionMessage(String)`: Adds a message to the action context.\n  - `this.getText(String, String[])`: Retrieves a localized text message.\n  - `this.input()`: Returns the input view.\n\n### Step 3: Decompose the Focal Method into Multiple Problem-Solving Steps",
    "slices": [
      {
        "id": 1,
        "description": "Log the start of the delete operation.",
        "code": "\t\tlogger.info( \"Starting delete()\" ); //f:log",
        "start_line": 146,
        "end_line": 146
      },
      {
        "id": 2,
        "description": "Open a Hibernate session and begin a transaction.",
        "code": "\t\tSession sess = HibernateUtil.getSessionFactory().openSession(); //f:hibernate\n\t\tTransaction t = sess.beginTransaction(); //f:hibernate",
        "start_line": 147,
        "end_line": 148
      },
      {
        "id": 3,
        "description": "Delete the product from the session.",
        "code": "\t\tsess.delete( this.product ); //f:hibernate",
        "start_line": 150,
        "end_line": 150
      },
      {
        "id": 4,
        "description": "Commit the transaction and close the session.",
        "code": "\t\tt.commit(); //f:hibernate\n\t\tsess.close(); //f:hibernate",
        "start_line": 152,
        "end_line": 153
      },
      {
        "id": 5,
        "description": "Set the task mode and add a success message.",
        "code": "\t\tthis.task = SystemConstants.CR_MODE;\n\t\tthis.addActionMessage( this.getText( \"deleteSuccessful\", new String[]{\"product\"})  );",
        "start_line": 155,
        "end_line": 156
      },
      {
        "id": 6,
        "description": "Log the completion of the delete operation and return the input view.",
        "code": "\t\tlogger.info( \"Finishing delete()\" ); //f:log\n\t\treturn this.input();",
        "start_line": 158,
        "end_line": 159
      }
    ],
    "full_response": "### Step 1: Summarize the Focal Method\n\nThe `delete()` method in the `classes.ProductAction` class is responsible for deleting a product from the database using Hibernate. It starts by logging the beginning of the operation, opens a Hibernate session, and begins a transaction. It then deletes the product object from the session, commits the transaction, and closes the session. After the database operation, it sets a task constant, adds a success message, logs the completion of the operation, and returns an input view.\n\n### Step 2: List Necessary Environment Settings to Run the Focal Method\n\n- **Invoked Parameters and Fields:**\n  - `this.product`: The product object to be deleted.\n  - `this.task`: A field updated to indicate the current mode.\n  \n- **Invoked Methods:**\n  - `HibernateUtil.getSessionFactory()`: Retrieves the Hibernate `SessionFactory`.\n  - `this.addActionMessage(String)`: Adds a message to the action context.\n  - `this.getText(String, String[])`: Retrieves a localized text message.\n  - `this.input()`: Returns the input view.\n\n### Step 3: Decompose the Focal Method into Multiple Problem-Solving Steps\n\n```json\n[\n  {\n    \"id\": 1,\n    \"description\": \"Log the start of the delete operation.\",\n    \"code\": \"\\t\\tlogger.info( \\\"Starting delete()\\\" ); //f:log\",\n    \"start_line\": 146,\n    \"end_line\": 146\n  },\n  {\n    \"id\": 2,\n    \"description\": \"Open a Hibernate session and begin a transaction.\",\n    \"code\": \"\\t\\tSession sess = HibernateUtil.getSessionFactory().openSession(); //f:hibernate\\n\\t\\tTransaction t = sess.beginTransaction(); //f:hibernate\",\n    \"start_line\": 147,\n    \"end_line\": 148\n  },\n  {\n    \"id\": 3,\n    \"description\": \"Delete the product from the session.\",\n    \"code\": \"\\t\\tsess.delete( this.product ); //f:hibernate\",\n    \"start_line\": 150,\n    \"end_line\": 150\n  },\n  {\n    \"id\": 4,\n    \"description\": \"Commit the transaction and close the session.\",\n    \"code\": \"\\t\\tt.commit(); //f:hibernate\\n\\t\\tsess.close(); //f:hibernate\",\n    \"start_line\": 152,\n    \"end_line\": 153\n  },\n  {\n    \"id\": 5,\n    \"description\": \"Set the task mode and add a success message.\",\n    \"code\": \"\\t\\tthis.task = SystemConstants.CR_MODE;\\n\\t\\tthis.addActionMessage( this.getText( \\\"deleteSuccessful\\\", new String[]{\\\"product\\\"})  );\",\n    \"start_line\": 155,\n    \"end_line\": 156\n  },\n  {\n    \"id\": 6,\n    \"description\": \"Log the completion of the delete operation and return the input view.\",\n    \"code\": \"\\t\\tlogger.info( \\\"Finishing delete()\\\" ); //f:log\\n\\t\\treturn this.input();\",\n    \"start_line\": 158,\n    \"end_line\": 159\n  }\n]\n```"
  },
  {
    "class_name": "classes.ProductAction",
    "function_name": "edit()",
    "analysis": "### Step 1: Summarize the Focal Method\n\nThe `edit()` method in the `classes.ProductAction` class is responsible for editing a product identified by its ID. It begins by logging the start of the operation, retrieves the product ID from the request parameters, and then interacts with a Hibernate session to fetch the product from the database. After the transaction is committed and the session is closed, the product is set in the current context, and a task mode is updated. Finally, the method logs the completion of the operation and returns an input constant.\n\n### Step 2: List Necessary Environment Settings to Run the Focal Method\n\n- **Invoked Parameters and Fields:**\n  - `this.parameters`: A map-like structure that holds request parameters, from which the product ID is retrieved.\n  - `this.task`: A field that is set to `SystemConstants.UD_MODE` during the method execution.\n  - `this.setProduct(Product p)`: A method that sets the retrieved product in the current context.\n\n- **Invoked Methods:**\n  - `HibernateUtil.getSessionFactory()`: A static method that returns a Hibernate `SessionFactory`.\n  - `sess.get(Product.class, id)`: A Hibernate session method to retrieve a product by its ID.\n  - `t.commit()`: A method to commit the transaction.\n  - `sess.close()`: A method to close the Hibernate session.\n\n### Step 3: Decompose the Focal Method into Multiple Problem-Solving Steps",
    "slices": [
      {
        "id": 1,
        "description": "Log the start of the edit operation and retrieve the product ID from request parameters.",
        "code": "\t\tlogger.info( \"Starting edit()\" ); //f:log\n\t\tInteger id = Integer.valueOf( this.parameters.get( \"id\" )[0] );",
        "start_line": 163,
        "end_line": 164
      },
      {
        "id": 2,
        "description": "Open a Hibernate session and begin a transaction.",
        "code": "\t\tSession sess = HibernateUtil.getSessionFactory().openSession(); //f:hibernate\n\t\tTransaction t = sess.beginTransaction(); //f:hibernate",
        "start_line": 166,
        "end_line": 167
      },
      {
        "id": 3,
        "description": "Retrieve the product from the database using the session and product ID.",
        "code": "\t\tProduct p = (Product) sess.get( Product.class, id ); //f:hibernate",
        "start_line": 169,
        "end_line": 169
      },
      {
        "id": 4,
        "description": "Commit the transaction and close the Hibernate session.",
        "code": "\t\tt.commit(); //f:hibernate\n\t\tsess.close(); //f:hibernate",
        "start_line": 171,
        "end_line": 172
      },
      {
        "id": 5,
        "description": "Set the retrieved product in the current context and update the task mode.",
        "code": "\t\tthis.setProduct( p );\n\n\t\tthis.task = SystemConstants.UD_MODE;",
        "start_line": 174,
        "end_line": 177
      },
      {
        "id": 6,
        "description": "Log the completion of the edit operation and return the input constant.",
        "code": "\t\tlogger.info( \"Finishing edit()\" ); //f:log\n\t\treturn INPUT;",
        "start_line": 178,
        "end_line": 179
      }
    ],
    "full_response": "### Step 1: Summarize the Focal Method\n\nThe `edit()` method in the `classes.ProductAction` class is responsible for editing a product identified by its ID. It begins by logging the start of the operation, retrieves the product ID from the request parameters, and then interacts with a Hibernate session to fetch the product from the database. After the transaction is committed and the session is closed, the product is set in the current context, and a task mode is updated. Finally, the method logs the completion of the operation and returns an input constant.\n\n### Step 2: List Necessary Environment Settings to Run the Focal Method\n\n- **Invoked Parameters and Fields:**\n  - `this.parameters`: A map-like structure that holds request parameters, from which the product ID is retrieved.\n  - `this.task`: A field that is set to `SystemConstants.UD_MODE` during the method execution.\n  - `this.setProduct(Product p)`: A method that sets the retrieved product in the current context.\n\n- **Invoked Methods:**\n  - `HibernateUtil.getSessionFactory()`: A static method that returns a Hibernate `SessionFactory`.\n  - `sess.get(Product.class, id)`: A Hibernate session method to retrieve a product by its ID.\n  - `t.commit()`: A method to commit the transaction.\n  - `sess.close()`: A method to close the Hibernate session.\n\n### Step 3: Decompose the Focal Method into Multiple Problem-Solving Steps\n\n```json\n[\n  {\n    \"id\": 1,\n    \"description\": \"Log the start of the edit operation and retrieve the product ID from request parameters.\",\n    \"code\": \"\\t\\tlogger.info( \\\"Starting edit()\\\" ); //f:log\\n\\t\\tInteger id = Integer.valueOf( this.parameters.get( \\\"id\\\" )[0] );\",\n    \"start_line\": 163,\n    \"end_line\": 164\n  },\n  {\n    \"id\": 2,\n    \"description\": \"Open a Hibernate session and begin a transaction.\",\n    \"code\": \"\\t\\tSession sess = HibernateUtil.getSessionFactory().openSession(); //f:hibernate\\n\\t\\tTransaction t = sess.beginTransaction(); //f:hibernate\",\n    \"start_line\": 166,\n    \"end_line\": 167\n  },\n  {\n    \"id\": 3,\n    \"description\": \"Retrieve the product from the database using the session and product ID.\",\n    \"code\": \"\\t\\tProduct p = (Product) sess.get( Product.class, id ); //f:hibernate\",\n    \"start_line\": 169,\n    \"end_line\": 169\n  },\n  {\n    \"id\": 4,\n    \"description\": \"Commit the transaction and close the Hibernate session.\",\n    \"code\": \"\\t\\tt.commit(); //f:hibernate\\n\\t\\tsess.close(); //f:hibernate\",\n    \"start_line\": 171,\n    \"end_line\": 172\n  },\n  {\n    \"id\": 5,\n    \"description\": \"Set the retrieved product in the current context and update the task mode.\",\n    \"code\": \"\\t\\tthis.setProduct( p );\\n\\n\\t\\tthis.task = SystemConstants.UD_MODE;\",\n    \"start_line\": 174,\n    \"end_line\": 177\n  },\n  {\n    \"id\": 6,\n    \"description\": \"Log the completion of the edit operation and return the input constant.\",\n    \"code\": \"\\t\\tlogger.info( \\\"Finishing edit()\\\" ); //f:log\\n\\t\\treturn INPUT;\",\n    \"start_line\": 178,\n    \"end_line\": 179\n  }\n]\n```"
  },
  {
    "class_name": "classes.PurchaseOrderAction",
    "function_name": "input()",
    "analysis": "### Step 1: Summarize the Focal Method\n\nThe `input()` method in the `classes.PurchaseOrderAction` class is responsible for initializing the state of a purchase order process. It sets the task mode, resets the purchase order object, and retrieves lists of customers and products from a database using Hibernate. These lists are then stored in the session context for later use. The method logs its start and finish and returns an `INPUT` constant to indicate successful preparation.\n\n### Step 2: List Necessary Environment Settings to Run the Focal Method\n\n- **Invoked Parameters and Fields:**\n  - `this.task`: A field in the class, set to `SystemConstants.CR_MODE`.\n  - `this.purchaseOrder`: A field in the class, set to `null`.\n\n- **Invoked Methods:**\n  - `HibernateUtil.getSessionFactory()`: Used to obtain the Hibernate `SessionFactory`.\n  - `sess.createCriteria(Customer.class)`: Used to create a criteria query for `Customer`.\n  - `sess.createCriteria(Product.class)`: Used to create a criteria query for `Product`.\n  - `ActionContext.getContext().getSession().put(String, Object)`: Used to store lists in the session.\n\n- **Dependent Method Bodies:**\n  - `classes.HibernateUtil.getSessionFactory()`: Returns the static `sessionFactory`.\n\n### Step 3: Decompose the Focal Method into Multiple Problem-Solving Steps",
    "slices": [
      {
        "id": 1,
        "description": "Initialize task mode and reset purchase order state.",
        "code": "\t\tlogger.info( \"Starting input()\" ); //f:log\n\t\tthis.task = SystemConstants.CR_MODE;\n\t\tthis.purchaseOrder = null;",
        "start_line": 83,
        "end_line": 86
      },
      {
        "id": 2,
        "description": "Open a Hibernate session and begin a transaction.",
        "code": "\t\tSession sess = HibernateUtil.getSessionFactory().openSession(); //f:hibernate\n\t\tTransaction t = sess.beginTransaction(); //f:hibernate",
        "start_line": 88,
        "end_line": 89
      },
      {
        "id": 3,
        "description": "Retrieve and store the list of customers in the session.",
        "code": "\t\tCriteria criteria = sess.createCriteria( Customer.class ); //f:hibernate\n\t\t@SuppressWarnings(\"unchecked\")\n\t\tList<Customer> lc = (List<Customer>) criteria.list(); //f:hibernate\n\t\tActionContext.getContext().getSession().put( \"listCustomer\", lc );",
        "start_line": 91,
        "end_line": 94
      },
      {
        "id": 4,
        "description": "Retrieve and store the list of products in the session.",
        "code": "\t\tcriteria = sess.createCriteria( Product.class ); //f:hibernate\n\t\t@SuppressWarnings(\"unchecked\")\n\t\tList<Product> lp = (List<Product>) criteria.list(); //f:hibernate\n\t\tActionContext.getContext().getSession().put( \"listProduct\", lp );",
        "start_line": 96,
        "end_line": 103
      },
      {
        "id": 5,
        "description": "Commit the transaction and close the Hibernate session.",
        "code": "\t\tt.commit(); //f:hibernate\n\t\tsess.close(); //f:hibernate",
        "start_line": 100,
        "end_line": 101
      },
      {
        "id": 6,
        "description": "Log the completion of the method and return the INPUT constant.",
        "code": "\t\tlogger.info( \"Finishing input()\" ); //f:log\n\t\treturn INPUT;",
        "start_line": 105,
        "end_line": 106
      }
    ],
    "full_response": "### Step 1: Summarize the Focal Method\n\nThe `input()` method in the `classes.PurchaseOrderAction` class is responsible for initializing the state of a purchase order process. It sets the task mode, resets the purchase order object, and retrieves lists of customers and products from a database using Hibernate. These lists are then stored in the session context for later use. The method logs its start and finish and returns an `INPUT` constant to indicate successful preparation.\n\n### Step 2: List Necessary Environment Settings to Run the Focal Method\n\n- **Invoked Parameters and Fields:**\n  - `this.task`: A field in the class, set to `SystemConstants.CR_MODE`.\n  - `this.purchaseOrder`: A field in the class, set to `null`.\n\n- **Invoked Methods:**\n  - `HibernateUtil.getSessionFactory()`: Used to obtain the Hibernate `SessionFactory`.\n  - `sess.createCriteria(Customer.class)`: Used to create a criteria query for `Customer`.\n  - `sess.createCriteria(Product.class)`: Used to create a criteria query for `Product`.\n  - `ActionContext.getContext().getSession().put(String, Object)`: Used to store lists in the session.\n\n- **Dependent Method Bodies:**\n  - `classes.HibernateUtil.getSessionFactory()`: Returns the static `sessionFactory`.\n\n### Step 3: Decompose the Focal Method into Multiple Problem-Solving Steps\n\n```json\n[\n  {\n    \"id\": 1,\n    \"description\": \"Initialize task mode and reset purchase order state.\",\n    \"code\": \"\\t\\tlogger.info( \\\"Starting input()\\\" ); //f:log\\n\\t\\tthis.task = SystemConstants.CR_MODE;\\n\\t\\tthis.purchaseOrder = null;\",\n    \"start_line\": 83,\n    \"end_line\": 86\n  },\n  {\n    \"id\": 2,\n    \"description\": \"Open a Hibernate session and begin a transaction.\",\n    \"code\": \"\\t\\tSession sess = HibernateUtil.getSessionFactory().openSession(); //f:hibernate\\n\\t\\tTransaction t = sess.beginTransaction(); //f:hibernate\",\n    \"start_line\": 88,\n    \"end_line\": 89\n  },\n  {\n    \"id\": 3,\n    \"description\": \"Retrieve and store the list of customers in the session.\",\n    \"code\": \"\\t\\tCriteria criteria = sess.createCriteria( Customer.class ); //f:hibernate\\n\\t\\t@SuppressWarnings(\\\"unchecked\\\")\\n\\t\\tList<Customer> lc = (List<Customer>) criteria.list(); //f:hibernate\\n\\t\\tActionContext.getContext().getSession().put( \\\"listCustomer\\\", lc );\",\n    \"start_line\": 91,\n    \"end_line\": 94\n  },\n  {\n    \"id\": 4,\n    \"description\": \"Retrieve and store the list of products in the session.\",\n    \"code\": \"\\t\\tcriteria = sess.createCriteria( Product.class ); //f:hibernate\\n\\t\\t@SuppressWarnings(\\\"unchecked\\\")\\n\\t\\tList<Product> lp = (List<Product>) criteria.list(); //f:hibernate\\n\\t\\tActionContext.getContext().getSession().put( \\\"listProduct\\\", lp );\",\n    \"start_line\": 96,\n    \"end_line\": 103\n  },\n  {\n    \"id\": 5,\n    \"description\": \"Commit the transaction and close the Hibernate session.\",\n    \"code\": \"\\t\\tt.commit(); //f:hibernate\\n\\t\\tsess.close(); //f:hibernate\",\n    \"start_line\": 100,\n    \"end_line\": 101\n  },\n  {\n    \"id\": 6,\n    \"description\": \"Log the completion of the method and return the INPUT constant.\",\n    \"code\": \"\\t\\tlogger.info( \\\"Finishing input()\\\" ); //f:log\\n\\t\\treturn INPUT;\",\n    \"start_line\": 105,\n    \"end_line\": 106\n  }\n]\n```"
  },
  {
    "class_name": "classes.PurchaseOrderAction",
    "function_name": "find()",
    "analysis": "## Step 1: Summary of the Focal Method\n\nThe `find()` method in the `PurchaseOrderAction` class is responsible for retrieving a list of `PurchaseOrder` objects from the database based on certain criteria. It uses Hibernate for database operations. The method begins by logging the start of the operation, then opens a Hibernate session and begins a transaction. It constructs a `Criteria` object to query `PurchaseOrder` entities, applying filters based on the properties of the `purchaseOrder` instance. If specific IDs for the purchase order or its customer are provided, additional restrictions are added to the criteria. The method executes the query, commits the transaction, and closes the session. The resulting list of purchase orders is then stored in a request map, and the method concludes by logging its completion and returning a constant `INPUT`.\n\n## Step 2: Necessary Environment Settings\n\n### Invoked Parameters and Fields\n- `this.purchaseOrder`: An instance of `PurchaseOrder` used to define search criteria.\n- `this.purchaseOrder.getId()`: Retrieves the ID of the `PurchaseOrder`.\n- `this.purchaseOrder.getCustomer()`: Retrieves the `Customer` associated with the `PurchaseOrder`.\n- `this.purchaseOrder.getCustomer().getId()`: Retrieves the ID of the `Customer`.\n- `request`: A map-like object used to store the result list.\n\n### Invoked Methods\n- `HibernateUtil.getSessionFactory()`: Returns the Hibernate `SessionFactory`.\n- `sess.openSession()`: Opens a new Hibernate session.\n- `sess.beginTransaction()`: Begins a new transaction.\n- `sess.createCriteria(PurchaseOrder.class)`: Creates a criteria query for `PurchaseOrder`.\n- `criteria.add(...)`: Adds restrictions to the criteria.\n- `criteria.setResultTransformer(Criteria.DISTINCT_ROOT_ENTITY)`: Ensures distinct results.\n- `criteria.list()`: Executes the query and returns the result list.\n- `t.commit()`: Commits the transaction.\n- `sess.close()`: Closes the session.\n\n## Step 3: Decomposition of the Focal Method",
    "slices": [
      {
        "id": 1,
        "description": "Initialize logging and open a Hibernate session with a transaction.",
        "code": "\t\tlogger.info( \"Starting find()\" ); //f:log\n\t\tSession sess = HibernateUtil.getSessionFactory().openSession(); //f:hibernate\n\t\tTransaction t = sess.beginTransaction(); //f:hibernate",
        "start_line": 110,
        "end_line": 112
      },
      {
        "id": 2,
        "description": "Create a criteria query for PurchaseOrder and apply basic filtering using the Example API.",
        "code": "\t\tCriteria criteria = sess.createCriteria( PurchaseOrder.class ); //f:hibernate\n\n\t\tcriteria.add( Example.create( this.purchaseOrder ).excludeZeroes().ignoreCase().enableLike( MatchMode.ANYWHERE ) ); //f:hibernate",
        "start_line": 114,
        "end_line": 116
      },
      {
        "id": 3,
        "description": "Add restrictions to the criteria based on the purchase order ID if it is not null.",
        "code": "\t\tif ( this.purchaseOrder.getId() != null ) { //f:hibernate\n\t\t\tcriteria.add( Restrictions.idEq( this.purchaseOrder.getId() ) ); //f:hibernate\n\t\t} //f:hibernate",
        "start_line": 117,
        "end_line": 119
      },
      {
        "id": 4,
        "description": "Add restrictions to the criteria based on the customer's ID if it is not null.",
        "code": "\t\tif ( this.purchaseOrder.getCustomer().getId() != null ) { //f:hibernate\n\t\t\tcriteria.add( Restrictions.eq( \"customer\", this.purchaseOrder.getCustomer() ) ); //f:hibernate\n\t\t} //f:hibernate",
        "start_line": 121,
        "end_line": 123
      },
      {
        "id": 5,
        "description": "Execute the criteria query to retrieve the list of purchase orders, commit the transaction, and close the session.",
        "code": "\t\tcriteria.setResultTransformer( Criteria.DISTINCT_ROOT_ENTITY ); //f:hibernate\n\t\t@SuppressWarnings(\"unchecked\")\n\t\tList<PurchaseOrder> l = (List<PurchaseOrder>) criteria.list(); //f:hibernate\n\t\tt.commit(); //f:hibernate\n\t\tsess.close(); //f:hibernate",
        "start_line": 125,
        "end_line": 129
      },
      {
        "id": 6,
        "description": "Store the result list in the request map and finalize the method with logging and return statement.",
        "code": "\t\trequest.put( \"list\", l );\n\n\t\tthis.task = SystemConstants.CR_MODE;\n\t\tlogger.info( \"Finishing input()\" ); //f:log\n\t\treturn INPUT;",
        "start_line": 130,
        "end_line": 134
      }
    ],
    "full_response": "## Step 1: Summary of the Focal Method\n\nThe `find()` method in the `PurchaseOrderAction` class is responsible for retrieving a list of `PurchaseOrder` objects from the database based on certain criteria. It uses Hibernate for database operations. The method begins by logging the start of the operation, then opens a Hibernate session and begins a transaction. It constructs a `Criteria` object to query `PurchaseOrder` entities, applying filters based on the properties of the `purchaseOrder` instance. If specific IDs for the purchase order or its customer are provided, additional restrictions are added to the criteria. The method executes the query, commits the transaction, and closes the session. The resulting list of purchase orders is then stored in a request map, and the method concludes by logging its completion and returning a constant `INPUT`.\n\n## Step 2: Necessary Environment Settings\n\n### Invoked Parameters and Fields\n- `this.purchaseOrder`: An instance of `PurchaseOrder` used to define search criteria.\n- `this.purchaseOrder.getId()`: Retrieves the ID of the `PurchaseOrder`.\n- `this.purchaseOrder.getCustomer()`: Retrieves the `Customer` associated with the `PurchaseOrder`.\n- `this.purchaseOrder.getCustomer().getId()`: Retrieves the ID of the `Customer`.\n- `request`: A map-like object used to store the result list.\n\n### Invoked Methods\n- `HibernateUtil.getSessionFactory()`: Returns the Hibernate `SessionFactory`.\n- `sess.openSession()`: Opens a new Hibernate session.\n- `sess.beginTransaction()`: Begins a new transaction.\n- `sess.createCriteria(PurchaseOrder.class)`: Creates a criteria query for `PurchaseOrder`.\n- `criteria.add(...)`: Adds restrictions to the criteria.\n- `criteria.setResultTransformer(Criteria.DISTINCT_ROOT_ENTITY)`: Ensures distinct results.\n- `criteria.list()`: Executes the query and returns the result list.\n- `t.commit()`: Commits the transaction.\n- `sess.close()`: Closes the session.\n\n## Step 3: Decomposition of the Focal Method\n\n```json\n[\n  {\n    \"id\": 1,\n    \"description\": \"Initialize logging and open a Hibernate session with a transaction.\",\n    \"code\": \"\\t\\tlogger.info( \\\"Starting find()\\\" ); //f:log\\n\\t\\tSession sess = HibernateUtil.getSessionFactory().openSession(); //f:hibernate\\n\\t\\tTransaction t = sess.beginTransaction(); //f:hibernate\",\n    \"start_line\": 110,\n    \"end_line\": 112\n  },\n  {\n    \"id\": 2,\n    \"description\": \"Create a criteria query for PurchaseOrder and apply basic filtering using the Example API.\",\n    \"code\": \"\\t\\tCriteria criteria = sess.createCriteria( PurchaseOrder.class ); //f:hibernate\\n\\n\\t\\tcriteria.add( Example.create( this.purchaseOrder ).excludeZeroes().ignoreCase().enableLike( MatchMode.ANYWHERE ) ); //f:hibernate\",\n    \"start_line\": 114,\n    \"end_line\": 116\n  },\n  {\n    \"id\": 3,\n    \"description\": \"Add restrictions to the criteria based on the purchase order ID if it is not null.\",\n    \"code\": \"\\t\\tif ( this.purchaseOrder.getId() != null ) { //f:hibernate\\n\\t\\t\\tcriteria.add( Restrictions.idEq( this.purchaseOrder.getId() ) ); //f:hibernate\\n\\t\\t} //f:hibernate\",\n    \"start_line\": 117,\n    \"end_line\": 119\n  },\n  {\n    \"id\": 4,\n    \"description\": \"Add restrictions to the criteria based on the customer's ID if it is not null.\",\n    \"code\": \"\\t\\tif ( this.purchaseOrder.getCustomer().getId() != null ) { //f:hibernate\\n\\t\\t\\tcriteria.add( Restrictions.eq( \\\"customer\\\", this.purchaseOrder.getCustomer() ) ); //f:hibernate\\n\\t\\t} //f:hibernate\",\n    \"start_line\": 121,\n    \"end_line\": 123\n  },\n  {\n    \"id\": 5,\n    \"description\": \"Execute the criteria query to retrieve the list of purchase orders, commit the transaction, and close the session.\",\n    \"code\": \"\\t\\tcriteria.setResultTransformer( Criteria.DISTINCT_ROOT_ENTITY ); //f:hibernate\\n\\t\\t@SuppressWarnings(\\\"unchecked\\\")\\n\\t\\tList<PurchaseOrder> l = (List<PurchaseOrder>) criteria.list(); //f:hibernate\\n\\t\\tt.commit(); //f:hibernate\\n\\t\\tsess.close(); //f:hibernate\",\n    \"start_line\": 125,\n    \"end_line\": 129\n  },\n  {\n    \"id\": 6,\n    \"description\": \"Store the result list in the request map and finalize the method with logging and return statement.\",\n    \"code\": \"\\t\\trequest.put( \\\"list\\\", l );\\n\\n\\t\\tthis.task = SystemConstants.CR_MODE;\\n\\t\\tlogger.info( \\\"Finishing input()\\\" ); //f:log\\n\\t\\treturn INPUT;\",\n    \"start_line\": 130,\n    \"end_line\": 134\n  }\n]\n```"
  },
  {
    "class_name": "classes.PurchaseOrderAction",
    "function_name": "save()",
    "analysis": "### Step 1: Summarize the Focal Method\n\nThe `save()` method in the `PurchaseOrderAction` class is responsible for persisting a `PurchaseOrder` object to a database using Hibernate. It begins by logging the start of the operation, then opens a Hibernate session and transaction. The method saves the `purchaseOrder` object, commits the transaction, and closes the session. Afterward, it sets the order date to the current date and associates each `PurchaseOrderItem` with the `purchaseOrder`. Finally, it updates the task state, adds a success message, logs the completion of the operation, and returns an input status.\n\n### Step 2: List Necessary Environment Settings to Run the Focal Method\n\n#### Invoked Parameters and Fields\n- `this.purchaseOrder`: An instance of `PurchaseOrder` that is being saved.\n- `this.task`: A field in the `PurchaseOrderAction` class that is updated to `SystemConstants.UD_MODE`.\n\n#### Invoked Methods\n- `HibernateUtil.getSessionFactory()`: Retrieves the Hibernate `SessionFactory`.\n- `sess.save(this.purchaseOrder)`: Saves the `purchaseOrder` object in the session.\n- `t.commit()`: Commits the current transaction.\n- `sess.close()`: Closes the Hibernate session.\n- `this.purchaseOrder.setOrderDate(new Date())`: Sets the order date of the `purchaseOrder`.\n- `this.purchaseOrder.getPurchaseOrderItems()`: Retrieves the collection of `PurchaseOrderItem` objects.\n- `item.setPurchaseOrder(this.purchaseOrder)`: Associates a `PurchaseOrderItem` with the `purchaseOrder`.\n- `this.addActionMessage(this.getText(\"saveSuccessful\", new String[] { \"order\" }))`: Adds a success message to the action.\n- `logger.info(...)`: Logs messages for tracking the method's execution.\n\n### Step 3: Decompose the Focal Method into Multiple Problem-Solving Steps",
    "slices": [
      {
        "id": 1,
        "description": "Log the start of the save operation and initialize Hibernate session and transaction.",
        "code": "\t\tlogger.info( \"Starting save()\" ); //f:log\n\t\tSession sess = HibernateUtil.getSessionFactory().openSession(); //f:hibernate\n\t\tTransaction t = sess.beginTransaction(); //f:hibernate",
        "start_line": 138,
        "end_line": 140
      },
      {
        "id": 2,
        "description": "Save the purchase order in the database, commit the transaction, and close the session.",
        "code": "\t\tsess.save( this.purchaseOrder ); //f:hibernate\n\n\t\tt.commit(); //f:hibernate\n\t\tsess.close(); //f:hibernate",
        "start_line": 142,
        "end_line": 145
      },
      {
        "id": 3,
        "description": "Set the order date of the purchase order to the current date.",
        "code": "\t\tthis.purchaseOrder.setOrderDate( new Date() );",
        "start_line": 147,
        "end_line": 147
      },
      {
        "id": 4,
        "description": "Associate each PurchaseOrderItem with the purchase order.",
        "code": "\t\tfor (PurchaseOrderItem item : this.purchaseOrder.getPurchaseOrderItems()) {  \n\t\t\titem.setPurchaseOrder( this.purchaseOrder );\n\t\t}",
        "start_line": 149,
        "end_line": 151
      },
      {
        "id": 5,
        "description": "Update the task state and add a success message.",
        "code": "\t\tthis.task = SystemConstants.UD_MODE;\n\t\tthis.addActionMessage( this.getText( \"saveSuccessful\", new String[] { \"order\" } ) );",
        "start_line": 153,
        "end_line": 154
      },
      {
        "id": 6,
        "description": "Log the completion of the save operation and return the input status.",
        "code": "\t\tlogger.info( \"Finishing save()\" ); //f:log\n\t\treturn INPUT;",
        "start_line": 156,
        "end_line": 157
      }
    ],
    "full_response": "### Step 1: Summarize the Focal Method\n\nThe `save()` method in the `PurchaseOrderAction` class is responsible for persisting a `PurchaseOrder` object to a database using Hibernate. It begins by logging the start of the operation, then opens a Hibernate session and transaction. The method saves the `purchaseOrder` object, commits the transaction, and closes the session. Afterward, it sets the order date to the current date and associates each `PurchaseOrderItem` with the `purchaseOrder`. Finally, it updates the task state, adds a success message, logs the completion of the operation, and returns an input status.\n\n### Step 2: List Necessary Environment Settings to Run the Focal Method\n\n#### Invoked Parameters and Fields\n- `this.purchaseOrder`: An instance of `PurchaseOrder` that is being saved.\n- `this.task`: A field in the `PurchaseOrderAction` class that is updated to `SystemConstants.UD_MODE`.\n\n#### Invoked Methods\n- `HibernateUtil.getSessionFactory()`: Retrieves the Hibernate `SessionFactory`.\n- `sess.save(this.purchaseOrder)`: Saves the `purchaseOrder` object in the session.\n- `t.commit()`: Commits the current transaction.\n- `sess.close()`: Closes the Hibernate session.\n- `this.purchaseOrder.setOrderDate(new Date())`: Sets the order date of the `purchaseOrder`.\n- `this.purchaseOrder.getPurchaseOrderItems()`: Retrieves the collection of `PurchaseOrderItem` objects.\n- `item.setPurchaseOrder(this.purchaseOrder)`: Associates a `PurchaseOrderItem` with the `purchaseOrder`.\n- `this.addActionMessage(this.getText(\"saveSuccessful\", new String[] { \"order\" }))`: Adds a success message to the action.\n- `logger.info(...)`: Logs messages for tracking the method's execution.\n\n### Step 3: Decompose the Focal Method into Multiple Problem-Solving Steps\n\n```json\n[\n  {\n    \"id\": 1,\n    \"description\": \"Log the start of the save operation and initialize Hibernate session and transaction.\",\n    \"code\": \"\\t\\tlogger.info( \\\"Starting save()\\\" ); //f:log\\n\\t\\tSession sess = HibernateUtil.getSessionFactory().openSession(); //f:hibernate\\n\\t\\tTransaction t = sess.beginTransaction(); //f:hibernate\",\n    \"start_line\": 138,\n    \"end_line\": 140\n  },\n  {\n    \"id\": 2,\n    \"description\": \"Save the purchase order in the database, commit the transaction, and close the session.\",\n    \"code\": \"\\t\\tsess.save( this.purchaseOrder ); //f:hibernate\\n\\n\\t\\tt.commit(); //f:hibernate\\n\\t\\tsess.close(); //f:hibernate\",\n    \"start_line\": 142,\n    \"end_line\": 145\n  },\n  {\n    \"id\": 3,\n    \"description\": \"Set the order date of the purchase order to the current date.\",\n    \"code\": \"\\t\\tthis.purchaseOrder.setOrderDate( new Date() );\",\n    \"start_line\": 147,\n    \"end_line\": 147\n  },\n  {\n    \"id\": 4,\n    \"description\": \"Associate each PurchaseOrderItem with the purchase order.\",\n    \"code\": \"\\t\\tfor (PurchaseOrderItem item : this.purchaseOrder.getPurchaseOrderItems()) {  \\n\\t\\t\\titem.setPurchaseOrder( this.purchaseOrder );\\n\\t\\t}\",\n    \"start_line\": 149,\n    \"end_line\": 151\n  },\n  {\n    \"id\": 5,\n    \"description\": \"Update the task state and add a success message.\",\n    \"code\": \"\\t\\tthis.task = SystemConstants.UD_MODE;\\n\\t\\tthis.addActionMessage( this.getText( \\\"saveSuccessful\\\", new String[] { \\\"order\\\" } ) );\",\n    \"start_line\": 153,\n    \"end_line\": 154\n  },\n  {\n    \"id\": 6,\n    \"description\": \"Log the completion of the save operation and return the input status.\",\n    \"code\": \"\\t\\tlogger.info( \\\"Finishing save()\\\" ); //f:log\\n\\t\\treturn INPUT;\",\n    \"start_line\": 156,\n    \"end_line\": 157\n  }\n]\n```"
  },
  {
    "class_name": "classes.PurchaseOrderAction",
    "function_name": "update()",
    "analysis": "## Step 1: Summarize the Focal Method\n\nThe `update()` method in the `PurchaseOrderAction` class is responsible for updating a purchase order in the database. It begins by logging the start of the update process, then opens a Hibernate session and begins a transaction. The method updates the purchase order object in the database and commits the transaction, ensuring the session is closed afterward. It then iterates over the purchase order items to set their parent purchase order reference. Finally, it sets a task mode, adds a success message, logs the completion of the update process, and returns an input status.\n\n## Step 2: List Necessary Environment Settings to Run the Focal Method\n\n### Invoked Parameters and Fields\n- `this.purchaseOrder`: The purchase order object to be updated.\n- `this.task`: A field indicating the current task mode.\n- `SystemConstants.UD_MODE`: A constant representing the update mode.\n- `this`: The current instance of `PurchaseOrderAction`.\n\n### Invoked Methods\n- `HibernateUtil.getSessionFactory()`: Retrieves the Hibernate session factory.\n- `sess.openSession()`: Opens a new Hibernate session.\n- `sess.beginTransaction()`: Begins a new transaction.\n- `sess.update(this.purchaseOrder)`: Updates the purchase order in the database.\n- `t.commit()`: Commits the current transaction.\n- `sess.close()`: Closes the Hibernate session.\n- `this.purchaseOrder.getPurchaseOrderItems()`: Retrieves the collection of purchase order items.\n- `item.setPurchaseOrder(this.purchaseOrder)`: Sets the purchase order reference for each item.\n- `this.addActionMessage(this.getText(\"updateSuccessful\", new String[] { \"order\" }))`: Adds a success message.\n- `logger.info()`: Logs information messages.\n\n## Step 3: Decompose the Focal Method into Multiple Problem-Solving Steps",
    "slices": [
      {
        "id": 1,
        "description": "Log the start of the update process and initialize Hibernate session and transaction.",
        "code": "\t\tlogger.info( \"Starting update()\" ); //f:log\n\t\tSession sess = HibernateUtil.getSessionFactory().openSession(); //f:hibernate\n\t\tTransaction t = sess.beginTransaction(); //f:hibernate",
        "start_line": 161,
        "end_line": 163
      },
      {
        "id": 2,
        "description": "Update the purchase order in the database and commit the transaction, ensuring the session is closed.",
        "code": "\t\tsess.update( this.purchaseOrder ); //f:hibernate\n\n\t\tt.commit(); //f:hibernate\n\t\tsess.close(); //f:hibernate",
        "start_line": 164,
        "end_line": 167
      },
      {
        "id": 3,
        "description": "Set the purchase order reference for each purchase order item.",
        "code": "\t\tfor (PurchaseOrderItem item : this.purchaseOrder.getPurchaseOrderItems()){\n\t\t\titem.setPurchaseOrder( this.purchaseOrder );\n\t\t}",
        "start_line": 169,
        "end_line": 171
      },
      {
        "id": 4,
        "description": "Set the task mode to update and add a success message.",
        "code": "\t\tthis.task = SystemConstants.UD_MODE;\n\t\tthis.addActionMessage( this.getText( \"updateSuccessful\", new String[] { \"order\" } ) );",
        "start_line": 173,
        "end_line": 174
      },
      {
        "id": 5,
        "description": "Log the completion of the update process and return the input status.",
        "code": "\t\tlogger.info( \"Finishing update()\" ); //f:log\n\t\treturn INPUT;",
        "start_line": 176,
        "end_line": 177
      }
    ],
    "full_response": "## Step 1: Summarize the Focal Method\n\nThe `update()` method in the `PurchaseOrderAction` class is responsible for updating a purchase order in the database. It begins by logging the start of the update process, then opens a Hibernate session and begins a transaction. The method updates the purchase order object in the database and commits the transaction, ensuring the session is closed afterward. It then iterates over the purchase order items to set their parent purchase order reference. Finally, it sets a task mode, adds a success message, logs the completion of the update process, and returns an input status.\n\n## Step 2: List Necessary Environment Settings to Run the Focal Method\n\n### Invoked Parameters and Fields\n- `this.purchaseOrder`: The purchase order object to be updated.\n- `this.task`: A field indicating the current task mode.\n- `SystemConstants.UD_MODE`: A constant representing the update mode.\n- `this`: The current instance of `PurchaseOrderAction`.\n\n### Invoked Methods\n- `HibernateUtil.getSessionFactory()`: Retrieves the Hibernate session factory.\n- `sess.openSession()`: Opens a new Hibernate session.\n- `sess.beginTransaction()`: Begins a new transaction.\n- `sess.update(this.purchaseOrder)`: Updates the purchase order in the database.\n- `t.commit()`: Commits the current transaction.\n- `sess.close()`: Closes the Hibernate session.\n- `this.purchaseOrder.getPurchaseOrderItems()`: Retrieves the collection of purchase order items.\n- `item.setPurchaseOrder(this.purchaseOrder)`: Sets the purchase order reference for each item.\n- `this.addActionMessage(this.getText(\"updateSuccessful\", new String[] { \"order\" }))`: Adds a success message.\n- `logger.info()`: Logs information messages.\n\n## Step 3: Decompose the Focal Method into Multiple Problem-Solving Steps\n\n```json\n[\n  {\n    \"id\": 1,\n    \"description\": \"Log the start of the update process and initialize Hibernate session and transaction.\",\n    \"code\": \"\\t\\tlogger.info( \\\"Starting update()\\\" ); //f:log\\n\\t\\tSession sess = HibernateUtil.getSessionFactory().openSession(); //f:hibernate\\n\\t\\tTransaction t = sess.beginTransaction(); //f:hibernate\",\n    \"start_line\": 161,\n    \"end_line\": 163\n  },\n  {\n    \"id\": 2,\n    \"description\": \"Update the purchase order in the database and commit the transaction, ensuring the session is closed.\",\n    \"code\": \"\\t\\tsess.update( this.purchaseOrder ); //f:hibernate\\n\\n\\t\\tt.commit(); //f:hibernate\\n\\t\\tsess.close(); //f:hibernate\",\n    \"start_line\": 164,\n    \"end_line\": 167\n  },\n  {\n    \"id\": 3,\n    \"description\": \"Set the purchase order reference for each purchase order item.\",\n    \"code\": \"\\t\\tfor (PurchaseOrderItem item : this.purchaseOrder.getPurchaseOrderItems()){\\n\\t\\t\\titem.setPurchaseOrder( this.purchaseOrder );\\n\\t\\t}\",\n    \"start_line\": 169,\n    \"end_line\": 171\n  },\n  {\n    \"id\": 4,\n    \"description\": \"Set the task mode to update and add a success message.\",\n    \"code\": \"\\t\\tthis.task = SystemConstants.UD_MODE;\\n\\t\\tthis.addActionMessage( this.getText( \\\"updateSuccessful\\\", new String[] { \\\"order\\\" } ) );\",\n    \"start_line\": 173,\n    \"end_line\": 174\n  },\n  {\n    \"id\": 5,\n    \"description\": \"Log the completion of the update process and return the input status.\",\n    \"code\": \"\\t\\tlogger.info( \\\"Finishing update()\\\" ); //f:log\\n\\t\\treturn INPUT;\",\n    \"start_line\": 176,\n    \"end_line\": 177\n  }\n]\n```"
  },
  {
    "class_name": "classes.PurchaseOrderAction",
    "function_name": "delete()",
    "analysis": "### Step 1: Summarize the Focal Method\n\nThe `delete()` method in the `PurchaseOrderAction` class is responsible for deleting a purchase order from the database using Hibernate. It starts by logging the beginning of the operation, then opens a Hibernate session and begins a transaction. The method deletes the specified purchase order, commits the transaction, and closes the session. Afterward, it sets a task mode, adds a success message, logs the completion of the operation, and returns an input view.\n\n### Step 2: List Necessary Environment Settings to Run the Focal Method\n\n#### Invoked Parameters and Fields\n- `this.purchaseOrder`: The purchase order object that is to be deleted.\n- `this.task`: A field that is set to `SystemConstants.CR_MODE` after the deletion.\n- `this`: The current instance of `PurchaseOrderAction` which provides context for method invocations like `addActionMessage` and `getText`.\n\n#### Invoked Methods\n- `HibernateUtil.getSessionFactory()`: Provides the session factory to open a Hibernate session.\n- `sess.delete(this.purchaseOrder)`: Deletes the purchase order from the database.\n- `t.commit()`: Commits the transaction.\n- `sess.close()`: Closes the Hibernate session.\n- `this.addActionMessage(String)`: Adds a message to be displayed to the user.\n- `this.getText(String, String[])`: Retrieves a localized text message.\n- `this.input()`: Returns the input view after the operation.\n\n### Step 3: Decompose the Focal Method into Multiple Problem-Solving Steps",
    "slices": [
      {
        "id": 1,
        "description": "Initialize logging and Hibernate session for the delete operation.",
        "code": "\t\tlogger.info( \"Starting delete()\" ); //f:log\n\t\tSession sess = HibernateUtil.getSessionFactory().openSession(); //f:hibernate\n\t\tTransaction t = sess.beginTransaction(); //f:hibernate",
        "start_line": 181,
        "end_line": 183
      },
      {
        "id": 2,
        "description": "Delete the purchase order and manage the transaction lifecycle.",
        "code": "\t\tsess.delete( this.purchaseOrder ); //f:hibernate\n\n\t\tt.commit(); //f:hibernate\n\t\tsess.close(); //f:hibernate",
        "start_line": 185,
        "end_line": 188
      },
      {
        "id": 3,
        "description": "Set task mode, add success message, and finalize logging.",
        "code": "\t\tthis.task = SystemConstants.CR_MODE;\n\t\tthis.addActionMessage( this.getText( \"deleteSuccessful\", new String[] { \"order\" } ) );\n\t\tlogger.info( \"Finishing delete()\" ); //f:log",
        "start_line": 190,
        "end_line": 192
      },
      {
        "id": 4,
        "description": "Return the input view after completing the delete operation.",
        "code": "\t\treturn this.input();",
        "start_line": 193,
        "end_line": 193
      }
    ],
    "full_response": "### Step 1: Summarize the Focal Method\n\nThe `delete()` method in the `PurchaseOrderAction` class is responsible for deleting a purchase order from the database using Hibernate. It starts by logging the beginning of the operation, then opens a Hibernate session and begins a transaction. The method deletes the specified purchase order, commits the transaction, and closes the session. Afterward, it sets a task mode, adds a success message, logs the completion of the operation, and returns an input view.\n\n### Step 2: List Necessary Environment Settings to Run the Focal Method\n\n#### Invoked Parameters and Fields\n- `this.purchaseOrder`: The purchase order object that is to be deleted.\n- `this.task`: A field that is set to `SystemConstants.CR_MODE` after the deletion.\n- `this`: The current instance of `PurchaseOrderAction` which provides context for method invocations like `addActionMessage` and `getText`.\n\n#### Invoked Methods\n- `HibernateUtil.getSessionFactory()`: Provides the session factory to open a Hibernate session.\n- `sess.delete(this.purchaseOrder)`: Deletes the purchase order from the database.\n- `t.commit()`: Commits the transaction.\n- `sess.close()`: Closes the Hibernate session.\n- `this.addActionMessage(String)`: Adds a message to be displayed to the user.\n- `this.getText(String, String[])`: Retrieves a localized text message.\n- `this.input()`: Returns the input view after the operation.\n\n### Step 3: Decompose the Focal Method into Multiple Problem-Solving Steps\n\n```json\n[\n  {\n    \"id\": 1,\n    \"description\": \"Initialize logging and Hibernate session for the delete operation.\",\n    \"code\": \"\\t\\tlogger.info( \\\"Starting delete()\\\" ); //f:log\\n\\t\\tSession sess = HibernateUtil.getSessionFactory().openSession(); //f:hibernate\\n\\t\\tTransaction t = sess.beginTransaction(); //f:hibernate\",\n    \"start_line\": 181,\n    \"end_line\": 183\n  },\n  {\n    \"id\": 2,\n    \"description\": \"Delete the purchase order and manage the transaction lifecycle.\",\n    \"code\": \"\\t\\tsess.delete( this.purchaseOrder ); //f:hibernate\\n\\n\\t\\tt.commit(); //f:hibernate\\n\\t\\tsess.close(); //f:hibernate\",\n    \"start_line\": 185,\n    \"end_line\": 188\n  },\n  {\n    \"id\": 3,\n    \"description\": \"Set task mode, add success message, and finalize logging.\",\n    \"code\": \"\\t\\tthis.task = SystemConstants.CR_MODE;\\n\\t\\tthis.addActionMessage( this.getText( \\\"deleteSuccessful\\\", new String[] { \\\"order\\\" } ) );\\n\\t\\tlogger.info( \\\"Finishing delete()\\\" ); //f:log\",\n    \"start_line\": 190,\n    \"end_line\": 192\n  },\n  {\n    \"id\": 4,\n    \"description\": \"Return the input view after completing the delete operation.\",\n    \"code\": \"\\t\\treturn this.input();\",\n    \"start_line\": 193,\n    \"end_line\": 193\n  }\n]\n```"
  },
  {
    "class_name": "classes.PurchaseOrderAction",
    "function_name": "edit()",
    "analysis": "### Step 1: Summarise the Focal Method\n\nThe `edit()` method in the `PurchaseOrderAction` class is responsible for retrieving a `PurchaseOrder` object from the database using its ID, which is obtained from the request parameters. It logs the start and end of the operation, manages a Hibernate session and transaction to fetch the `PurchaseOrder`, and sets the retrieved object to the current instance. It also sets a task mode and returns an input string.\n\n### Step 2: List Necessary Environment Settings to Run the Focal Method\n\n- **Invoked Parameters and Fields:**\n  - `this.parameters`: A map-like structure from which the \"id\" parameter is retrieved.\n  - `this.task`: A field that is set to `SystemConstants.UD_MODE`.\n  - `this.setPurchaseOrder(po)`: A method to set the retrieved `PurchaseOrder` object.\n\n- **Invoked Methods:**\n  - `HibernateUtil.getSessionFactory()`: Returns a `SessionFactory` instance to open a Hibernate session.\n  - `sess.get(PurchaseOrder.class, id)`: Fetches a `PurchaseOrder` object from the database using the provided ID.\n  - `sess.beginTransaction()`, `t.commit()`, `sess.close()`: Methods to manage the transaction lifecycle.\n\n### Step 3: Decompose the Focal Method into Multiple Problem-Solving Steps",
    "slices": [
      {
        "id": 1,
        "description": "Log the start of the edit operation and retrieve the PurchaseOrder ID from request parameters.",
        "code": "\t\tlogger.info( \"Starting edit()\" ); //f:log\n\t\tInteger id = Integer.valueOf( this.parameters.get( \"id\" )[0] );",
        "start_line": 197,
        "end_line": 198
      },
      {
        "id": 2,
        "description": "Open a Hibernate session, begin a transaction, and retrieve the PurchaseOrder object using the ID.",
        "code": "\t\tSession sess = HibernateUtil.getSessionFactory().openSession(); //f:hibernate\n\t\tTransaction t = sess.beginTransaction(); //f:hibernate\n\t\tPurchaseOrder po = (PurchaseOrder) sess.get( PurchaseOrder.class, id ); //f:hibernate",
        "start_line": 200,
        "end_line": 203
      },
      {
        "id": 3,
        "description": "Commit the transaction and close the Hibernate session.",
        "code": "\t\tt.commit(); //f:hibernate\n\t\tsess.close(); //f:hibernate",
        "start_line": 205,
        "end_line": 206
      },
      {
        "id": 4,
        "description": "Set the retrieved PurchaseOrder object to the current instance and set the task mode.",
        "code": "\t\tthis.setPurchaseOrder( po );\n\t\tthis.task = SystemConstants.UD_MODE;",
        "start_line": 208,
        "end_line": 210
      },
      {
        "id": 5,
        "description": "Log the completion of the edit operation and return the input string.",
        "code": "\t\tlogger.info( \"Finishing edit()\" ); //f:log\n\t\treturn INPUT;",
        "start_line": 211,
        "end_line": 212
      }
    ],
    "full_response": "### Step 1: Summarise the Focal Method\n\nThe `edit()` method in the `PurchaseOrderAction` class is responsible for retrieving a `PurchaseOrder` object from the database using its ID, which is obtained from the request parameters. It logs the start and end of the operation, manages a Hibernate session and transaction to fetch the `PurchaseOrder`, and sets the retrieved object to the current instance. It also sets a task mode and returns an input string.\n\n### Step 2: List Necessary Environment Settings to Run the Focal Method\n\n- **Invoked Parameters and Fields:**\n  - `this.parameters`: A map-like structure from which the \"id\" parameter is retrieved.\n  - `this.task`: A field that is set to `SystemConstants.UD_MODE`.\n  - `this.setPurchaseOrder(po)`: A method to set the retrieved `PurchaseOrder` object.\n\n- **Invoked Methods:**\n  - `HibernateUtil.getSessionFactory()`: Returns a `SessionFactory` instance to open a Hibernate session.\n  - `sess.get(PurchaseOrder.class, id)`: Fetches a `PurchaseOrder` object from the database using the provided ID.\n  - `sess.beginTransaction()`, `t.commit()`, `sess.close()`: Methods to manage the transaction lifecycle.\n\n### Step 3: Decompose the Focal Method into Multiple Problem-Solving Steps\n\n```json\n[\n  {\n    \"id\": 1,\n    \"description\": \"Log the start of the edit operation and retrieve the PurchaseOrder ID from request parameters.\",\n    \"code\": \"\\t\\tlogger.info( \\\"Starting edit()\\\" ); //f:log\\n\\t\\tInteger id = Integer.valueOf( this.parameters.get( \\\"id\\\" )[0] );\",\n    \"start_line\": 197,\n    \"end_line\": 198\n  },\n  {\n    \"id\": 2,\n    \"description\": \"Open a Hibernate session, begin a transaction, and retrieve the PurchaseOrder object using the ID.\",\n    \"code\": \"\\t\\tSession sess = HibernateUtil.getSessionFactory().openSession(); //f:hibernate\\n\\t\\tTransaction t = sess.beginTransaction(); //f:hibernate\\n\\t\\tPurchaseOrder po = (PurchaseOrder) sess.get( PurchaseOrder.class, id ); //f:hibernate\",\n    \"start_line\": 200,\n    \"end_line\": 203\n  },\n  {\n    \"id\": 3,\n    \"description\": \"Commit the transaction and close the Hibernate session.\",\n    \"code\": \"\\t\\tt.commit(); //f:hibernate\\n\\t\\tsess.close(); //f:hibernate\",\n    \"start_line\": 205,\n    \"end_line\": 206\n  },\n  {\n    \"id\": 4,\n    \"description\": \"Set the retrieved PurchaseOrder object to the current instance and set the task mode.\",\n    \"code\": \"\\t\\tthis.setPurchaseOrder( po );\\n\\t\\tthis.task = SystemConstants.UD_MODE;\",\n    \"start_line\": 208,\n    \"end_line\": 210\n  },\n  {\n    \"id\": 5,\n    \"description\": \"Log the completion of the edit operation and return the input string.\",\n    \"code\": \"\\t\\tlogger.info( \\\"Finishing edit()\\\" ); //f:log\\n\\t\\treturn INPUT;\",\n    \"start_line\": 211,\n    \"end_line\": 212\n  }\n]\n```"
  },
  {
    "class_name": "classes.PurchaseOrderAjax",
    "function_name": "getProductPrice(Integer)",
    "analysis": "## Step 1: Summarise the Focal Method\n\nThe `getProductPrice(Integer idProduct)` method is part of the `classes.PurchaseOrderAjax` class. Its primary function is to retrieve the price of a product from a database using Hibernate ORM. The method starts by logging the initiation of the process, then it opens a Hibernate session and begins a transaction. It constructs a criteria query to fetch the price of the product with the specified `idProduct`. After executing the query, it commits the transaction, closes the session, logs the completion of the process, and returns the retrieved price.\n\n## Step 2: List Necessary Environment Settings to Run the Focal Method\n\n### Invoked Parameters and Fields\n- **Parameter:** `Integer idProduct` - The ID of the product whose price is to be retrieved.\n- **Field:** `sessionFactory` from `classes.HibernateUtil` - Used to open a Hibernate session.\n\n### Invoked Methods\n- **`HibernateUtil.getSessionFactory()`** - Retrieves the session factory to open a session.\n- **`sess.createCriteria(Product.class)`** - Creates a criteria query for the `Product` class.\n- **`criteria.setProjection(Projections.property(\"price\"))`** - Sets the projection to fetch the price property.\n- **`criteria.add(Restrictions.eq(\"id\", idProduct))`** - Adds a restriction to filter by product ID.\n- **`criteria.uniqueResult()`** - Executes the query and retrieves the unique result.\n- **`sess.beginTransaction()`** - Begins a transaction.\n- **`t.commit()`** - Commits the transaction.\n- **`sess.close()`** - Closes the session.\n\n## Step 3: Decompose the Focal Method into Multiple Problem-Solving Steps",
    "slices": [
      {
        "id": 1,
        "description": "Log the start of the getProductPrice method execution.",
        "code": "\t\tlogger.info( \"Starting getProductPrice()\" ); //f:log",
        "start_line": 14,
        "end_line": 14
      },
      {
        "id": 2,
        "description": "Open a Hibernate session and begin a transaction.",
        "code": "\t\tSession sess = HibernateUtil.getSessionFactory().openSession(); //f:hibernate\n\t\tTransaction t = sess.beginTransaction(); //f:hibernate",
        "start_line": 15,
        "end_line": 16
      },
      {
        "id": 3,
        "description": "Create a criteria query to select the price of the product with the specified ID.",
        "code": "\t\tCriteria criteria = sess.createCriteria( Product.class ); //f:hibernate\n\t\tcriteria.setProjection( Projections.property( \"price\" ) ); //f:hibernate\n\t\tcriteria.add( Restrictions.eq( \"id\", idProduct ) ); //f:hibernate",
        "start_line": 18,
        "end_line": 23
      },
      {
        "id": 4,
        "description": "Execute the criteria query to retrieve the product price.",
        "code": "\t\tDouble price = (Double) criteria.uniqueResult(); //f:hibernate",
        "start_line": 25,
        "end_line": 25
      },
      {
        "id": 5,
        "description": "Commit the transaction and close the session.",
        "code": "\t\tt.commit(); //f:hibernate\n\t\tsess.close(); //f:hibernate",
        "start_line": 27,
        "end_line": 28
      },
      {
        "id": 6,
        "description": "Log the completion of the getProductPrice method execution and return the retrieved price.",
        "code": "\t\tlogger.info( \"Finishing getProductPrice()\" ); //f:log\n\t\treturn price;",
        "start_line": 29,
        "end_line": 30
      }
    ],
    "full_response": "## Step 1: Summarise the Focal Method\n\nThe `getProductPrice(Integer idProduct)` method is part of the `classes.PurchaseOrderAjax` class. Its primary function is to retrieve the price of a product from a database using Hibernate ORM. The method starts by logging the initiation of the process, then it opens a Hibernate session and begins a transaction. It constructs a criteria query to fetch the price of the product with the specified `idProduct`. After executing the query, it commits the transaction, closes the session, logs the completion of the process, and returns the retrieved price.\n\n## Step 2: List Necessary Environment Settings to Run the Focal Method\n\n### Invoked Parameters and Fields\n- **Parameter:** `Integer idProduct` - The ID of the product whose price is to be retrieved.\n- **Field:** `sessionFactory` from `classes.HibernateUtil` - Used to open a Hibernate session.\n\n### Invoked Methods\n- **`HibernateUtil.getSessionFactory()`** - Retrieves the session factory to open a session.\n- **`sess.createCriteria(Product.class)`** - Creates a criteria query for the `Product` class.\n- **`criteria.setProjection(Projections.property(\"price\"))`** - Sets the projection to fetch the price property.\n- **`criteria.add(Restrictions.eq(\"id\", idProduct))`** - Adds a restriction to filter by product ID.\n- **`criteria.uniqueResult()`** - Executes the query and retrieves the unique result.\n- **`sess.beginTransaction()`** - Begins a transaction.\n- **`t.commit()`** - Commits the transaction.\n- **`sess.close()`** - Closes the session.\n\n## Step 3: Decompose the Focal Method into Multiple Problem-Solving Steps\n\n```json\n[\n  {\n    \"id\": 1,\n    \"description\": \"Log the start of the getProductPrice method execution.\",\n    \"code\": \"\\t\\tlogger.info( \\\"Starting getProductPrice()\\\" ); //f:log\",\n    \"start_line\": 14,\n    \"end_line\": 14\n  },\n  {\n    \"id\": 2,\n    \"description\": \"Open a Hibernate session and begin a transaction.\",\n    \"code\": \"\\t\\tSession sess = HibernateUtil.getSessionFactory().openSession(); //f:hibernate\\n\\t\\tTransaction t = sess.beginTransaction(); //f:hibernate\",\n    \"start_line\": 15,\n    \"end_line\": 16\n  },\n  {\n    \"id\": 3,\n    \"description\": \"Create a criteria query to select the price of the product with the specified ID.\",\n    \"code\": \"\\t\\tCriteria criteria = sess.createCriteria( Product.class ); //f:hibernate\\n\\t\\tcriteria.setProjection( Projections.property( \\\"price\\\" ) ); //f:hibernate\\n\\t\\tcriteria.add( Restrictions.eq( \\\"id\\\", idProduct ) ); //f:hibernate\",\n    \"start_line\": 18,\n    \"end_line\": 23\n  },\n  {\n    \"id\": 4,\n    \"description\": \"Execute the criteria query to retrieve the product price.\",\n    \"code\": \"\\t\\tDouble price = (Double) criteria.uniqueResult(); //f:hibernate\",\n    \"start_line\": 25,\n    \"end_line\": 25\n  },\n  {\n    \"id\": 5,\n    \"description\": \"Commit the transaction and close the session.\",\n    \"code\": \"\\t\\tt.commit(); //f:hibernate\\n\\t\\tsess.close(); //f:hibernate\",\n    \"start_line\": 27,\n    \"end_line\": 28\n  },\n  {\n    \"id\": 6,\n    \"description\": \"Log the completion of the getProductPrice method execution and return the retrieved price.\",\n    \"code\": \"\\t\\tlogger.info( \\\"Finishing getProductPrice()\\\" ); //f:log\\n\\t\\treturn price;\",\n    \"start_line\": 29,\n    \"end_line\": 30\n  }\n]\n```"
  },
  {
    "class_name": "classes.ReportAction",
    "function_name": "productReport()",
    "analysis": "### Step 1: Summarize the Focal Method\n\nThe `productReport()` method in the `classes.ReportAction` class is responsible for generating a product report in PDF format. It does this by compiling a Jasper report template, fetching product data from a database using Hibernate, and then filling the report with this data. The resulting report is exported to a PDF, which is then made available as a downloadable stream.\n\n### Step 2: List Necessary Environment Settings to Run the Focal Method\n\n#### Invoked Parameters and Fields\n- `this.inputStream`: A field in the `ReportAction` class where the generated PDF stream is stored.\n\n#### Invoked Methods\n- `ActionContext.getContext()`: Retrieves the current action context.\n- `ServletContext.get()`: Accesses the servlet context.\n- `JasperCompileManager.compileReport(InputStream)`: Compiles a Jasper report from an XML template.\n- `HibernateUtil.getSessionFactory()`: Obtains the Hibernate session factory.\n- `SessionFactory.openSession()`: Opens a new Hibernate session.\n- `Session.beginTransaction()`: Begins a new transaction.\n- `Session.createCriteria(Class)`: Creates a criteria query for the specified class.\n- `Criteria.setProjection(ProjectionList)`: Sets the projection for a criteria query.\n- `Criteria.list()`: Executes the criteria query and returns the results.\n- `Transaction.commit()`: Commits the current transaction.\n- `Session.close()`: Closes the session.\n- `JasperFillManager.fillReport(JasperReport, Map, JRDataSource)`: Fills a Jasper report with data.\n- `JasperExportManager.exportReportToPdf(JasperPrint)`: Exports a Jasper report to a PDF.\n- `ByteArrayInputStream(byte[])`: Creates an input stream from a byte array.\n- `logger.info(String)`: Logs an informational message.\n\n### Step 3: Decompose the Focal Method into Multiple Problem-Solving Steps",
    "slices": [
      {
        "id": 1,
        "description": "Log the start of the product report generation process.",
        "code": "\t\tlogger.info( \"Starting productReport()\" ); //f:log",
        "start_line": 66,
        "end_line": 66
      },
      {
        "id": 2,
        "description": "Set up the action and servlet contexts required for report compilation.",
        "code": "\t\tActionContext ac = ActionContext.getContext();\n\t\tServletContext sc = (ServletContext) ac.get( StrutsStatics.SERVLET_CONTEXT );",
        "start_line": 68,
        "end_line": 69
      },
      {
        "id": 3,
        "description": "Compile the Jasper report template from the XML resource.",
        "code": "\t\tJasperReport jasperReport = JasperCompileManager.compileReport( sc.getResourceAsStream( \"/WEB-INF/classes/ProductReport.xml\" ) ); //f:jr",
        "start_line": 71,
        "end_line": 71
      },
      {
        "id": 4,
        "description": "Initialize report parameters with a title and the current date.",
        "code": "\t\tMap<String, Object> parameters = new HashMap<String, Object>(); //f:jr\n\t\tparameters.put( \"ReportTitle\", \"List of Products\" ); //f:jr\n\t\tparameters.put( \"DataFile\", new Date().toString() ); //f:jr",
        "start_line": 73,
        "end_line": 75
      },
      {
        "id": 5,
        "description": "Open a Hibernate session and begin a transaction to query product data.",
        "code": "\t\tSession sess = HibernateUtil.getSessionFactory().openSession(); //f:hibernate\n\t\tTransaction t = sess.beginTransaction(); //f:hibernate",
        "start_line": 77,
        "end_line": 78
      },
      {
        "id": 6,
        "description": "Create and configure a criteria query to select product data.",
        "code": "\t\tCriteria criteria = sess.createCriteria( Product.class ); //f:hibernate\n\t\tcriteria.setProjection( Projections.projectionList().add( Projections.property( \"id\" ) ).add( Projections.property( \"name\" ) ).add( Projections.property( \"price\" ) ) ); //f:hibernate",
        "start_line": 80,
        "end_line": 82
      },
      {
        "id": 7,
        "description": "Execute the criteria query and retrieve the product data list.",
        "code": "\t\t@SuppressWarnings(\"unchecked\")\n\t\tList<Object[]> l = (List<Object[]>) criteria.list(); //f:hibernate",
        "start_line": 85,
        "end_line": 86
      },
      {
        "id": 8,
        "description": "Commit the transaction and close the Hibernate session.",
        "code": "\t\tt.commit(); //f:hibernate\n\t\tsess.close(); //f:hibernate",
        "start_line": 88,
        "end_line": 89
      },
      {
        "id": 9,
        "description": "Create a data source for the Jasper report using the retrieved product data.",
        "code": "\t\tHibernateQueryResultDataSource ds = new HibernateQueryResultDataSource(l, new String[] { \"Id\", \"Name\", \"Price\" }); //f:jr",
        "start_line": 91,
        "end_line": 91
      },
      {
        "id": 10,
        "description": "Fill the Jasper report with the prepared parameters and data source.",
        "code": "\t\tJasperPrint jasperPrint = JasperFillManager.fillReport( jasperReport, parameters, ds ); //f:jr",
        "start_line": 93,
        "end_line": 93
      },
      {
        "id": 11,
        "description": "Export the filled Jasper report to a PDF byte array.",
        "code": "\t\tbyte b[] = JasperExportManager.exportReportToPdf( jasperPrint ); //f:jr",
        "start_line": 95,
        "end_line": 95
      },
      {
        "id": 12,
        "description": "Convert the PDF byte array into an input stream for download.",
        "code": "\t\tthis.inputStream = new ByteArrayInputStream( b );",
        "start_line": 97,
        "end_line": 97
      },
      {
        "id": 13,
        "description": "Log the completion of the product report generation process and return the download action.",
        "code": "\t\tlogger.info( \"Finishing productReport()\" ); //f:log\n\t\treturn \"download\";",
        "start_line": 99,
        "end_line": 100
      }
    ],
    "full_response": "### Step 1: Summarize the Focal Method\n\nThe `productReport()` method in the `classes.ReportAction` class is responsible for generating a product report in PDF format. It does this by compiling a Jasper report template, fetching product data from a database using Hibernate, and then filling the report with this data. The resulting report is exported to a PDF, which is then made available as a downloadable stream.\n\n### Step 2: List Necessary Environment Settings to Run the Focal Method\n\n#### Invoked Parameters and Fields\n- `this.inputStream`: A field in the `ReportAction` class where the generated PDF stream is stored.\n\n#### Invoked Methods\n- `ActionContext.getContext()`: Retrieves the current action context.\n- `ServletContext.get()`: Accesses the servlet context.\n- `JasperCompileManager.compileReport(InputStream)`: Compiles a Jasper report from an XML template.\n- `HibernateUtil.getSessionFactory()`: Obtains the Hibernate session factory.\n- `SessionFactory.openSession()`: Opens a new Hibernate session.\n- `Session.beginTransaction()`: Begins a new transaction.\n- `Session.createCriteria(Class)`: Creates a criteria query for the specified class.\n- `Criteria.setProjection(ProjectionList)`: Sets the projection for a criteria query.\n- `Criteria.list()`: Executes the criteria query and returns the results.\n- `Transaction.commit()`: Commits the current transaction.\n- `Session.close()`: Closes the session.\n- `JasperFillManager.fillReport(JasperReport, Map, JRDataSource)`: Fills a Jasper report with data.\n- `JasperExportManager.exportReportToPdf(JasperPrint)`: Exports a Jasper report to a PDF.\n- `ByteArrayInputStream(byte[])`: Creates an input stream from a byte array.\n- `logger.info(String)`: Logs an informational message.\n\n### Step 3: Decompose the Focal Method into Multiple Problem-Solving Steps\n\n```json\n[\n  {\n    \"id\": 1,\n    \"description\": \"Log the start of the product report generation process.\",\n    \"code\": \"\\t\\tlogger.info( \\\"Starting productReport()\\\" ); //f:log\",\n    \"start_line\": 66,\n    \"end_line\": 66\n  },\n  {\n    \"id\": 2,\n    \"description\": \"Set up the action and servlet contexts required for report compilation.\",\n    \"code\": \"\\t\\tActionContext ac = ActionContext.getContext();\\n\\t\\tServletContext sc = (ServletContext) ac.get( StrutsStatics.SERVLET_CONTEXT );\",\n    \"start_line\": 68,\n    \"end_line\": 69\n  },\n  {\n    \"id\": 3,\n    \"description\": \"Compile the Jasper report template from the XML resource.\",\n    \"code\": \"\\t\\tJasperReport jasperReport = JasperCompileManager.compileReport( sc.getResourceAsStream( \\\"/WEB-INF/classes/ProductReport.xml\\\" ) ); //f:jr\",\n    \"start_line\": 71,\n    \"end_line\": 71\n  },\n  {\n    \"id\": 4,\n    \"description\": \"Initialize report parameters with a title and the current date.\",\n    \"code\": \"\\t\\tMap<String, Object> parameters = new HashMap<String, Object>(); //f:jr\\n\\t\\tparameters.put( \\\"ReportTitle\\\", \\\"List of Products\\\" ); //f:jr\\n\\t\\tparameters.put( \\\"DataFile\\\", new Date().toString() ); //f:jr\",\n    \"start_line\": 73,\n    \"end_line\": 75\n  },\n  {\n    \"id\": 5,\n    \"description\": \"Open a Hibernate session and begin a transaction to query product data.\",\n    \"code\": \"\\t\\tSession sess = HibernateUtil.getSessionFactory().openSession(); //f:hibernate\\n\\t\\tTransaction t = sess.beginTransaction(); //f:hibernate\",\n    \"start_line\": 77,\n    \"end_line\": 78\n  },\n  {\n    \"id\": 6,\n    \"description\": \"Create and configure a criteria query to select product data.\",\n    \"code\": \"\\t\\tCriteria criteria = sess.createCriteria( Product.class ); //f:hibernate\\n\\t\\tcriteria.setProjection( Projections.projectionList().add( Projections.property( \\\"id\\\" ) ).add( Projections.property( \\\"name\\\" ) ).add( Projections.property( \\\"price\\\" ) ) ); //f:hibernate\",\n    \"start_line\": 80,\n    \"end_line\": 82\n  },\n  {\n    \"id\": 7,\n    \"description\": \"Execute the criteria query and retrieve the product data list.\",\n    \"code\": \"\\t\\t@SuppressWarnings(\\\"unchecked\\\")\\n\\t\\tList<Object[]> l = (List<Object[]>) criteria.list(); //f:hibernate\",\n    \"start_line\": 85,\n    \"end_line\": 86\n  },\n  {\n    \"id\": 8,\n    \"description\": \"Commit the transaction and close the Hibernate session.\",\n    \"code\": \"\\t\\tt.commit(); //f:hibernate\\n\\t\\tsess.close(); //f:hibernate\",\n    \"start_line\": 88,\n    \"end_line\": 89\n  },\n  {\n    \"id\": 9,\n    \"description\": \"Create a data source for the Jasper report using the retrieved product data.\",\n    \"code\": \"\\t\\tHibernateQueryResultDataSource ds = new HibernateQueryResultDataSource(l, new String[] { \\\"Id\\\", \\\"Name\\\", \\\"Price\\\" }); //f:jr\",\n    \"start_line\": 91,\n    \"end_line\": 91\n  },\n  {\n    \"id\": 10,\n    \"description\": \"Fill the Jasper report with the prepared parameters and data source.\",\n    \"code\": \"\\t\\tJasperPrint jasperPrint = JasperFillManager.fillReport( jasperReport, parameters, ds ); //f:jr\",\n    \"start_line\": 93,\n    \"end_line\": 93\n  },\n  {\n    \"id\": 11,\n    \"description\": \"Export the filled Jasper report to a PDF byte array.\",\n    \"code\": \"\\t\\tbyte b[] = JasperExportManager.exportReportToPdf( jasperPrint ); //f:jr\",\n    \"start_line\": 95,\n    \"end_line\": 95\n  },\n  {\n    \"id\": 12,\n    \"description\": \"Convert the PDF byte array into an input stream for download.\",\n    \"code\": \"\\t\\tthis.inputStream = new ByteArrayInputStream( b );\",\n    \"start_line\": 97,\n    \"end_line\": 97\n  },\n  {\n    \"id\": 13,\n    \"description\": \"Log the completion of the product report generation process and return the download action.\",\n    \"code\": \"\\t\\tlogger.info( \\\"Finishing productReport()\\\" ); //f:log\\n\\t\\treturn \\\"download\\\";\",\n    \"start_line\": 99,\n    \"end_line\": 100\n  }\n]\n```"
  },
  {
    "class_name": "classes.ReportAction",
    "function_name": "customerReport()",
    "analysis": "### Step 1: Summarize the Focal Method\n\nThe `customerReport()` method in the `classes.ReportAction` class is responsible for generating a PDF report of customers using JasperReports and Hibernate. It involves several key operations: initializing the context and resources, compiling a Jasper report template, setting report parameters, executing a Hibernate query to fetch customer data, filling the report with data, exporting the report to a PDF format, and then preparing the PDF for download.\n\n### Step 2: List Necessary Environment Settings to Run the Focal Method\n\n- **Invoked Parameters and Fields:**\n  - `this.inputStream`: A field presumably used to store the generated PDF for further processing or download.\n\n- **Invoked Methods:**\n  - `ActionContext.getContext()`: Retrieves the current action context.\n  - `ServletContext.get()`: Fetches resources from the servlet context.\n  - `JasperCompileManager.compileReport()`: Compiles a JasperReports template.\n  - `HibernateUtil.getSessionFactory()`: Provides a Hibernate session factory.\n  - `Session.openSession()`: Opens a new Hibernate session.\n  - `Session.createCriteria()`: Creates a criteria query for fetching data.\n  - `Transaction.commit()`: Commits the current transaction.\n  - `Session.close()`: Closes the Hibernate session.\n  - `JasperFillManager.fillReport()`: Fills the compiled report with data.\n  - `JasperExportManager.exportReportToPdf()`: Exports the filled report to a PDF.\n  - `new ByteArrayInputStream()`: Converts a byte array to an input stream.\n  - `logger.info()`: Logs information messages.\n\n### Step 3: Decompose the Focal Method into Multiple Problem-Solving Steps",
    "slices": [
      {
        "id": 1,
        "description": "Initialize the action and servlet context, and log the start of the report generation process.",
        "code": "\t\tlogger.info( \"Starting customerReport()\" );\n\n\t\tActionContext ac = ActionContext.getContext();\n\t\tServletContext sc = (ServletContext) ac.get( StrutsStatics.SERVLET_CONTEXT );",
        "start_line": 105,
        "end_line": 108
      },
      {
        "id": 2,
        "description": "Compile the JasperReports template for the customer report.",
        "code": "\t\tJasperReport jasperReport = JasperCompileManager.compileReport( sc.getResourceAsStream( \"/WEB-INF/classes/CustomerReport.xml\" ) );",
        "start_line": 110,
        "end_line": 110
      },
      {
        "id": 3,
        "description": "Set up parameters for the Jasper report, including the report title and current date.",
        "code": "\t\tMap<String, Object> parameters = new HashMap<String, Object>();\n\t\tparameters.put( \"ReportTitle\", \"List of Customers\" );\n\t\tparameters.put( \"DataFile\", new Date().toString() );",
        "start_line": 112,
        "end_line": 114
      },
      {
        "id": 4,
        "description": "Open a Hibernate session and begin a transaction to fetch customer data.",
        "code": "\t\tSession sess = HibernateUtil.getSessionFactory().openSession();\n\t\tTransaction t = sess.beginTransaction();",
        "start_line": 116,
        "end_line": 117
      },
      {
        "id": 5,
        "description": "Create a criteria query to select customer data, including id, name, and phone.",
        "code": "\t\tCriteria criteria = sess.createCriteria( Customer.class );\n\n\t\tcriteria.setProjection( Projections.projectionList().add( Projections.property( \"id\" ) ).add( Projections.property( \"name\" ) ).add( Projections.property( \"phone\" ) ) );",
        "start_line": 119,
        "end_line": 121
      },
      {
        "id": 6,
        "description": "Execute the criteria query to retrieve customer data and commit the transaction.",
        "code": "\t\t@SuppressWarnings(\"unchecked\")\n\t\tList<Object[]> l = (List<Object[]>) criteria.list();\n\n\t\tt.commit();\n\t\tsess.close();",
        "start_line": 124,
        "end_line": 128
      },
      {
        "id": 7,
        "description": "Create a data source for the Jasper report using the fetched customer data.",
        "code": "\t\tHibernateQueryResultDataSource ds = new HibernateQueryResultDataSource(l, new String[] { \"Id\", \"Name\", \"Phone\" });",
        "start_line": 130,
        "end_line": 130
      },
      {
        "id": 8,
        "description": "Fill the compiled Jasper report with data from the data source and parameters.",
        "code": "\t\tJasperPrint jasperPrint = JasperFillManager.fillReport( jasperReport, parameters, ds );",
        "start_line": 132,
        "end_line": 132
      },
      {
        "id": 9,
        "description": "Export the filled Jasper report to a PDF format.",
        "code": "\t\tbyte b[] = JasperExportManager.exportReportToPdf( jasperPrint );",
        "start_line": 134,
        "end_line": 134
      },
      {
        "id": 10,
        "description": "Prepare the generated PDF for download by converting it to an input stream.",
        "code": "\t\tthis.inputStream = new ByteArrayInputStream( b );",
        "start_line": 136,
        "end_line": 136
      },
      {
        "id": 11,
        "description": "Log the completion of the report generation process and return the download action.",
        "code": "\t\tlogger.info( \"Finishing customerReport()\" );\n\t\treturn \"download\";",
        "start_line": 138,
        "end_line": 139
      }
    ],
    "full_response": "### Step 1: Summarize the Focal Method\n\nThe `customerReport()` method in the `classes.ReportAction` class is responsible for generating a PDF report of customers using JasperReports and Hibernate. It involves several key operations: initializing the context and resources, compiling a Jasper report template, setting report parameters, executing a Hibernate query to fetch customer data, filling the report with data, exporting the report to a PDF format, and then preparing the PDF for download.\n\n### Step 2: List Necessary Environment Settings to Run the Focal Method\n\n- **Invoked Parameters and Fields:**\n  - `this.inputStream`: A field presumably used to store the generated PDF for further processing or download.\n\n- **Invoked Methods:**\n  - `ActionContext.getContext()`: Retrieves the current action context.\n  - `ServletContext.get()`: Fetches resources from the servlet context.\n  - `JasperCompileManager.compileReport()`: Compiles a JasperReports template.\n  - `HibernateUtil.getSessionFactory()`: Provides a Hibernate session factory.\n  - `Session.openSession()`: Opens a new Hibernate session.\n  - `Session.createCriteria()`: Creates a criteria query for fetching data.\n  - `Transaction.commit()`: Commits the current transaction.\n  - `Session.close()`: Closes the Hibernate session.\n  - `JasperFillManager.fillReport()`: Fills the compiled report with data.\n  - `JasperExportManager.exportReportToPdf()`: Exports the filled report to a PDF.\n  - `new ByteArrayInputStream()`: Converts a byte array to an input stream.\n  - `logger.info()`: Logs information messages.\n\n### Step 3: Decompose the Focal Method into Multiple Problem-Solving Steps\n\n```json\n[\n  {\n    \"id\": 1,\n    \"description\": \"Initialize the action and servlet context, and log the start of the report generation process.\",\n    \"code\": \"\\t\\tlogger.info( \\\"Starting customerReport()\\\" );\\n\\n\\t\\tActionContext ac = ActionContext.getContext();\\n\\t\\tServletContext sc = (ServletContext) ac.get( StrutsStatics.SERVLET_CONTEXT );\",\n    \"start_line\": 105,\n    \"end_line\": 108\n  },\n  {\n    \"id\": 2,\n    \"description\": \"Compile the JasperReports template for the customer report.\",\n    \"code\": \"\\t\\tJasperReport jasperReport = JasperCompileManager.compileReport( sc.getResourceAsStream( \\\"/WEB-INF/classes/CustomerReport.xml\\\" ) );\",\n    \"start_line\": 110,\n    \"end_line\": 110\n  },\n  {\n    \"id\": 3,\n    \"description\": \"Set up parameters for the Jasper report, including the report title and current date.\",\n    \"code\": \"\\t\\tMap<String, Object> parameters = new HashMap<String, Object>();\\n\\t\\tparameters.put( \\\"ReportTitle\\\", \\\"List of Customers\\\" );\\n\\t\\tparameters.put( \\\"DataFile\\\", new Date().toString() );\",\n    \"start_line\": 112,\n    \"end_line\": 114\n  },\n  {\n    \"id\": 4,\n    \"description\": \"Open a Hibernate session and begin a transaction to fetch customer data.\",\n    \"code\": \"\\t\\tSession sess = HibernateUtil.getSessionFactory().openSession();\\n\\t\\tTransaction t = sess.beginTransaction();\",\n    \"start_line\": 116,\n    \"end_line\": 117\n  },\n  {\n    \"id\": 5,\n    \"description\": \"Create a criteria query to select customer data, including id, name, and phone.\",\n    \"code\": \"\\t\\tCriteria criteria = sess.createCriteria( Customer.class );\\n\\n\\t\\tcriteria.setProjection( Projections.projectionList().add( Projections.property( \\\"id\\\" ) ).add( Projections.property( \\\"name\\\" ) ).add( Projections.property( \\\"phone\\\" ) ) );\",\n    \"start_line\": 119,\n    \"end_line\": 121\n  },\n  {\n    \"id\": 6,\n    \"description\": \"Execute the criteria query to retrieve customer data and commit the transaction.\",\n    \"code\": \"\\t\\t@SuppressWarnings(\\\"unchecked\\\")\\n\\t\\tList<Object[]> l = (List<Object[]>) criteria.list();\\n\\n\\t\\tt.commit();\\n\\t\\tsess.close();\",\n    \"start_line\": 124,\n    \"end_line\": 128\n  },\n  {\n    \"id\": 7,\n    \"description\": \"Create a data source for the Jasper report using the fetched customer data.\",\n    \"code\": \"\\t\\tHibernateQueryResultDataSource ds = new HibernateQueryResultDataSource(l, new String[] { \\\"Id\\\", \\\"Name\\\", \\\"Phone\\\" });\",\n    \"start_line\": 130,\n    \"end_line\": 130\n  },\n  {\n    \"id\": 8,\n    \"description\": \"Fill the compiled Jasper report with data from the data source and parameters.\",\n    \"code\": \"\\t\\tJasperPrint jasperPrint = JasperFillManager.fillReport( jasperReport, parameters, ds );\",\n    \"start_line\": 132,\n    \"end_line\": 132\n  },\n  {\n    \"id\": 9,\n    \"description\": \"Export the filled Jasper report to a PDF format.\",\n    \"code\": \"\\t\\tbyte b[] = JasperExportManager.exportReportToPdf( jasperPrint );\",\n    \"start_line\": 134,\n    \"end_line\": 134\n  },\n  {\n    \"id\": 10,\n    \"description\": \"Prepare the generated PDF for download by converting it to an input stream.\",\n    \"code\": \"\\t\\tthis.inputStream = new ByteArrayInputStream( b );\",\n    \"start_line\": 136,\n    \"end_line\": 136\n  },\n  {\n    \"id\": 11,\n    \"description\": \"Log the completion of the report generation process and return the download action.\",\n    \"code\": \"\\t\\tlogger.info( \\\"Finishing customerReport()\\\" );\\n\\t\\treturn \\\"download\\\";\",\n    \"start_line\": 138,\n    \"end_line\": 139\n  }\n]\n```"
  },
  {
    "class_name": "classes.SchedulerAction",
    "function_name": "input()",
    "analysis": "### Step 1: Summarise the Focal Method\n\nThe `input()` method in the `SchedulerAction` class is responsible for interacting with a Quartz Scheduler to retrieve job details for a specific job identified by its key. It initializes a scheduler, retrieves a job detail, extracts a time interval from the job's data map if the job exists, logs the start and end of the method execution, and finally calls a superclass method `input()` to complete its operation.\n\n### Step 2: List Necessary Environment Settings to Run the Focal Method\n\n- **Invoked Parameters and Fields:**\n  - `this.timeInterval`: A field presumably in the `SchedulerAction` class where the time interval is stored.\n  \n- **Invoked Methods:**\n  - `sf.getScheduler()`: Method from `SchedulerFactory` to obtain a `Scheduler` instance.\n  - `sc.getJobDetail(JobKey.jobKey(\"supplyMailJob\", \"group\"))`: Method from `Scheduler` to get details of a specific job.\n  - `job.getJobDataMap().getIntValue(\"timeInterval\")`: Method from `JobDetail` to retrieve an integer value from the job's data map.\n  - `super.input()`: Method from the superclass of `SchedulerAction`.\n\n### Step 3: Decompose the Focal Method into Multiple Problem-Solving Steps",
    "slices": [
      {
        "id": 1,
        "description": "Log the start of the input method execution.",
        "code": "\t\tlogger.info( \"Starting input()\" ); //f:log",
        "start_line": 55,
        "end_line": 55
      },
      {
        "id": 2,
        "description": "Initialize the SchedulerFactory and obtain a Scheduler instance.",
        "code": "\t\tSchedulerFactory sf = new StdSchedulerFactory(); //f:quartz\n\t\tScheduler sc = sf.getScheduler(); //f:quartz",
        "start_line": 56,
        "end_line": 57
      },
      {
        "id": 3,
        "description": "Retrieve the job details for a specific job using its key.",
        "code": "\t\tJobDetail job = sc.getJobDetail( JobKey.jobKey( \"supplyMailJob\", \"group\" ) ); //f:quartz",
        "start_line": 59,
        "end_line": 59
      },
      {
        "id": 4,
        "description": "If the job exists, extract the time interval from the job's data map.",
        "code": "\t\tif ( job != null ) { //f:quartz\n\t\t\tthis.timeInterval = job.getJobDataMap().getIntValue( \"timeInterval\" ); //f:quartz\n\t\t} //f:quartz",
        "start_line": 61,
        "end_line": 63
      },
      {
        "id": 5,
        "description": "Log the end of the input method execution and return the result of the superclass input method.",
        "code": "\t\tlogger.info( \"Finishing input()\" ); //f:log\n\t\treturn super.input();",
        "start_line": 65,
        "end_line": 66
      }
    ],
    "full_response": "### Step 1: Summarise the Focal Method\n\nThe `input()` method in the `SchedulerAction` class is responsible for interacting with a Quartz Scheduler to retrieve job details for a specific job identified by its key. It initializes a scheduler, retrieves a job detail, extracts a time interval from the job's data map if the job exists, logs the start and end of the method execution, and finally calls a superclass method `input()` to complete its operation.\n\n### Step 2: List Necessary Environment Settings to Run the Focal Method\n\n- **Invoked Parameters and Fields:**\n  - `this.timeInterval`: A field presumably in the `SchedulerAction` class where the time interval is stored.\n  \n- **Invoked Methods:**\n  - `sf.getScheduler()`: Method from `SchedulerFactory` to obtain a `Scheduler` instance.\n  - `sc.getJobDetail(JobKey.jobKey(\"supplyMailJob\", \"group\"))`: Method from `Scheduler` to get details of a specific job.\n  - `job.getJobDataMap().getIntValue(\"timeInterval\")`: Method from `JobDetail` to retrieve an integer value from the job's data map.\n  - `super.input()`: Method from the superclass of `SchedulerAction`.\n\n### Step 3: Decompose the Focal Method into Multiple Problem-Solving Steps\n\n```json\n[\n  {\n    \"id\": 1,\n    \"description\": \"Log the start of the input method execution.\",\n    \"code\": \"\\t\\tlogger.info( \\\"Starting input()\\\" ); //f:log\",\n    \"start_line\": 55,\n    \"end_line\": 55\n  },\n  {\n    \"id\": 2,\n    \"description\": \"Initialize the SchedulerFactory and obtain a Scheduler instance.\",\n    \"code\": \"\\t\\tSchedulerFactory sf = new StdSchedulerFactory(); //f:quartz\\n\\t\\tScheduler sc = sf.getScheduler(); //f:quartz\",\n    \"start_line\": 56,\n    \"end_line\": 57\n  },\n  {\n    \"id\": 3,\n    \"description\": \"Retrieve the job details for a specific job using its key.\",\n    \"code\": \"\\t\\tJobDetail job = sc.getJobDetail( JobKey.jobKey( \\\"supplyMailJob\\\", \\\"group\\\" ) ); //f:quartz\",\n    \"start_line\": 59,\n    \"end_line\": 59\n  },\n  {\n    \"id\": 4,\n    \"description\": \"If the job exists, extract the time interval from the job's data map.\",\n    \"code\": \"\\t\\tif ( job != null ) { //f:quartz\\n\\t\\t\\tthis.timeInterval = job.getJobDataMap().getIntValue( \\\"timeInterval\\\" ); //f:quartz\\n\\t\\t} //f:quartz\",\n    \"start_line\": 61,\n    \"end_line\": 63\n  },\n  {\n    \"id\": 5,\n    \"description\": \"Log the end of the input method execution and return the result of the superclass input method.\",\n    \"code\": \"\\t\\tlogger.info( \\\"Finishing input()\\\" ); //f:log\\n\\t\\treturn super.input();\",\n    \"start_line\": 65,\n    \"end_line\": 66\n  }\n]\n```"
  },
  {
    "class_name": "classes.SchedulerAction",
    "function_name": "schedule()",
    "analysis": "## Step 1: Summarise the Focal Method\n\nThe `schedule()` method in the `classes.SchedulerAction` class is responsible for setting up a scheduled job using the Quartz Scheduler framework. It begins by initializing a `Scheduler` instance and checks if a job with a specific key (`supplyMailJob` in the `group`) already exists. If it does, the existing job is deleted. The method then creates a new job with the same key and associates it with a trigger that uses a cron schedule based on a `timeInterval` field. Finally, the job is scheduled with the trigger, and the method logs the start and end of the scheduling process before returning a constant `INPUT`.\n\n## Step 2: List Necessary Environment Settings to Run the Focal Method\n\n- **Invoked Parameters and Fields:**\n  - `this.timeInterval`: A field presumably defined in the class, used to determine the cron schedule interval.\n\n- **Invoked Methods:**\n  - `sf.getScheduler()`: Obtains a `Scheduler` instance.\n  - `sc.getJobDetail(JobKey.jobKey(\"supplyMailJob\", \"group\"))`: Retrieves the job detail for a specific job key.\n  - `sc.deleteJob(JobKey.jobKey(\"supplyMailJob\", \"group\"))`: Deletes a job with a specific job key.\n  - `newJob(SupplyMailJob.class).withIdentity(\"supplyMailJob\", \"group\").build()`: Constructs a new job detail instance.\n  - `job.getJobDataMap().put(\"timeInterval\", this.timeInterval)`: Stores data in the job's data map.\n  - `newTrigger().withIdentity(\"supplyMailTrigger\", \"group\").startNow().withSchedule(CronScheduleBuilder.cronSchedule(...)).build()`: Constructs a new trigger with a cron schedule.\n  - `sc.scheduleJob(job, trigger)`: Schedules the job with the specified trigger.\n\n## Step 3: Decompose the Focal Method into Multiple Problem-Solving Steps",
    "slices": [
      {
        "id": 1,
        "description": "Log the start of the scheduling process.",
        "code": "\t\tlogger.info( \"Starting schedule()\" ); //f:log",
        "start_line": 70,
        "end_line": 70
      },
      {
        "id": 2,
        "description": "Initialize the Scheduler instance.",
        "code": "\t\tSchedulerFactory sf = new StdSchedulerFactory(); //f:quartz\n\t\tScheduler sc = sf.getScheduler(); //f:quartz",
        "start_line": 72,
        "end_line": 73
      },
      {
        "id": 3,
        "description": "Check if the job with the specified key exists and delete it if present.",
        "code": "\t\tJobDetail job = sc.getJobDetail( JobKey.jobKey( \"supplyMailJob\", \"group\" ) ); //f:quartz\n\n\t\tif ( job != null ) { //f:quartz\n\t\t\tsc.deleteJob( JobKey.jobKey( \"supplyMailJob\", \"group\" ) ); //f:quartz\n\t\t} //f:quartz",
        "start_line": 75,
        "end_line": 79
      },
      {
        "id": 4,
        "description": "Create a new job detail and set its data map with the time interval.",
        "code": "\t\tjob = newJob( SupplyMailJob.class ).withIdentity( \"supplyMailJob\", \"group\" ).build(); //f:quartz\n\t\tjob.getJobDataMap().put( \"timeInterval\", this.timeInterval ); //f:quartz",
        "start_line": 81,
        "end_line": 82
      },
      {
        "id": 5,
        "description": "Create a trigger with a cron schedule based on the time interval.",
        "code": "\t\tTrigger trigger = newTrigger().withIdentity( \"supplyMailTrigger\", \"group\" ).startNow().withSchedule( CronScheduleBuilder.cronSchedule( \"0 0/\"\n\t\t\t\t+ (this.timeInterval * 60) + \" * * * ?\" ) ).build(); //f:quartz",
        "start_line": 84,
        "end_line": 85
      },
      {
        "id": 6,
        "description": "Schedule the job with the trigger.",
        "code": "\t\tsc.scheduleJob( job, trigger ); //f:quartz",
        "start_line": 87,
        "end_line": 87
      },
      {
        "id": 7,
        "description": "Log the end of the scheduling process and return the INPUT constant.",
        "code": "\t\tlogger.info( \"Finishing schedule()\" ); //f:log\n\t\treturn INPUT;",
        "start_line": 89,
        "end_line": 90
      }
    ],
    "full_response": "## Step 1: Summarise the Focal Method\n\nThe `schedule()` method in the `classes.SchedulerAction` class is responsible for setting up a scheduled job using the Quartz Scheduler framework. It begins by initializing a `Scheduler` instance and checks if a job with a specific key (`supplyMailJob` in the `group`) already exists. If it does, the existing job is deleted. The method then creates a new job with the same key and associates it with a trigger that uses a cron schedule based on a `timeInterval` field. Finally, the job is scheduled with the trigger, and the method logs the start and end of the scheduling process before returning a constant `INPUT`.\n\n## Step 2: List Necessary Environment Settings to Run the Focal Method\n\n- **Invoked Parameters and Fields:**\n  - `this.timeInterval`: A field presumably defined in the class, used to determine the cron schedule interval.\n\n- **Invoked Methods:**\n  - `sf.getScheduler()`: Obtains a `Scheduler` instance.\n  - `sc.getJobDetail(JobKey.jobKey(\"supplyMailJob\", \"group\"))`: Retrieves the job detail for a specific job key.\n  - `sc.deleteJob(JobKey.jobKey(\"supplyMailJob\", \"group\"))`: Deletes a job with a specific job key.\n  - `newJob(SupplyMailJob.class).withIdentity(\"supplyMailJob\", \"group\").build()`: Constructs a new job detail instance.\n  - `job.getJobDataMap().put(\"timeInterval\", this.timeInterval)`: Stores data in the job's data map.\n  - `newTrigger().withIdentity(\"supplyMailTrigger\", \"group\").startNow().withSchedule(CronScheduleBuilder.cronSchedule(...)).build()`: Constructs a new trigger with a cron schedule.\n  - `sc.scheduleJob(job, trigger)`: Schedules the job with the specified trigger.\n\n## Step 3: Decompose the Focal Method into Multiple Problem-Solving Steps\n\n```json\n[\n  {\n    \"id\": 1,\n    \"description\": \"Log the start of the scheduling process.\",\n    \"code\": \"\\t\\tlogger.info( \\\"Starting schedule()\\\" ); //f:log\",\n    \"start_line\": 70,\n    \"end_line\": 70\n  },\n  {\n    \"id\": 2,\n    \"description\": \"Initialize the Scheduler instance.\",\n    \"code\": \"\\t\\tSchedulerFactory sf = new StdSchedulerFactory(); //f:quartz\\n\\t\\tScheduler sc = sf.getScheduler(); //f:quartz\",\n    \"start_line\": 72,\n    \"end_line\": 73\n  },\n  {\n    \"id\": 3,\n    \"description\": \"Check if the job with the specified key exists and delete it if present.\",\n    \"code\": \"\\t\\tJobDetail job = sc.getJobDetail( JobKey.jobKey( \\\"supplyMailJob\\\", \\\"group\\\" ) ); //f:quartz\\n\\n\\t\\tif ( job != null ) { //f:quartz\\n\\t\\t\\tsc.deleteJob( JobKey.jobKey( \\\"supplyMailJob\\\", \\\"group\\\" ) ); //f:quartz\\n\\t\\t} //f:quartz\",\n    \"start_line\": 75,\n    \"end_line\": 79\n  },\n  {\n    \"id\": 4,\n    \"description\": \"Create a new job detail and set its data map with the time interval.\",\n    \"code\": \"\\t\\tjob = newJob( SupplyMailJob.class ).withIdentity( \\\"supplyMailJob\\\", \\\"group\\\" ).build(); //f:quartz\\n\\t\\tjob.getJobDataMap().put( \\\"timeInterval\\\", this.timeInterval ); //f:quartz\",\n    \"start_line\": 81,\n    \"end_line\": 82\n  },\n  {\n    \"id\": 5,\n    \"description\": \"Create a trigger with a cron schedule based on the time interval.\",\n    \"code\": \"\\t\\tTrigger trigger = newTrigger().withIdentity( \\\"supplyMailTrigger\\\", \\\"group\\\" ).startNow().withSchedule( CronScheduleBuilder.cronSchedule( \\\"0 0/\\\"\\n\\t\\t\\t\\t+ (this.timeInterval * 60) + \\\" * * * ?\\\" ) ).build(); //f:quartz\",\n    \"start_line\": 84,\n    \"end_line\": 85\n  },\n  {\n    \"id\": 6,\n    \"description\": \"Schedule the job with the trigger.\",\n    \"code\": \"\\t\\tsc.scheduleJob( job, trigger ); //f:quartz\",\n    \"start_line\": 87,\n    \"end_line\": 87\n  },\n  {\n    \"id\": 7,\n    \"description\": \"Log the end of the scheduling process and return the INPUT constant.\",\n    \"code\": \"\\t\\tlogger.info( \\\"Finishing schedule()\\\" ); //f:log\\n\\t\\treturn INPUT;\",\n    \"start_line\": 89,\n    \"end_line\": 90\n  }\n]\n```"
  },
  {
    "class_name": "classes.SupplyMailJob",
    "function_name": "execute(JobExecutionContext)",
    "analysis": "### Step 1: Summarise the Focal Method\n\nThe `execute` method in the `SupplyMailJob` class is responsible for executing a scheduled job that checks the supply of products in a database. If any products have a supply level below a certain threshold, it sends an email notification listing these products. The method performs the following key tasks:\n1. Logs the start of the execution.\n2. Opens a Hibernate session and begins a transaction to query products with low supply.\n3. Constructs an email message if low-supply products are found.\n4. Sends the email using JavaMail API.\n5. Logs the completion of the execution.\n\n### Step 2: List Necessary Environment Settings to Run the Focal Method\n\n**Invoked Parameters and Fields:**\n- `JobExecutionContext context`: The context in which the job is executed.\n- `this.host`: SMTP host for sending emails.\n- `this.from`: Email address from which the notification is sent.\n- `this.to`: Email address to which the notification is sent.\n\n**Invoked Methods:**\n- `HibernateUtil.getSessionFactory()`: Retrieves the Hibernate `SessionFactory`.\n- `Product.getSupply()`: Gets the supply level of a product.\n- `Product.getName()`: Gets the name of a product.\n\n### Step 3: Decompose the Focal Method into Multiple Problem-Solving Steps",
    "slices": [
      {
        "id": 1,
        "description": "Log the start of the job execution.",
        "code": "\t\tlogger.info( \"Starting execute() in job\" ); //f:log",
        "start_line": 31,
        "end_line": 31
      },
      {
        "id": 2,
        "description": "Open a Hibernate session and begin a transaction to query products with low supply.",
        "code": "\t\torg.hibernate.Session sess = HibernateUtil.getSessionFactory().openSession(); //f:hibernate\n\t\tTransaction t = sess.beginTransaction(); //f:hibernate\n\n\t\tCriteria criteria = sess.createCriteria( Product.class ); //f:hibernate\n\t\tcriteria.add( Restrictions.lt( \"supply\", 5 ) ); //f:hibernate\n\n\t\t@SuppressWarnings(\"unchecked\")\n\t\tList<Product> l = (List<Product>) criteria.list(); //f:hibernate\n\t\tt.commit(); //f:hibernate\n\t\tsess.close(); //f:hibernate",
        "start_line": 33,
        "end_line": 42
      },
      {
        "id": 3,
        "description": "Check if there are products with low supply and prepare the email content.",
        "code": "\t\tif ( !l.isEmpty() ) {\n\t\t\tStringBuilder str = new StringBuilder();\n\t\t\tstr.append( \"The following products are getting over:\\n\" );",
        "start_line": 44,
        "end_line": 46
      },
      {
        "id": 4,
        "description": "Set up email properties and session for sending the notification.",
        "code": "\t\t\tProperties props = new Properties(); //f:mail\n\t\t\tprops.setProperty( \"mail.smtp.submitter\", \"terra\" ); //f:mail\n\t\t\tprops.setProperty( \"mail.smtp.auth\", \"false\" ); //f:mail\n\t\t\tprops.setProperty( \"mail.smtp.host\", this.host ); //f:mail\n\t\t\tprops.setProperty( \"mail.smtp.port\", \"25\" ); //f:mail\n\n\t\t\tjavax.mail.Session session = javax.mail.Session.getInstance( props ); //f:mail",
        "start_line": 48,
        "end_line": 54
      },
      {
        "id": 5,
        "description": "Create and send the email message with the list of low-supply products.",
        "code": "\t\t\ttry { //f:mail\n\t\t\t\tMessage msg = new MimeMessage( session ); //f:mail\n\n\t\t\t\tmsg.setFrom( new InternetAddress( this.from ) ); //f:mail\n\t\t\t\tInternetAddress[] address = { new InternetAddress( this.to ) }; //f:mail\n\t\t\t\tmsg.setRecipients( Message.RecipientType.TO, address ); //f:mail\n\t\t\t\tmsg.setSubject( \"Low Supply of Products\" ); //f:mail\n\t\t\t\tmsg.setSentDate( new Date() ); //f:mail\n\n\t\t\t\tmsg.setText( str.toString() ); //f:mail\n\n\t\t\t\tTransport.send( msg ); //f:mail\n\t\t\t} catch (MessagingException mex) {\n\t\t\t\tmex.printStackTrace();\n\t\t\t}",
        "start_line": 56,
        "end_line": 70
      },
      {
        "id": 6,
        "description": "Append the details of each low-supply product to the email content.",
        "code": "\t\t\tfor ( Product p : l ) {\n\t\t\t\tstr.append( p.getName() + \"\\t\\t\" + p.getSupply() + \"\\n\" );\n\t\t\t}",
        "start_line": 72,
        "end_line": 74
      },
      {
        "id": 7,
        "description": "Log the completion of the job execution.",
        "code": "\t\tlogger.info( \"Finishing execute() in job\" ); //f:log",
        "start_line": 77,
        "end_line": 77
      }
    ],
    "full_response": "### Step 1: Summarise the Focal Method\n\nThe `execute` method in the `SupplyMailJob` class is responsible for executing a scheduled job that checks the supply of products in a database. If any products have a supply level below a certain threshold, it sends an email notification listing these products. The method performs the following key tasks:\n1. Logs the start of the execution.\n2. Opens a Hibernate session and begins a transaction to query products with low supply.\n3. Constructs an email message if low-supply products are found.\n4. Sends the email using JavaMail API.\n5. Logs the completion of the execution.\n\n### Step 2: List Necessary Environment Settings to Run the Focal Method\n\n**Invoked Parameters and Fields:**\n- `JobExecutionContext context`: The context in which the job is executed.\n- `this.host`: SMTP host for sending emails.\n- `this.from`: Email address from which the notification is sent.\n- `this.to`: Email address to which the notification is sent.\n\n**Invoked Methods:**\n- `HibernateUtil.getSessionFactory()`: Retrieves the Hibernate `SessionFactory`.\n- `Product.getSupply()`: Gets the supply level of a product.\n- `Product.getName()`: Gets the name of a product.\n\n### Step 3: Decompose the Focal Method into Multiple Problem-Solving Steps\n\n```json\n[\n  {\n    \"id\": 1,\n    \"description\": \"Log the start of the job execution.\",\n    \"code\": \"\\t\\tlogger.info( \\\"Starting execute() in job\\\" ); //f:log\",\n    \"start_line\": 31,\n    \"end_line\": 31\n  },\n  {\n    \"id\": 2,\n    \"description\": \"Open a Hibernate session and begin a transaction to query products with low supply.\",\n    \"code\": \"\\t\\torg.hibernate.Session sess = HibernateUtil.getSessionFactory().openSession(); //f:hibernate\\n\\t\\tTransaction t = sess.beginTransaction(); //f:hibernate\\n\\n\\t\\tCriteria criteria = sess.createCriteria( Product.class ); //f:hibernate\\n\\t\\tcriteria.add( Restrictions.lt( \\\"supply\\\", 5 ) ); //f:hibernate\\n\\n\\t\\t@SuppressWarnings(\\\"unchecked\\\")\\n\\t\\tList<Product> l = (List<Product>) criteria.list(); //f:hibernate\\n\\t\\tt.commit(); //f:hibernate\\n\\t\\tsess.close(); //f:hibernate\",\n    \"start_line\": 33,\n    \"end_line\": 42\n  },\n  {\n    \"id\": 3,\n    \"description\": \"Check if there are products with low supply and prepare the email content.\",\n    \"code\": \"\\t\\tif ( !l.isEmpty() ) {\\n\\t\\t\\tStringBuilder str = new StringBuilder();\\n\\t\\t\\tstr.append( \\\"The following products are getting over:\\\\n\\\" );\",\n    \"start_line\": 44,\n    \"end_line\": 46\n  },\n  {\n    \"id\": 4,\n    \"description\": \"Set up email properties and session for sending the notification.\",\n    \"code\": \"\\t\\t\\tProperties props = new Properties(); //f:mail\\n\\t\\t\\tprops.setProperty( \\\"mail.smtp.submitter\\\", \\\"terra\\\" ); //f:mail\\n\\t\\t\\tprops.setProperty( \\\"mail.smtp.auth\\\", \\\"false\\\" ); //f:mail\\n\\t\\t\\tprops.setProperty( \\\"mail.smtp.host\\\", this.host ); //f:mail\\n\\t\\t\\tprops.setProperty( \\\"mail.smtp.port\\\", \\\"25\\\" ); //f:mail\\n\\n\\t\\t\\tjavax.mail.Session session = javax.mail.Session.getInstance( props ); //f:mail\",\n    \"start_line\": 48,\n    \"end_line\": 54\n  },\n  {\n    \"id\": 5,\n    \"description\": \"Create and send the email message with the list of low-supply products.\",\n    \"code\": \"\\t\\t\\ttry { //f:mail\\n\\t\\t\\t\\tMessage msg = new MimeMessage( session ); //f:mail\\n\\n\\t\\t\\t\\tmsg.setFrom( new InternetAddress( this.from ) ); //f:mail\\n\\t\\t\\t\\tInternetAddress[] address = { new InternetAddress( this.to ) }; //f:mail\\n\\t\\t\\t\\tmsg.setRecipients( Message.RecipientType.TO, address ); //f:mail\\n\\t\\t\\t\\tmsg.setSubject( \\\"Low Supply of Products\\\" ); //f:mail\\n\\t\\t\\t\\tmsg.setSentDate( new Date() ); //f:mail\\n\\n\\t\\t\\t\\tmsg.setText( str.toString() ); //f:mail\\n\\n\\t\\t\\t\\tTransport.send( msg ); //f:mail\\n\\t\\t\\t} catch (MessagingException mex) {\\n\\t\\t\\t\\tmex.printStackTrace();\\n\\t\\t\\t}\",\n    \"start_line\": 56,\n    \"end_line\": 70\n  },\n  {\n    \"id\": 6,\n    \"description\": \"Append the details of each low-supply product to the email content.\",\n    \"code\": \"\\t\\t\\tfor ( Product p : l ) {\\n\\t\\t\\t\\tstr.append( p.getName() + \\\"\\\\t\\\\t\\\" + p.getSupply() + \\\"\\\\n\\\" );\\n\\t\\t\\t}\",\n    \"start_line\": 72,\n    \"end_line\": 74\n  },\n  {\n    \"id\": 7,\n    \"description\": \"Log the completion of the job execution.\",\n    \"code\": \"\\t\\tlogger.info( \\\"Finishing execute() in job\\\" ); //f:log\",\n    \"start_line\": 77,\n    \"end_line\": 77\n  }\n]\n```"
  }
]