{
  "fullClassName": "ca.ualberta.cs.serl.wikidev.city3d.CityLayout",
  "className": "CityLayout",
  "index": 20,
  "modifier": "[public ]",
  "extend": "[Layout]",
  "implement": "[]",
  "packageName": "ca.ualberta.cs.serl.wikidev.city3d",
  "packageDeclaration": "package ca.ualberta.cs.serl.wikidev.city3d;",
  "classSignature": "public class CityLayout",
  "hasConstructor": true,
  "isPublic": true,
  "isInterface": false,
  "isAbstract": false,
  "imports": [
    "import java.io.BufferedWriter;",
    "import java.io.FileWriter;",
    "import java.io.IOException;",
    "import java.sql.SQLException;",
    "import java.sql.Timestamp;",
    "import java.util.ArrayList;",
    "import java.util.HashMap;",
    "import ca.ualberta.cs.serl.wikidev.DataManager;",
    "import ca.ualberta.cs.serl.wikidev.RelationshipMiner;",
    "import ca.ualberta.cs.serl.wikidev.User;",
    "import ca.ualberta.cs.serl.wikidev.artifacts.ChangeSet;",
    "import ca.ualberta.cs.serl.wikidev.artifacts.IArtifact;",
    "import ca.ualberta.cs.serl.wikidev.artifacts.Message;",
    "import ca.ualberta.cs.serl.wikidev.artifacts.SVNFile;",
    "import ca.ualberta.cs.serl.wikidev.artifacts.Ticket;",
    "import ca.ualberta.cs.serl.wikidev.artifacts.TicketChange;",
    "import ca.ualberta.cs.serl.wikidev.artifacts.Wiki;",
    "import ca.ualberta.cs.serl.wikidev.city3d.animation.CommunicationBuildingData;",
    "import ca.ualberta.cs.serl.wikidev.city3d.animation.UserData;"
  ],
  "fields": [
    "public static final String CITY_TYPE = \"communications\";",
    "private ArrayList<Message> messages;",
    "private int projectid;"
  ],
  "superClasses": [
    "Layout"
  ],
  "implementedTypes": [],
  "methodSigs": {
    "getMessageCount(ArrayList)": "0",
    "getMessageCountBeforeDate(ArrayList, Timestamp)": "1",
    "getMessageUserContributionBeforeDate(Timestamp, ArrayList, Message, ArrayList)": "2",
    "prepareToWriteCitySnapshots(Timestamp, Timestamp)": "3",
    "printCityBlocks(ArrayList, HashMap)": "4",
    "CityLayout(ArrayList, RelationshipMiner, int)": "5"
  },
  "methodsBrief": [
    "private HashMap<Message, Integer> getMessageCount(ArrayList<Message> messages){}",
    "public HashMap<Message, Integer> getMessageCountBeforeDate(ArrayList<Message> messages, Timestamp timestamp){}",
    "public HashMap<User, Double> getMessageUserContributionBeforeDate(Timestamp timestamp, ArrayList<User> users, Message message, ArrayList<Message> messages){}",
    "public void prepareToWriteCitySnapshots(Timestamp start, Timestamp end){}",
    "public static void printCityBlocks(ArrayList<CityBlock> blocks, HashMap<Message, Integer> messageCount)\r\n\t\t\tthrows IOException{}",
    "public CityLayout(ArrayList<IArtifact> newArtifacts, RelationshipMiner rm, int projectid)\r\n\t\t\tthrows IOException{}"
  ],
  "constructorSigs": [
    "CityLayout(ArrayList, RelationshipMiner, int)"
  ],
  "constructorBrief": [
    "public CityLayout(ArrayList<IArtifact> newArtifacts, RelationshipMiner rm, int projectid)\r\n\t\t\tthrows IOException{}"
  ],
  "getterSetterSigs": [],
  "getterSetterBrief": [],
  "constructorDeps": {
    "ca.ualberta.cs.serl.wikidev.RelationshipMiner": [
      "getDistanceMatrix()"
    ],
    "java.io.PrintStream": [
      "print(String)",
      "println(String)"
    ],
    "java.util.ArrayList": [
      "add(E)"
    ],
    "ca.ualberta.cs.serl.wikidev.city3d.Layout": [
      "getLayout(IArtifact>, double[][])"
    ],
    "ca.ualberta.cs.serl.wikidev.city3d.CityLayout": [
      "getMessageCount(Message>)"
    ]
  },
  "compilationUnitCode": "package ca.ualberta.cs.serl.wikidev.city3d;\n\nimport java.io.BufferedWriter;\nimport java.io.FileWriter;\nimport java.io.IOException;\nimport java.sql.SQLException;\nimport java.sql.Timestamp;\nimport java.util.ArrayList;\nimport java.util.HashMap;\nimport ca.ualberta.cs.serl.wikidev.DataManager;\nimport ca.ualberta.cs.serl.wikidev.RelationshipMiner;\nimport ca.ualberta.cs.serl.wikidev.User;\nimport ca.ualberta.cs.serl.wikidev.artifacts.ChangeSet;\nimport ca.ualberta.cs.serl.wikidev.artifacts.IArtifact;\nimport ca.ualberta.cs.serl.wikidev.artifacts.Message;\nimport ca.ualberta.cs.serl.wikidev.artifacts.SVNFile;\nimport ca.ualberta.cs.serl.wikidev.artifacts.Ticket;\nimport ca.ualberta.cs.serl.wikidev.artifacts.TicketChange;\nimport ca.ualberta.cs.serl.wikidev.artifacts.Wiki;\nimport ca.ualberta.cs.serl.wikidev.city3d.animation.CommunicationBuildingData;\nimport ca.ualberta.cs.serl.wikidev.city3d.animation.UserData;\n\npublic class CityLayout extends Layout {\n\n    public static final String CITY_TYPE = \"communications\";\n\n    private ArrayList<Message> messages;\n\n    private int projectid;\n\n    public CityLayout(ArrayList<IArtifact> newArtifacts, RelationshipMiner rm, int projectid) throws IOException {\n        this.projectid = projectid;\n        System.out.print(\"pch<-c(\");\n        messages = new ArrayList<Message>();\n        for (IArtifact artifact : newArtifacts) {\n            if (artifact instanceof Ticket) {\n                System.out.print(\"\\'*\\', \");\n            } else if (artifact instanceof Wiki) {\n                System.out.print(\"\\'o\\', \");\n            } else if (artifact instanceof Message) {\n                System.out.print(\"\\'+\\', \");\n                Message message = (Message) artifact;\n                messages.add(message);\n            } else if (artifact instanceof ChangeSet) {\n                System.out.print(\"\\'$\\', \");\n            }\n        }\n        System.out.println(\")\");\n        System.out.println(\"MDS start\");\n        double[][] distanceMatrix = rm.getDistanceMatrix();\n        this.getLayout(newArtifacts, distanceMatrix);\n        HashMap<Message, Integer> messageCount = getMessageCount(messages);\n        // printCityBlocks(cityBlocks, messageCount);\n    }\n\n    private HashMap<Message, Integer> getMessageCount(ArrayList<Message> messages) {\n        HashMap<Message, Integer> messageCount = new HashMap<Message, Integer>();\n        for (Message message1 : messages) {\n            int count = 1;\n            for (Message message2 : messages) {\n                if (message1.getRefid_header().equals(message2.getRefid_header())) {\n                    count++;\n                }\n            }\n            messageCount.put(message1, count);\n        }\n        return messageCount;\n    }\n\n    public HashMap<Message, Integer> getMessageCountBeforeDate(ArrayList<Message> messages, Timestamp timestamp) {\n        HashMap<Message, Integer> messageCount = new HashMap<Message, Integer>();\n        for (Message message1 : messages) {\n            int count = 1;\n            for (Message message2 : messages) {\n                if (message1.getTimestamp().before(timestamp) && message2.getTimestamp().before(timestamp) && message1.getRefid_header().equals(message2.getRefid_header())) {\n                    count++;\n                }\n            }\n            messageCount.put(message1, count);\n        }\n        return messageCount;\n    }\n\n    public HashMap<User, Double> getMessageUserContributionBeforeDate(Timestamp timestamp, ArrayList<User> users, Message message, ArrayList<Message> messages) {\n        HashMap<User, Double> userChanges = new HashMap<User, Double>();\n        for (User user : users) {\n            if (message.getOwner().equals(user)) {\n                userChanges.put(user, 1.0);\n            } else {\n                userChanges.put(user, 0.0);\n            }\n        }\n        int count = 1;\n        for (Message message2 : messages) {\n            if (message.getTimestamp().before(timestamp) && message2.getTimestamp().before(timestamp) && message.getRefid_header().equals(message2.getRefid_header())) {\n                count++;\n                for (User user : users) {\n                    if (message2.getOwner().equals(user)) {\n                        userChanges.put(user, userChanges.get(user) + 1);\n                    }\n                }\n            }\n        }\n        for (User user : userChanges.keySet()) {\n            userChanges.put(user, userChanges.get(user) / (double) count);\n        }\n        return userChanges;\n    }\n\n    public void prepareToWriteCitySnapshots(Timestamp start, Timestamp end) {\n        Timestamp firstWeek = new Timestamp(start.getTime() + DataManager.WEEK_INTERVAL_IN_MILLIS);\n        for (long l = firstWeek.getTime(); l < end.getTime() + DataManager.WEEK_INTERVAL_IN_MILLIS; l += DataManager.WEEK_INTERVAL_IN_MILLIS) {\n            if (l > end.getTime()) {\n                l = end.getTime();\n            }\n            Timestamp nextWeek = new Timestamp(l);\n            for (CityBlock block : cityBlocks) {\n                for (IArtifact artifact : block.getArtifacts().keySet()) {\n                    System.out.println(\"Writing \" + artifact.toString());\n                    String type = \"\";\n                    int height = 0;\n                    HashMap<User, Double> userContribution = null;\n                    int id = 0;\n                    String url = \"\";\n                    User lastEditor = null;\n                    Timestamp created = null;\n                    Timestamp lastModified = null;\n                    if (artifact instanceof Ticket) {\n                        Ticket ticket = (Ticket) artifact;\n                        type = \"Ticket\";\n                        height = 6 - Integer.parseInt(\"\" + ticket.getLastPriorityBeforeDate(nextWeek).charAt(1));\n                        userContribution = ticket.getUserContributionBeforeDate(nextWeek, this.getUsers(projectid));\n                        id = ticket.getTicketID();\n                        url = \"http://hypatia.cs.ualberta.ca/ucosp/index.php/UCOSP_Index:Ticket_Index\";\n                        ticket.setCreated(ticket.getDateOpened());\n                        ticket.setLastEditorAndTimeLastModifiedBeforeDate(nextWeek);\n                        lastEditor = ticket.getLastEditor();\n                        created = ticket.getCreated();\n                        lastModified = ticket.getLastModified();\n                    } else if (artifact instanceof Message) {\n                        type = \"Message\";\n                        Message message = (Message) artifact;\n                        height = this.getMessageCountBeforeDate(messages, nextWeek).get(message);\n                        userContribution = getMessageUserContributionBeforeDate(nextWeek, getUsers(projectid), message, messages);\n                        id = message.getCommunicationID();\n                        try {\n                            url = Layout.URLprefix + DataManager.getProjectByID(projectid).getProjectName() + \"_Mail:\" + message.getSubject().replace(' ', '_');\n                        } catch (SQLException e) {\n                            // TODO Auto-generated catch block\n                            e.printStackTrace();\n                        }\n                        message.setLastEditorAndTimeLastModifiedBeforeDate(nextWeek);\n                        message.setCreated(message.getTimestamp());\n                        lastEditor = message.getLastEditor();\n                        created = message.getCreated();\n                        lastModified = message.getLastModified();\n                    } else if (artifact instanceof Wiki) {\n                        type = \"Wiki\";\n                        Wiki wiki = (Wiki) artifact;\n                        height = wiki.getNumberOfRevisionsBeforeDate(nextWeek);\n                        userContribution = wiki.getUserContributionBeforeDate(nextWeek, getUsers(projectid));\n                        id = wiki.getPage_id();\n                        try {\n                            url = Layout.URLprefix + DataManager.getProjectByID(projectid).getProjectName() + wiki.getPage_title();\n                        } catch (SQLException e) {\n                            // TODO Auto-generated catch block\n                            e.printStackTrace();\n                        }\n                        wiki.setCreated(wiki.getRevisions().get(0).getRev_timestamp());\n                        wiki.setLastEditorAndTimeLastModifiedBeforeDate(nextWeek);\n                        lastEditor = wiki.getLastEditor();\n                        created = wiki.getCreated();\n                        lastModified = wiki.getLastModified();\n                    }\n                    ArrayList<UserData> userData = new ArrayList<UserData>();\n                    for (User user : userContribution.keySet()) {\n                        userData.add(new UserData(user.getUserName(), user.getColor().getRed(), user.getColor().getGreen(), user.getColor().getBlue(), userContribution.get(user), nextWeek, CityLayout.CITY_TYPE));\n                    }\n                    CommunicationBuildingData building = new CommunicationBuildingData(type, id, nextWeek, height, block.getIndex().x, block.getIndex().y, block.getArtifacts().get(artifact), url, projectid, userData, lastEditor, created, lastModified);\n                    try {\n                        DataManager.writeCommunicationsBuildingData(building);\n                    } catch (SQLException e) {\n                        // TODO Auto-generated catch block\n                        e.printStackTrace();\n                    }\n                }\n            }\n        }\n    }\n\n    public static void printCityBlocks(ArrayList<CityBlock> blocks, HashMap<Message, Integer> messageCount) throws IOException {\n        // BufferedWriter out = new BufferedWriter(new\n        // FileWriter(\"C:\\\\Documents and Settings\\\\Marios Fokaefs\\\\Desktop\\\\wikidev-files\\\\ucosp\\\\clusters\"+week+\".txt\"));\n        BufferedWriter out = new BufferedWriter(new FileWriter(\"C:\\\\Documents and Settings\\\\Marios Fokaefs\\\\Desktop\\\\wikidev-files\\\\c301f09\\\\cityBlocks.txt\"));\n        int index = 1;\n        out.write(\"\" + Math.sqrt(blocks.size()));\n        out.newLine();\n        for (CityBlock block : blocks) {\n            for (IArtifact artifact : block.getArtifacts().keySet()) {\n                String type = \"\" + index + \"\\t\";\n                int height = 0;\n                String line = \"\";\n                if (artifact instanceof Ticket) {\n                    Ticket ticket = (Ticket) artifact;\n                    type += \"Ticket\";\n                    height = 6 - ticket.getPriority();\n                } else if (artifact instanceof Message) {\n                    type += \"Message\";\n                    Message message = (Message) artifact;\n                    height = messageCount.get(message);\n                } else if (artifact instanceof Wiki) {\n                    Wiki wiki = (Wiki) artifact;\n                    type += \"Wiki\";\n                    height = wiki.getRevisions().size();\n                }\n                line += type + \"\\t\" + block.getIndex().x + \"\\t\" + block.getIndex().y + \"\\t\" + block.getArtifacts().get(artifact) + \"\\t\" + height + \"\\t\";\n                for (User user : artifact.getAssociatedUsers()) {\n                    line += \"<\" + user.getUserName() + \", \" + user.getColor().getRed() + \", \" + user.getColor().getGreen() + \", \" + user.getColor().getBlue() + \"> \\t\";\n                }\n                out.write(line);\n                out.newLine();\n                index++;\n            }\n        }\n        out.close();\n    }\n}\n",
  "classDeclarationCode": "public class CityLayout extends Layout {\n\n    public static final String CITY_TYPE = \"communications\";\n\n    private ArrayList<Message> messages;\n\n    private int projectid;\n\n    public CityLayout(ArrayList<IArtifact> newArtifacts, RelationshipMiner rm, int projectid) throws IOException {\n        this.projectid = projectid;\n        System.out.print(\"pch<-c(\");\n        messages = new ArrayList<Message>();\n        for (IArtifact artifact : newArtifacts) {\n            if (artifact instanceof Ticket) {\n                System.out.print(\"\\'*\\', \");\n            } else if (artifact instanceof Wiki) {\n                System.out.print(\"\\'o\\', \");\n            } else if (artifact instanceof Message) {\n                System.out.print(\"\\'+\\', \");\n                Message message = (Message) artifact;\n                messages.add(message);\n            } else if (artifact instanceof ChangeSet) {\n                System.out.print(\"\\'$\\', \");\n            }\n        }\n        System.out.println(\")\");\n        System.out.println(\"MDS start\");\n        double[][] distanceMatrix = rm.getDistanceMatrix();\n        this.getLayout(newArtifacts, distanceMatrix);\n        HashMap<Message, Integer> messageCount = getMessageCount(messages);\n        // printCityBlocks(cityBlocks, messageCount);\n    }\n\n    private HashMap<Message, Integer> getMessageCount(ArrayList<Message> messages) {\n        HashMap<Message, Integer> messageCount = new HashMap<Message, Integer>();\n        for (Message message1 : messages) {\n            int count = 1;\n            for (Message message2 : messages) {\n                if (message1.getRefid_header().equals(message2.getRefid_header())) {\n                    count++;\n                }\n            }\n            messageCount.put(message1, count);\n        }\n        return messageCount;\n    }\n\n    public HashMap<Message, Integer> getMessageCountBeforeDate(ArrayList<Message> messages, Timestamp timestamp) {\n        HashMap<Message, Integer> messageCount = new HashMap<Message, Integer>();\n        for (Message message1 : messages) {\n            int count = 1;\n            for (Message message2 : messages) {\n                if (message1.getTimestamp().before(timestamp) && message2.getTimestamp().before(timestamp) && message1.getRefid_header().equals(message2.getRefid_header())) {\n                    count++;\n                }\n            }\n            messageCount.put(message1, count);\n        }\n        return messageCount;\n    }\n\n    public HashMap<User, Double> getMessageUserContributionBeforeDate(Timestamp timestamp, ArrayList<User> users, Message message, ArrayList<Message> messages) {\n        HashMap<User, Double> userChanges = new HashMap<User, Double>();\n        for (User user : users) {\n            if (message.getOwner().equals(user)) {\n                userChanges.put(user, 1.0);\n            } else {\n                userChanges.put(user, 0.0);\n            }\n        }\n        int count = 1;\n        for (Message message2 : messages) {\n            if (message.getTimestamp().before(timestamp) && message2.getTimestamp().before(timestamp) && message.getRefid_header().equals(message2.getRefid_header())) {\n                count++;\n                for (User user : users) {\n                    if (message2.getOwner().equals(user)) {\n                        userChanges.put(user, userChanges.get(user) + 1);\n                    }\n                }\n            }\n        }\n        for (User user : userChanges.keySet()) {\n            userChanges.put(user, userChanges.get(user) / (double) count);\n        }\n        return userChanges;\n    }\n\n    public void prepareToWriteCitySnapshots(Timestamp start, Timestamp end) {\n        Timestamp firstWeek = new Timestamp(start.getTime() + DataManager.WEEK_INTERVAL_IN_MILLIS);\n        for (long l = firstWeek.getTime(); l < end.getTime() + DataManager.WEEK_INTERVAL_IN_MILLIS; l += DataManager.WEEK_INTERVAL_IN_MILLIS) {\n            if (l > end.getTime()) {\n                l = end.getTime();\n            }\n            Timestamp nextWeek = new Timestamp(l);\n            for (CityBlock block : cityBlocks) {\n                for (IArtifact artifact : block.getArtifacts().keySet()) {\n                    System.out.println(\"Writing \" + artifact.toString());\n                    String type = \"\";\n                    int height = 0;\n                    HashMap<User, Double> userContribution = null;\n                    int id = 0;\n                    String url = \"\";\n                    User lastEditor = null;\n                    Timestamp created = null;\n                    Timestamp lastModified = null;\n                    if (artifact instanceof Ticket) {\n                        Ticket ticket = (Ticket) artifact;\n                        type = \"Ticket\";\n                        height = 6 - Integer.parseInt(\"\" + ticket.getLastPriorityBeforeDate(nextWeek).charAt(1));\n                        userContribution = ticket.getUserContributionBeforeDate(nextWeek, this.getUsers(projectid));\n                        id = ticket.getTicketID();\n                        url = \"http://hypatia.cs.ualberta.ca/ucosp/index.php/UCOSP_Index:Ticket_Index\";\n                        ticket.setCreated(ticket.getDateOpened());\n                        ticket.setLastEditorAndTimeLastModifiedBeforeDate(nextWeek);\n                        lastEditor = ticket.getLastEditor();\n                        created = ticket.getCreated();\n                        lastModified = ticket.getLastModified();\n                    } else if (artifact instanceof Message) {\n                        type = \"Message\";\n                        Message message = (Message) artifact;\n                        height = this.getMessageCountBeforeDate(messages, nextWeek).get(message);\n                        userContribution = getMessageUserContributionBeforeDate(nextWeek, getUsers(projectid), message, messages);\n                        id = message.getCommunicationID();\n                        try {\n                            url = Layout.URLprefix + DataManager.getProjectByID(projectid).getProjectName() + \"_Mail:\" + message.getSubject().replace(' ', '_');\n                        } catch (SQLException e) {\n                            // TODO Auto-generated catch block\n                            e.printStackTrace();\n                        }\n                        message.setLastEditorAndTimeLastModifiedBeforeDate(nextWeek);\n                        message.setCreated(message.getTimestamp());\n                        lastEditor = message.getLastEditor();\n                        created = message.getCreated();\n                        lastModified = message.getLastModified();\n                    } else if (artifact instanceof Wiki) {\n                        type = \"Wiki\";\n                        Wiki wiki = (Wiki) artifact;\n                        height = wiki.getNumberOfRevisionsBeforeDate(nextWeek);\n                        userContribution = wiki.getUserContributionBeforeDate(nextWeek, getUsers(projectid));\n                        id = wiki.getPage_id();\n                        try {\n                            url = Layout.URLprefix + DataManager.getProjectByID(projectid).getProjectName() + wiki.getPage_title();\n                        } catch (SQLException e) {\n                            // TODO Auto-generated catch block\n                            e.printStackTrace();\n                        }\n                        wiki.setCreated(wiki.getRevisions().get(0).getRev_timestamp());\n                        wiki.setLastEditorAndTimeLastModifiedBeforeDate(nextWeek);\n                        lastEditor = wiki.getLastEditor();\n                        created = wiki.getCreated();\n                        lastModified = wiki.getLastModified();\n                    }\n                    ArrayList<UserData> userData = new ArrayList<UserData>();\n                    for (User user : userContribution.keySet()) {\n                        userData.add(new UserData(user.getUserName(), user.getColor().getRed(), user.getColor().getGreen(), user.getColor().getBlue(), userContribution.get(user), nextWeek, CityLayout.CITY_TYPE));\n                    }\n                    CommunicationBuildingData building = new CommunicationBuildingData(type, id, nextWeek, height, block.getIndex().x, block.getIndex().y, block.getArtifacts().get(artifact), url, projectid, userData, lastEditor, created, lastModified);\n                    try {\n                        DataManager.writeCommunicationsBuildingData(building);\n                    } catch (SQLException e) {\n                        // TODO Auto-generated catch block\n                        e.printStackTrace();\n                    }\n                }\n            }\n        }\n    }\n\n    public static void printCityBlocks(ArrayList<CityBlock> blocks, HashMap<Message, Integer> messageCount) throws IOException {\n        // BufferedWriter out = new BufferedWriter(new\n        // FileWriter(\"C:\\\\Documents and Settings\\\\Marios Fokaefs\\\\Desktop\\\\wikidev-files\\\\ucosp\\\\clusters\"+week+\".txt\"));\n        BufferedWriter out = new BufferedWriter(new FileWriter(\"C:\\\\Documents and Settings\\\\Marios Fokaefs\\\\Desktop\\\\wikidev-files\\\\c301f09\\\\cityBlocks.txt\"));\n        int index = 1;\n        out.write(\"\" + Math.sqrt(blocks.size()));\n        out.newLine();\n        for (CityBlock block : blocks) {\n            for (IArtifact artifact : block.getArtifacts().keySet()) {\n                String type = \"\" + index + \"\\t\";\n                int height = 0;\n                String line = \"\";\n                if (artifact instanceof Ticket) {\n                    Ticket ticket = (Ticket) artifact;\n                    type += \"Ticket\";\n                    height = 6 - ticket.getPriority();\n                } else if (artifact instanceof Message) {\n                    type += \"Message\";\n                    Message message = (Message) artifact;\n                    height = messageCount.get(message);\n                } else if (artifact instanceof Wiki) {\n                    Wiki wiki = (Wiki) artifact;\n                    type += \"Wiki\";\n                    height = wiki.getRevisions().size();\n                }\n                line += type + \"\\t\" + block.getIndex().x + \"\\t\" + block.getIndex().y + \"\\t\" + block.getArtifacts().get(artifact) + \"\\t\" + height + \"\\t\";\n                for (User user : artifact.getAssociatedUsers()) {\n                    line += \"<\" + user.getUserName() + \", \" + user.getColor().getRed() + \", \" + user.getColor().getGreen() + \", \" + user.getColor().getBlue() + \"> \\t\";\n                }\n                out.write(line);\n                out.newLine();\n                index++;\n            }\n        }\n        out.close();\n    }\n}",
  "subClasses": []
}