{
  "fullClassName": "ca.ualberta.cs.serl.wikidev.TestMain",
  "className": "TestMain",
  "index": 42,
  "modifier": "[public ]",
  "extend": "[]",
  "implement": "[]",
  "packageName": "ca.ualberta.cs.serl.wikidev",
  "packageDeclaration": "package ca.ualberta.cs.serl.wikidev;",
  "classSignature": "public class TestMain",
  "hasConstructor": false,
  "isPublic": true,
  "isInterface": false,
  "isAbstract": false,
  "imports": [
    "import java.sql.SQLException;",
    "import java.sql.Timestamp;",
    "import java.util.ArrayList;",
    "import ca.ualberta.cs.serl.wikidev.city3d.animation.BuildingData;",
    "import ca.ualberta.cs.serl.wikidev.city3d.animation.ClusterData;",
    "import ca.ualberta.cs.serl.wikidev.city3d.animation.CommunicationBuildingData;"
  ],
  "fields": [],
  "superClasses": [],
  "implementedTypes": [],
  "methodSigs": {
    "main(String[])": "0"
  },
  "methodsBrief": [
    "public static void main(String[] args){}"
  ],
  "constructorSigs": [],
  "constructorBrief": [],
  "getterSetterSigs": [],
  "getterSetterBrief": [],
  "constructorDeps": {},
  "compilationUnitCode": "package ca.ualberta.cs.serl.wikidev;\n\nimport java.sql.SQLException;\nimport java.sql.Timestamp;\nimport java.util.ArrayList;\nimport ca.ualberta.cs.serl.wikidev.city3d.animation.BuildingData;\nimport ca.ualberta.cs.serl.wikidev.city3d.animation.ClusterData;\nimport ca.ualberta.cs.serl.wikidev.city3d.animation.CommunicationBuildingData;\n\npublic class TestMain {\n\n    /**\n     * @param args\n     */\n    public static void main(String[] args) {\n        try {\n            String[] args2 = { \"jdbc:mysql://hypatia.cs.ualberta.ca/wikidev_ucosp\", \"fokaefs\", \"filimon9786#7@gr\", \"2009-09-01 00:00:00\", \"2010-01-01 00:00:00\", \"1\", \"weekly\", \"-lb\", \"0.05\", \"-ub\", \"0.95\", \"-i\", \"0.05\" };\n            InvocationParser ip = new InvocationParser();\n            ip.parseArgs(args2);\n            String databaseName = ip.getDatabaseName();\n            String username = ip.getUsername();\n            String password = ip.getPassword();\n            DataManager.openTheConnection(username, password, databaseName);\n            /*ArrayList<CommunicationBuildingData> buildings = DataManager.getCommunicationsBuildingHistory(\"Message\", 99, 1);\n\t\t\tClusterData clustered = DataManager.getClusteredBuildings(buildings.get(buildings.size()-1));\n\t\t\tint countComm=0;\n\t\t\tint countFile=0;\n\t\t\tfor(BuildingData data : clustered.getBuildings().keySet()) {\n\t\t\t\t\n\t\t\t\tif (data instanceof CommunicationBuildingData) {\n\t\t\t\t\tCommunicationBuildingData commData = (CommunicationBuildingData)data;\n\t\t\t\t\tSystem.out.println(commData.getType()+commData.getArtifact_id()+\"\\t\"+clustered.getBuildings().get(data)+\"\\t\"+commData.getWeek());\n\t\t\t\t\tcountComm++;\n\t\t\t\t}\n\t\t\t\telse {\n\t\t\t\t\tcountFile++;\n\t\t\t\t}\n\t\t\t}*/\n            Timestamp start = Timestamp.valueOf(\"2009-09-01 00:00:00\");\n            Timestamp firstWeek = new Timestamp(start.getTime() + DataManager.WEEK_INTERVAL_IN_MILLIS);\n            ArrayList<CommunicationBuildingData> buildings = DataManager.getCommmunicationCitySnapshot(firstWeek, 1);\n            for (CommunicationBuildingData building : buildings) {\n                System.out.println(building.toString());\n            }\n            /*System.out.println(clustered.getTerms().size());\n\t\t\tfor(String term : clustered.getTerms().keySet()) {\n\t\t\t\tSystem.out.println(term+\" \"+clustered.getTerms().get(term));\n\t\t\t}\n\t\t\tSystem.out.println(countComm);\n\t\t\tSystem.out.println(countFile);*/\n            DataManager.closeTheConnection();\n            System.out.println(\"Success!!!\");\n        } catch (SQLException e) {\n            // TODO Auto-generated catch block\n            e.printStackTrace();\n        } catch (Exception e) {\n            // TODO Auto-generated catch block\n            e.printStackTrace();\n        }\n    }\n}\n",
  "classDeclarationCode": "public class TestMain {\n\n    /**\n     * @param args\n     */\n    public static void main(String[] args) {\n        try {\n            String[] args2 = { \"jdbc:mysql://hypatia.cs.ualberta.ca/wikidev_ucosp\", \"fokaefs\", \"filimon9786#7@gr\", \"2009-09-01 00:00:00\", \"2010-01-01 00:00:00\", \"1\", \"weekly\", \"-lb\", \"0.05\", \"-ub\", \"0.95\", \"-i\", \"0.05\" };\n            InvocationParser ip = new InvocationParser();\n            ip.parseArgs(args2);\n            String databaseName = ip.getDatabaseName();\n            String username = ip.getUsername();\n            String password = ip.getPassword();\n            DataManager.openTheConnection(username, password, databaseName);\n            /*ArrayList<CommunicationBuildingData> buildings = DataManager.getCommunicationsBuildingHistory(\"Message\", 99, 1);\n\t\t\tClusterData clustered = DataManager.getClusteredBuildings(buildings.get(buildings.size()-1));\n\t\t\tint countComm=0;\n\t\t\tint countFile=0;\n\t\t\tfor(BuildingData data : clustered.getBuildings().keySet()) {\n\t\t\t\t\n\t\t\t\tif (data instanceof CommunicationBuildingData) {\n\t\t\t\t\tCommunicationBuildingData commData = (CommunicationBuildingData)data;\n\t\t\t\t\tSystem.out.println(commData.getType()+commData.getArtifact_id()+\"\\t\"+clustered.getBuildings().get(data)+\"\\t\"+commData.getWeek());\n\t\t\t\t\tcountComm++;\n\t\t\t\t}\n\t\t\t\telse {\n\t\t\t\t\tcountFile++;\n\t\t\t\t}\n\t\t\t}*/\n            Timestamp start = Timestamp.valueOf(\"2009-09-01 00:00:00\");\n            Timestamp firstWeek = new Timestamp(start.getTime() + DataManager.WEEK_INTERVAL_IN_MILLIS);\n            ArrayList<CommunicationBuildingData> buildings = DataManager.getCommmunicationCitySnapshot(firstWeek, 1);\n            for (CommunicationBuildingData building : buildings) {\n                System.out.println(building.toString());\n            }\n            /*System.out.println(clustered.getTerms().size());\n\t\t\tfor(String term : clustered.getTerms().keySet()) {\n\t\t\t\tSystem.out.println(term+\" \"+clustered.getTerms().get(term));\n\t\t\t}\n\t\t\tSystem.out.println(countComm);\n\t\t\tSystem.out.println(countFile);*/\n            DataManager.closeTheConnection();\n            System.out.println(\"Success!!!\");\n        } catch (SQLException e) {\n            // TODO Auto-generated catch block\n            e.printStackTrace();\n        } catch (Exception e) {\n            // TODO Auto-generated catch block\n            e.printStackTrace();\n        }\n    }\n}",
  "subClasses": []
}