[
  {
    "class_name": "classes.CustomerAction",
    "function_name": "find()",
    "analysis": "### Step 1: Summarise the Focal Method\n\nThe `find()` method in the `classes.CustomerAction` class is responsible for searching for `Customer` entities based on the attributes of a `Customer` object. It uses Hibernate for database interaction and constructs a query using criteria. The method performs the following tasks:\n\n1. Logs the start of the operation.\n2. Opens a Hibernate session and begins a transaction.\n3. Constructs a criteria query based on the `Customer` object's attributes, applying filters like ignoring case, excluding zeroes, and enabling partial matches.\n4. Adds an additional filter if the `Customer` object's ID is not null.\n5. Executes the query and retrieves a list of matching `Customer` entities.\n6. Commits the transaction and closes the session.\n7. Stores the retrieved list in the `request` map.\n8. Sets a task constant and logs the completion of the operation.\n9. Returns a predefined input constant.\n\n---\n\n### Step 2: Necessary Environment Settings to Run the Focal Method\n\n#### Invoked Parameters and Fields:\n- **`this.customer`**: A `Customer` object containing search criteria.\n- **`request`**: A map-like object used to store the result list.\n- **`SystemConstants.CR_MODE`**: A constant used to set the task.\n- **`INPUT`**: A constant string returned by the method.\n\n#### Invoked Methods:\n- **`HibernateUtil.getSessionFactory()`**: Retrieves the Hibernate `SessionFactory`.\n- **`sess.openSession()`**: Opens a Hibernate session.\n- **`sess.beginTransaction()`**: Begins a transaction.\n- **`sess.createCriteria(Customer.class)`**: Creates a criteria query for the `Customer` class.\n- **`Example.create(this.customer)`**: Creates an example query based on the `Customer` object.\n- **`criteria.add(Restrictions.idEq(this.customer.getId()))`**: Adds a filter for the `Customer` ID.\n- **`criteria.list()`**: Executes the query and retrieves the result list.\n- **`t.commit()`**: Commits the transaction.\n- **`sess.close()`**: Closes the session.\n- **`logger.info()`**: Logs messages.\n\n---\n\n### Step 3: Decomposition of the Focal Method",
    "slices": [
      {
        "id": 1,
        "description": "Log the start of the method execution to track its lifecycle.",
        "code": "\t\tlogger.info( \"Starting find()\" ); //f:log",
        "start_line": 87,
        "end_line": 87
      },
      {
        "id": 2,
        "description": "Initialize a Hibernate session and begin a transaction to interact with the database.",
        "code": "\t\tSession sess = HibernateUtil.getSessionFactory().openSession(); //f:hibernate\n\t\tTransaction t = sess.beginTransaction(); //f:hibernate",
        "start_line": 88,
        "end_line": 89
      },
      {
        "id": 3,
        "description": "Create a criteria query for the Customer class using Hibernate.",
        "code": "\t\tCriteria criteria = sess.createCriteria( Customer.class ); //f:hibernate",
        "start_line": 91,
        "end_line": 91
      },
      {
        "id": 4,
        "description": "Add filters to the criteria query based on the Customer object's attributes, enabling partial matches, ignoring case, and excluding zeroes.",
        "code": "\t\tcriteria.add( Example.create( this.customer ).excludeZeroes().ignoreCase().enableLike( MatchMode.ANYWHERE ) ); //f:hibernate",
        "start_line": 93,
        "end_line": 93
      },
      {
        "id": 5,
        "description": "Add an additional filter to the criteria query if the Customer object's ID is not null.",
        "code": "\t\tif ( this.customer.getId() != null ) { //f:hibernate\n\t\t\tcriteria.add( Restrictions.idEq( this.customer.getId() ) ); //f:hibernate\n\t\t} //f:hibernate",
        "start_line": 94,
        "end_line": 96
      },
      {
        "id": 6,
        "description": "Execute the criteria query and retrieve the list of matching Customer entities.",
        "code": "\t\t@SuppressWarnings(\"unchecked\")\n\t\tList<Customer> l = (List<Customer>) criteria.list(); //f:hibernate",
        "start_line": 98,
        "end_line": 99
      },
      {
        "id": 7,
        "description": "Commit the transaction and close the Hibernate session to ensure proper resource management.",
        "code": "\t\tt.commit(); //f:hibernate\n\t\tsess.close(); //f:hibernate",
        "start_line": 100,
        "end_line": 101
      },
      {
        "id": 8,
        "description": "Store the retrieved list of Customer entities in the request map for further processing.",
        "code": "\t\trequest.put( \"list\", l );",
        "start_line": 102,
        "end_line": 102
      },
      {
        "id": 9,
        "description": "Set the task constant to indicate the current mode of operation.",
        "code": "\t\tthis.task = SystemConstants.CR_MODE;",
        "start_line": 104,
        "end_line": 104
      },
      {
        "id": 10,
        "description": "Log the completion of the method execution to track its lifecycle.",
        "code": "\t\tlogger.info( \"Finishing find()\" ); //f:log",
        "start_line": 105,
        "end_line": 105
      },
      {
        "id": 11,
        "description": "Return the predefined input constant to indicate the result of the method.",
        "code": "\t\treturn INPUT;",
        "start_line": 106,
        "end_line": 106
      }
    ],
    "full_response": "### Step 1: Summarise the Focal Method\n\nThe `find()` method in the `classes.CustomerAction` class is responsible for searching for `Customer` entities based on the attributes of a `Customer` object. It uses Hibernate for database interaction and constructs a query using criteria. The method performs the following tasks:\n\n1. Logs the start of the operation.\n2. Opens a Hibernate session and begins a transaction.\n3. Constructs a criteria query based on the `Customer` object's attributes, applying filters like ignoring case, excluding zeroes, and enabling partial matches.\n4. Adds an additional filter if the `Customer` object's ID is not null.\n5. Executes the query and retrieves a list of matching `Customer` entities.\n6. Commits the transaction and closes the session.\n7. Stores the retrieved list in the `request` map.\n8. Sets a task constant and logs the completion of the operation.\n9. Returns a predefined input constant.\n\n---\n\n### Step 2: Necessary Environment Settings to Run the Focal Method\n\n#### Invoked Parameters and Fields:\n- **`this.customer`**: A `Customer` object containing search criteria.\n- **`request`**: A map-like object used to store the result list.\n- **`SystemConstants.CR_MODE`**: A constant used to set the task.\n- **`INPUT`**: A constant string returned by the method.\n\n#### Invoked Methods:\n- **`HibernateUtil.getSessionFactory()`**: Retrieves the Hibernate `SessionFactory`.\n- **`sess.openSession()`**: Opens a Hibernate session.\n- **`sess.beginTransaction()`**: Begins a transaction.\n- **`sess.createCriteria(Customer.class)`**: Creates a criteria query for the `Customer` class.\n- **`Example.create(this.customer)`**: Creates an example query based on the `Customer` object.\n- **`criteria.add(Restrictions.idEq(this.customer.getId()))`**: Adds a filter for the `Customer` ID.\n- **`criteria.list()`**: Executes the query and retrieves the result list.\n- **`t.commit()`**: Commits the transaction.\n- **`sess.close()`**: Closes the session.\n- **`logger.info()`**: Logs messages.\n\n---\n\n### Step 3: Decomposition of the Focal Method\n\n```json\n[\n  {\n    \"id\": 1,\n    \"description\": \"Log the start of the method execution to track its lifecycle.\",\n    \"code\": \"\\t\\tlogger.info( \\\"Starting find()\\\" ); //f:log\",\n    \"start_line\": 87,\n    \"end_line\": 87\n  },\n  {\n    \"id\": 2,\n    \"description\": \"Initialize a Hibernate session and begin a transaction to interact with the database.\",\n    \"code\": \"\\t\\tSession sess = HibernateUtil.getSessionFactory().openSession(); //f:hibernate\\n\\t\\tTransaction t = sess.beginTransaction(); //f:hibernate\",\n    \"start_line\": 88,\n    \"end_line\": 89\n  },\n  {\n    \"id\": 3,\n    \"description\": \"Create a criteria query for the Customer class using Hibernate.\",\n    \"code\": \"\\t\\tCriteria criteria = sess.createCriteria( Customer.class ); //f:hibernate\",\n    \"start_line\": 91,\n    \"end_line\": 91\n  },\n  {\n    \"id\": 4,\n    \"description\": \"Add filters to the criteria query based on the Customer object's attributes, enabling partial matches, ignoring case, and excluding zeroes.\",\n    \"code\": \"\\t\\tcriteria.add( Example.create( this.customer ).excludeZeroes().ignoreCase().enableLike( MatchMode.ANYWHERE ) ); //f:hibernate\",\n    \"start_line\": 93,\n    \"end_line\": 93\n  },\n  {\n    \"id\": 5,\n    \"description\": \"Add an additional filter to the criteria query if the Customer object's ID is not null.\",\n    \"code\": \"\\t\\tif ( this.customer.getId() != null ) { //f:hibernate\\n\\t\\t\\tcriteria.add( Restrictions.idEq( this.customer.getId() ) ); //f:hibernate\\n\\t\\t} //f:hibernate\",\n    \"start_line\": 94,\n    \"end_line\": 96\n  },\n  {\n    \"id\": 6,\n    \"description\": \"Execute the criteria query and retrieve the list of matching Customer entities.\",\n    \"code\": \"\\t\\t@SuppressWarnings(\\\"unchecked\\\")\\n\\t\\tList<Customer> l = (List<Customer>) criteria.list(); //f:hibernate\",\n    \"start_line\": 98,\n    \"end_line\": 99\n  },\n  {\n    \"id\": 7,\n    \"description\": \"Commit the transaction and close the Hibernate session to ensure proper resource management.\",\n    \"code\": \"\\t\\tt.commit(); //f:hibernate\\n\\t\\tsess.close(); //f:hibernate\",\n    \"start_line\": 100,\n    \"end_line\": 101\n  },\n  {\n    \"id\": 8,\n    \"description\": \"Store the retrieved list of Customer entities in the request map for further processing.\",\n    \"code\": \"\\t\\trequest.put( \\\"list\\\", l );\",\n    \"start_line\": 102,\n    \"end_line\": 102\n  },\n  {\n    \"id\": 9,\n    \"description\": \"Set the task constant to indicate the current mode of operation.\",\n    \"code\": \"\\t\\tthis.task = SystemConstants.CR_MODE;\",\n    \"start_line\": 104,\n    \"end_line\": 104\n  },\n  {\n    \"id\": 10,\n    \"description\": \"Log the completion of the method execution to track its lifecycle.\",\n    \"code\": \"\\t\\tlogger.info( \\\"Finishing find()\\\" ); //f:log\",\n    \"start_line\": 105,\n    \"end_line\": 105\n  },\n  {\n    \"id\": 11,\n    \"description\": \"Return the predefined input constant to indicate the result of the method.\",\n    \"code\": \"\\t\\treturn INPUT;\",\n    \"start_line\": 106,\n    \"end_line\": 106\n  }\n]\n```"
  },
  {
    "class_name": "classes.CustomerAction",
    "function_name": "save()",
    "analysis": "### Step 1: Summary of the Focal Method\n\nThe `save()` method in the `classes.CustomerAction` class is responsible for persisting a `customer` object to the database using Hibernate. It begins by logging the start of the operation, opens a Hibernate session, and starts a transaction. The method then saves the `customer` object, commits the transaction, and closes the session. Afterward, it updates the task state and adds a success message to the action context. Finally, it logs the completion of the operation and returns an input constant.\n\n### Step 2: Necessary Environment Settings to Run the Focal Method\n\n#### Invoked Parameters and Fields:\n1. **`this.customer`**: The `customer` object that needs to be saved.\n2. **`this.task`**: A field in the class that is updated to `SystemConstants.UD_MODE`.\n3. **`SystemConstants.UD_MODE`**: A constant used to update the task state.\n4. **`this.addActionMessage()`**: A method to add a success message to the action context.\n5. **`this.getText()`**: A method to retrieve localized text for the success message.\n\n#### Invoked Methods:\n1. **`HibernateUtil.getSessionFactory()`**: Retrieves the Hibernate `SessionFactory`.\n2. **`sess.save()`**: Saves the `customer` object to the database.\n3. **`t.commit()`**: Commits the transaction.\n4. **`sess.close()`**: Closes the Hibernate session.\n\n#### Dependent Fields and Methods:\n1. **`HibernateUtil.getSessionFactory()`**:\n   - **Field**: `private static final SessionFactory sessionFactory`.\n   - **Method Body**:\n     ```java\n     public static SessionFactory getSessionFactory() {\n         return sessionFactory;\n     }\n     ```\n\n---\n\n### Step 3: Decomposition of the Focal Method",
    "slices": [
      {
        "id": 1,
        "description": "Log the start of the save operation.",
        "code": "\t\tlogger.info( \"Starting save()\" ); //f:log",
        "start_line": 110,
        "end_line": 110
      },
      {
        "id": 2,
        "description": "Initialize the Hibernate session and transaction.",
        "code": "\t\tSession sess = HibernateUtil.getSessionFactory().openSession(); //f:hibernate\n\t\tTransaction t = sess.beginTransaction(); //f:hibernate",
        "start_line": 111,
        "end_line": 112
      },
      {
        "id": 3,
        "description": "Save the customer object to the database using the Hibernate session.",
        "code": "\t\tsess.save( this.customer ); //f:hibernate",
        "start_line": 114,
        "end_line": 114
      },
      {
        "id": 4,
        "description": "Commit the transaction and close the Hibernate session.",
        "code": "\t\tt.commit(); //f:hibernate\n\t\tsess.close(); //f:hibernate",
        "start_line": 116,
        "end_line": 117
      },
      {
        "id": 5,
        "description": "Update the task state to indicate the operation mode.",
        "code": "\t\tthis.task = SystemConstants.UD_MODE;",
        "start_line": 119,
        "end_line": 119
      },
      {
        "id": 6,
        "description": "Add a success message to the action context.",
        "code": "\t\tthis.addActionMessage( this.getText( \"saveSuccessful\", new String[]{\"customer\"})  );",
        "start_line": 120,
        "end_line": 120
      },
      {
        "id": 7,
        "description": "Log the completion of the save operation.",
        "code": "\t\tlogger.info( \"Finishing save()\" ); //f:log",
        "start_line": 122,
        "end_line": 122
      },
      {
        "id": 8,
        "description": "Return the input constant to indicate the next action.",
        "code": "\t\treturn INPUT;",
        "start_line": 123,
        "end_line": 123
      }
    ],
    "full_response": "### Step 1: Summary of the Focal Method\n\nThe `save()` method in the `classes.CustomerAction` class is responsible for persisting a `customer` object to the database using Hibernate. It begins by logging the start of the operation, opens a Hibernate session, and starts a transaction. The method then saves the `customer` object, commits the transaction, and closes the session. Afterward, it updates the task state and adds a success message to the action context. Finally, it logs the completion of the operation and returns an input constant.\n\n### Step 2: Necessary Environment Settings to Run the Focal Method\n\n#### Invoked Parameters and Fields:\n1. **`this.customer`**: The `customer` object that needs to be saved.\n2. **`this.task`**: A field in the class that is updated to `SystemConstants.UD_MODE`.\n3. **`SystemConstants.UD_MODE`**: A constant used to update the task state.\n4. **`this.addActionMessage()`**: A method to add a success message to the action context.\n5. **`this.getText()`**: A method to retrieve localized text for the success message.\n\n#### Invoked Methods:\n1. **`HibernateUtil.getSessionFactory()`**: Retrieves the Hibernate `SessionFactory`.\n2. **`sess.save()`**: Saves the `customer` object to the database.\n3. **`t.commit()`**: Commits the transaction.\n4. **`sess.close()`**: Closes the Hibernate session.\n\n#### Dependent Fields and Methods:\n1. **`HibernateUtil.getSessionFactory()`**:\n   - **Field**: `private static final SessionFactory sessionFactory`.\n   - **Method Body**:\n     ```java\n     public static SessionFactory getSessionFactory() {\n         return sessionFactory;\n     }\n     ```\n\n---\n\n### Step 3: Decomposition of the Focal Method\n\n```json\n[\n  {\n    \"id\": 1,\n    \"description\": \"Log the start of the save operation.\",\n    \"code\": \"\\t\\tlogger.info( \\\"Starting save()\\\" ); //f:log\",\n    \"start_line\": 110,\n    \"end_line\": 110\n  },\n  {\n    \"id\": 2,\n    \"description\": \"Initialize the Hibernate session and transaction.\",\n    \"code\": \"\\t\\tSession sess = HibernateUtil.getSessionFactory().openSession(); //f:hibernate\\n\\t\\tTransaction t = sess.beginTransaction(); //f:hibernate\",\n    \"start_line\": 111,\n    \"end_line\": 112\n  },\n  {\n    \"id\": 3,\n    \"description\": \"Save the customer object to the database using the Hibernate session.\",\n    \"code\": \"\\t\\tsess.save( this.customer ); //f:hibernate\",\n    \"start_line\": 114,\n    \"end_line\": 114\n  },\n  {\n    \"id\": 4,\n    \"description\": \"Commit the transaction and close the Hibernate session.\",\n    \"code\": \"\\t\\tt.commit(); //f:hibernate\\n\\t\\tsess.close(); //f:hibernate\",\n    \"start_line\": 116,\n    \"end_line\": 117\n  },\n  {\n    \"id\": 5,\n    \"description\": \"Update the task state to indicate the operation mode.\",\n    \"code\": \"\\t\\tthis.task = SystemConstants.UD_MODE;\",\n    \"start_line\": 119,\n    \"end_line\": 119\n  },\n  {\n    \"id\": 6,\n    \"description\": \"Add a success message to the action context.\",\n    \"code\": \"\\t\\tthis.addActionMessage( this.getText( \\\"saveSuccessful\\\", new String[]{\\\"customer\\\"})  );\",\n    \"start_line\": 120,\n    \"end_line\": 120\n  },\n  {\n    \"id\": 7,\n    \"description\": \"Log the completion of the save operation.\",\n    \"code\": \"\\t\\tlogger.info( \\\"Finishing save()\\\" ); //f:log\",\n    \"start_line\": 122,\n    \"end_line\": 122\n  },\n  {\n    \"id\": 8,\n    \"description\": \"Return the input constant to indicate the next action.\",\n    \"code\": \"\\t\\treturn INPUT;\",\n    \"start_line\": 123,\n    \"end_line\": 123\n  }\n]\n```"
  },
  {
    "class_name": "classes.CustomerAction",
    "function_name": "update()",
    "analysis": "### Step 1: Summarise the Focal Method\n\nThe `update()` method in the `classes.CustomerAction` class is responsible for updating a `customer` object in the database using Hibernate. It performs the following tasks:\n1. Logs the start of the update operation.\n2. Opens a Hibernate session and begins a transaction.\n3. Updates the `customer` object in the database.\n4. Commits the transaction and closes the session.\n5. Sets a task mode and adds a success message to the action context.\n6. Logs the completion of the update operation and returns an input constant.\n\n### Step 2: Necessary Environment Settings to Run the Focal Method\n\n#### Invoked Parameters and Fields:\n- **`this.customer`**: The `customer` object to be updated in the database.\n- **`this.task`**: A field that is set to `SystemConstants.UD_MODE` after the update.\n- **`SystemConstants.UD_MODE`**: A constant used to set the task mode.\n- **`this.addActionMessage()`**: A method to add a success message to the action context.\n- **`this.getText()`**: A method to retrieve localized text for the success message.\n\n#### Invoked Methods:\n- **`HibernateUtil.getSessionFactory()`**: Retrieves the Hibernate `SessionFactory` for database operations.\n- **`sess.update()`**: Updates the `customer` object in the database.\n- **`t.commit()`**: Commits the transaction to persist changes.\n- **`sess.close()`**: Closes the Hibernate session.\n- **`logger.info()`**: Logs informational messages.\n\n#### Dependent Method Bodies:\n- **`HibernateUtil.getSessionFactory()`**:\n  ```java\n  public static SessionFactory getSessionFactory() {\n      return sessionFactory;\n  }\n  ```\n\n---\n\n### Step 3: Decomposition of the Focal Method",
    "slices": [
      {
        "id": 1,
        "description": "Log the start of the update operation.",
        "code": "\t\tlogger.info( \"Starting update()\" ); //f:log",
        "start_line": 127,
        "end_line": 127
      },
      {
        "id": 2,
        "description": "Open a Hibernate session and begin a transaction.",
        "code": "\t\tSession sess = HibernateUtil.getSessionFactory().openSession(); //f:hibernate\n\t\tTransaction t = sess.beginTransaction(); //f:hibernate",
        "start_line": 128,
        "end_line": 129
      },
      {
        "id": 3,
        "description": "Update the customer object in the database.",
        "code": "\t\tsess.update( this.customer ); //f:hibernate",
        "start_line": 131,
        "end_line": 131
      },
      {
        "id": 4,
        "description": "Commit the transaction and close the Hibernate session.",
        "code": "\t\tt.commit(); //f:hibernate\n\t\tsess.close(); //f:hibernate",
        "start_line": 133,
        "end_line": 134
      },
      {
        "id": 5,
        "description": "Set the task mode and add a success message to the action context.",
        "code": "\t\tthis.task = SystemConstants.UD_MODE;\n\t\tthis.addActionMessage( this.getText( \"updateSuccessful\", new String[]{\"customer\"})  );",
        "start_line": 136,
        "end_line": 137
      },
      {
        "id": 6,
        "description": "Log the completion of the update operation and return the input constant.",
        "code": "\t\tlogger.info( \"Finishing update()\" ); //f:log\n\t\treturn INPUT;",
        "start_line": 139,
        "end_line": 140
      }
    ],
    "full_response": "### Step 1: Summarise the Focal Method\n\nThe `update()` method in the `classes.CustomerAction` class is responsible for updating a `customer` object in the database using Hibernate. It performs the following tasks:\n1. Logs the start of the update operation.\n2. Opens a Hibernate session and begins a transaction.\n3. Updates the `customer` object in the database.\n4. Commits the transaction and closes the session.\n5. Sets a task mode and adds a success message to the action context.\n6. Logs the completion of the update operation and returns an input constant.\n\n### Step 2: Necessary Environment Settings to Run the Focal Method\n\n#### Invoked Parameters and Fields:\n- **`this.customer`**: The `customer` object to be updated in the database.\n- **`this.task`**: A field that is set to `SystemConstants.UD_MODE` after the update.\n- **`SystemConstants.UD_MODE`**: A constant used to set the task mode.\n- **`this.addActionMessage()`**: A method to add a success message to the action context.\n- **`this.getText()`**: A method to retrieve localized text for the success message.\n\n#### Invoked Methods:\n- **`HibernateUtil.getSessionFactory()`**: Retrieves the Hibernate `SessionFactory` for database operations.\n- **`sess.update()`**: Updates the `customer` object in the database.\n- **`t.commit()`**: Commits the transaction to persist changes.\n- **`sess.close()`**: Closes the Hibernate session.\n- **`logger.info()`**: Logs informational messages.\n\n#### Dependent Method Bodies:\n- **`HibernateUtil.getSessionFactory()`**:\n  ```java\n  public static SessionFactory getSessionFactory() {\n      return sessionFactory;\n  }\n  ```\n\n---\n\n### Step 3: Decomposition of the Focal Method\n\n```json\n[\n  {\n    \"id\": 1,\n    \"description\": \"Log the start of the update operation.\",\n    \"code\": \"\\t\\tlogger.info( \\\"Starting update()\\\" ); //f:log\",\n    \"start_line\": 127,\n    \"end_line\": 127\n  },\n  {\n    \"id\": 2,\n    \"description\": \"Open a Hibernate session and begin a transaction.\",\n    \"code\": \"\\t\\tSession sess = HibernateUtil.getSessionFactory().openSession(); //f:hibernate\\n\\t\\tTransaction t = sess.beginTransaction(); //f:hibernate\",\n    \"start_line\": 128,\n    \"end_line\": 129\n  },\n  {\n    \"id\": 3,\n    \"description\": \"Update the customer object in the database.\",\n    \"code\": \"\\t\\tsess.update( this.customer ); //f:hibernate\",\n    \"start_line\": 131,\n    \"end_line\": 131\n  },\n  {\n    \"id\": 4,\n    \"description\": \"Commit the transaction and close the Hibernate session.\",\n    \"code\": \"\\t\\tt.commit(); //f:hibernate\\n\\t\\tsess.close(); //f:hibernate\",\n    \"start_line\": 133,\n    \"end_line\": 134\n  },\n  {\n    \"id\": 5,\n    \"description\": \"Set the task mode and add a success message to the action context.\",\n    \"code\": \"\\t\\tthis.task = SystemConstants.UD_MODE;\\n\\t\\tthis.addActionMessage( this.getText( \\\"updateSuccessful\\\", new String[]{\\\"customer\\\"})  );\",\n    \"start_line\": 136,\n    \"end_line\": 137\n  },\n  {\n    \"id\": 6,\n    \"description\": \"Log the completion of the update operation and return the input constant.\",\n    \"code\": \"\\t\\tlogger.info( \\\"Finishing update()\\\" ); //f:log\\n\\t\\treturn INPUT;\",\n    \"start_line\": 139,\n    \"end_line\": 140\n  }\n]\n```"
  },
  {
    "class_name": "classes.CustomerAction",
    "function_name": "delete()",
    "analysis": "### Step 1: Summarise the focal method\n\nThe `delete()` method in the `classes.CustomerAction` class is responsible for deleting a `customer` object from the database using Hibernate. It performs the following tasks:\n1. Logs the start of the delete operation.\n2. Opens a Hibernate session and begins a transaction.\n3. Deletes the `customer` object from the database.\n4. Commits the transaction and closes the session.\n5. Updates the `task` field to a specific constant value.\n6. Adds a success message to the action context.\n7. Logs the completion of the delete operation and returns the result of the `input()` method.\n\n### Step 2: List necessary environment settings to run the focal method\n\n#### Invoked parameters and fields\n- `this.customer`: The `customer` object to be deleted.\n- `this.task`: A field updated to `SystemConstants.CR_MODE` after the delete operation.\n- `SystemConstants.CR_MODE`: A constant used to update the `task` field.\n- `this.addActionMessage(String)`: A method used to add a success message.\n- `this.getText(String, String[])`: A method used to fetch localized text for the success message.\n\n#### Invoked methods\n- `HibernateUtil.getSessionFactory()`: Retrieves the Hibernate `SessionFactory`.\n- `SessionFactory.openSession()`: Opens a new Hibernate session.\n- `Session.beginTransaction()`: Begins a transaction in the Hibernate session.\n- `Session.delete(Object)`: Deletes the specified object from the database.\n- `Transaction.commit()`: Commits the current transaction.\n- `Session.close()`: Closes the Hibernate session.\n- `this.input()`: Returns the result of the `input()` method, likely used for navigation or response.\n\n---\n\n### Step 3: Decompose the focal method into multiple problem-solving steps",
    "slices": [
      {
        "id": 1,
        "description": "Log the start of the delete operation.",
        "code": "\t\tlogger.info( \"Starting delete()\" ); //f:log",
        "start_line": 144,
        "end_line": 144
      },
      {
        "id": 2,
        "description": "Open a Hibernate session and begin a transaction.",
        "code": "\t\tSession sess = HibernateUtil.getSessionFactory().openSession(); //f:hibernate\n\t\tTransaction t = sess.beginTransaction(); //f:hibernate",
        "start_line": 145,
        "end_line": 146
      },
      {
        "id": 3,
        "description": "Delete the customer object from the database.",
        "code": "\t\tsess.delete( this.customer ); //f:hibernate",
        "start_line": 148,
        "end_line": 148
      },
      {
        "id": 4,
        "description": "Commit the transaction and close the Hibernate session.",
        "code": "\t\tt.commit(); //f:hibernate\n\t\tsess.close(); //f:hibernate",
        "start_line": 150,
        "end_line": 151
      },
      {
        "id": 5,
        "description": "Update the task field to indicate the operation mode.",
        "code": "\t\tthis.task = SystemConstants.CR_MODE;",
        "start_line": 153,
        "end_line": 153
      },
      {
        "id": 6,
        "description": "Add a success message to the action context.",
        "code": "\t\tthis.addActionMessage( this.getText( \"deleteSuccessful\", new String[]{\"customer\"})  );",
        "start_line": 154,
        "end_line": 154
      },
      {
        "id": 7,
        "description": "Log the completion of the delete operation and return the result of the input() method.",
        "code": "\t\tlogger.info( \"Finishing delete()\" ); //f:log\n\t\treturn this.input();",
        "start_line": 156,
        "end_line": 157
      }
    ],
    "full_response": "### Step 1: Summarise the focal method\n\nThe `delete()` method in the `classes.CustomerAction` class is responsible for deleting a `customer` object from the database using Hibernate. It performs the following tasks:\n1. Logs the start of the delete operation.\n2. Opens a Hibernate session and begins a transaction.\n3. Deletes the `customer` object from the database.\n4. Commits the transaction and closes the session.\n5. Updates the `task` field to a specific constant value.\n6. Adds a success message to the action context.\n7. Logs the completion of the delete operation and returns the result of the `input()` method.\n\n### Step 2: List necessary environment settings to run the focal method\n\n#### Invoked parameters and fields\n- `this.customer`: The `customer` object to be deleted.\n- `this.task`: A field updated to `SystemConstants.CR_MODE` after the delete operation.\n- `SystemConstants.CR_MODE`: A constant used to update the `task` field.\n- `this.addActionMessage(String)`: A method used to add a success message.\n- `this.getText(String, String[])`: A method used to fetch localized text for the success message.\n\n#### Invoked methods\n- `HibernateUtil.getSessionFactory()`: Retrieves the Hibernate `SessionFactory`.\n- `SessionFactory.openSession()`: Opens a new Hibernate session.\n- `Session.beginTransaction()`: Begins a transaction in the Hibernate session.\n- `Session.delete(Object)`: Deletes the specified object from the database.\n- `Transaction.commit()`: Commits the current transaction.\n- `Session.close()`: Closes the Hibernate session.\n- `this.input()`: Returns the result of the `input()` method, likely used for navigation or response.\n\n---\n\n### Step 3: Decompose the focal method into multiple problem-solving steps\n\n```json\n[\n  {\n    \"id\": 1,\n    \"description\": \"Log the start of the delete operation.\",\n    \"code\": \"\\t\\tlogger.info( \\\"Starting delete()\\\" ); //f:log\",\n    \"start_line\": 144,\n    \"end_line\": 144\n  },\n  {\n    \"id\": 2,\n    \"description\": \"Open a Hibernate session and begin a transaction.\",\n    \"code\": \"\\t\\tSession sess = HibernateUtil.getSessionFactory().openSession(); //f:hibernate\\n\\t\\tTransaction t = sess.beginTransaction(); //f:hibernate\",\n    \"start_line\": 145,\n    \"end_line\": 146\n  },\n  {\n    \"id\": 3,\n    \"description\": \"Delete the customer object from the database.\",\n    \"code\": \"\\t\\tsess.delete( this.customer ); //f:hibernate\",\n    \"start_line\": 148,\n    \"end_line\": 148\n  },\n  {\n    \"id\": 4,\n    \"description\": \"Commit the transaction and close the Hibernate session.\",\n    \"code\": \"\\t\\tt.commit(); //f:hibernate\\n\\t\\tsess.close(); //f:hibernate\",\n    \"start_line\": 150,\n    \"end_line\": 151\n  },\n  {\n    \"id\": 5,\n    \"description\": \"Update the task field to indicate the operation mode.\",\n    \"code\": \"\\t\\tthis.task = SystemConstants.CR_MODE;\",\n    \"start_line\": 153,\n    \"end_line\": 153\n  },\n  {\n    \"id\": 6,\n    \"description\": \"Add a success message to the action context.\",\n    \"code\": \"\\t\\tthis.addActionMessage( this.getText( \\\"deleteSuccessful\\\", new String[]{\\\"customer\\\"})  );\",\n    \"start_line\": 154,\n    \"end_line\": 154\n  },\n  {\n    \"id\": 7,\n    \"description\": \"Log the completion of the delete operation and return the result of the input() method.\",\n    \"code\": \"\\t\\tlogger.info( \\\"Finishing delete()\\\" ); //f:log\\n\\t\\treturn this.input();\",\n    \"start_line\": 156,\n    \"end_line\": 157\n  }\n]\n```"
  },
  {
    "class_name": "classes.CustomerAction",
    "function_name": "edit()",
    "analysis": "### Step 1: Summarize the focal method\n\nThe `edit()` method in the `classes.CustomerAction` class is responsible for retrieving a `Customer` object from the database based on an `id` parameter, setting it to the current instance, and preparing the system for an update operation. The method uses Hibernate for database interaction and logs its execution at the start and end. It also sets a task constant (`SystemConstants.UD_MODE`) and returns an `INPUT` string to indicate the next step in the workflow.\n\n### Step 2: List necessary environment settings to run the focal method\n\n#### Invoked parameters and fields:\n1. `this.parameters.get(\"id\")[0]`: Retrieves the `id` parameter from the request parameters.\n2. `this.setCustomer(c)`: Sets the retrieved `Customer` object to the current instance.\n3. `this.task`: A field in the class that is set to `SystemConstants.UD_MODE`.\n\n#### Invoked methods:\n1. `HibernateUtil.getSessionFactory()`: Retrieves the Hibernate `SessionFactory` for database operations.\n2. `sess.get(Customer.class, id)`: Fetches the `Customer` object from the database using Hibernate.\n3. `sess.beginTransaction()`: Starts a Hibernate transaction.\n4. `t.commit()`: Commits the transaction.\n5. `sess.close()`: Closes the Hibernate session.\n\n#### Dependent fields and methods:\n- `HibernateUtil.sessionFactory`: A static field that holds the `SessionFactory` instance.\n- `HibernateUtil.getSessionFactory()`: A static method that returns the `SessionFactory`.\n\n---\n\n### Step 3: Decomposition of the focal method",
    "slices": [
      {
        "id": 1,
        "description": "Log the start of the method execution.",
        "code": "\t\tlogger.info( \"Starting edit()\" ); //f:log",
        "start_line": 161,
        "end_line": 161
      },
      {
        "id": 2,
        "description": "Retrieve the 'id' parameter from the request and convert it to an Integer.",
        "code": "\t\tInteger id = Integer.valueOf( this.parameters.get( \"id\" )[0] );",
        "start_line": 162,
        "end_line": 162
      },
      {
        "id": 3,
        "description": "Open a Hibernate session and start a transaction.",
        "code": "\t\tSession sess = HibernateUtil.getSessionFactory().openSession(); //f:hibernate\n\t\tTransaction t = sess.beginTransaction(); //f:hibernate",
        "start_line": 164,
        "end_line": 165
      },
      {
        "id": 4,
        "description": "Retrieve the Customer object from the database using the provided id.",
        "code": "\t\tCustomer c = (Customer) sess.get( Customer.class, id ); //f:hibernate",
        "start_line": 167,
        "end_line": 167
      },
      {
        "id": 5,
        "description": "Commit the transaction and close the Hibernate session.",
        "code": "\t\tt.commit(); //f:hibernate\n\t\tsess.close(); //f:hibernate",
        "start_line": 168,
        "end_line": 169
      },
      {
        "id": 6,
        "description": "Set the retrieved Customer object to the current instance.",
        "code": "\t\tthis.setCustomer( c );",
        "start_line": 171,
        "end_line": 171
      },
      {
        "id": 7,
        "description": "Log the end of the method execution.",
        "code": "\t\tlogger.info( \"Finishing edit()\" ); //f:log",
        "start_line": 173,
        "end_line": 173
      },
      {
        "id": 8,
        "description": "Set the task constant to indicate update mode and return the INPUT string.",
        "code": "\t\tthis.task = SystemConstants.UD_MODE;\n\t\treturn INPUT;",
        "start_line": 174,
        "end_line": 175
      }
    ],
    "full_response": "### Step 1: Summarize the focal method\n\nThe `edit()` method in the `classes.CustomerAction` class is responsible for retrieving a `Customer` object from the database based on an `id` parameter, setting it to the current instance, and preparing the system for an update operation. The method uses Hibernate for database interaction and logs its execution at the start and end. It also sets a task constant (`SystemConstants.UD_MODE`) and returns an `INPUT` string to indicate the next step in the workflow.\n\n### Step 2: List necessary environment settings to run the focal method\n\n#### Invoked parameters and fields:\n1. `this.parameters.get(\"id\")[0]`: Retrieves the `id` parameter from the request parameters.\n2. `this.setCustomer(c)`: Sets the retrieved `Customer` object to the current instance.\n3. `this.task`: A field in the class that is set to `SystemConstants.UD_MODE`.\n\n#### Invoked methods:\n1. `HibernateUtil.getSessionFactory()`: Retrieves the Hibernate `SessionFactory` for database operations.\n2. `sess.get(Customer.class, id)`: Fetches the `Customer` object from the database using Hibernate.\n3. `sess.beginTransaction()`: Starts a Hibernate transaction.\n4. `t.commit()`: Commits the transaction.\n5. `sess.close()`: Closes the Hibernate session.\n\n#### Dependent fields and methods:\n- `HibernateUtil.sessionFactory`: A static field that holds the `SessionFactory` instance.\n- `HibernateUtil.getSessionFactory()`: A static method that returns the `SessionFactory`.\n\n---\n\n### Step 3: Decomposition of the focal method\n\n```json\n[\n  {\n    \"id\": 1,\n    \"description\": \"Log the start of the method execution.\",\n    \"code\": \"\\t\\tlogger.info( \\\"Starting edit()\\\" ); //f:log\",\n    \"start_line\": 161,\n    \"end_line\": 161\n  },\n  {\n    \"id\": 2,\n    \"description\": \"Retrieve the 'id' parameter from the request and convert it to an Integer.\",\n    \"code\": \"\\t\\tInteger id = Integer.valueOf( this.parameters.get( \\\"id\\\" )[0] );\",\n    \"start_line\": 162,\n    \"end_line\": 162\n  },\n  {\n    \"id\": 3,\n    \"description\": \"Open a Hibernate session and start a transaction.\",\n    \"code\": \"\\t\\tSession sess = HibernateUtil.getSessionFactory().openSession(); //f:hibernate\\n\\t\\tTransaction t = sess.beginTransaction(); //f:hibernate\",\n    \"start_line\": 164,\n    \"end_line\": 165\n  },\n  {\n    \"id\": 4,\n    \"description\": \"Retrieve the Customer object from the database using the provided id.\",\n    \"code\": \"\\t\\tCustomer c = (Customer) sess.get( Customer.class, id ); //f:hibernate\",\n    \"start_line\": 167,\n    \"end_line\": 167\n  },\n  {\n    \"id\": 5,\n    \"description\": \"Commit the transaction and close the Hibernate session.\",\n    \"code\": \"\\t\\tt.commit(); //f:hibernate\\n\\t\\tsess.close(); //f:hibernate\",\n    \"start_line\": 168,\n    \"end_line\": 169\n  },\n  {\n    \"id\": 6,\n    \"description\": \"Set the retrieved Customer object to the current instance.\",\n    \"code\": \"\\t\\tthis.setCustomer( c );\",\n    \"start_line\": 171,\n    \"end_line\": 171\n  },\n  {\n    \"id\": 7,\n    \"description\": \"Log the end of the method execution.\",\n    \"code\": \"\\t\\tlogger.info( \\\"Finishing edit()\\\" ); //f:log\",\n    \"start_line\": 173,\n    \"end_line\": 173\n  },\n  {\n    \"id\": 8,\n    \"description\": \"Set the task constant to indicate update mode and return the INPUT string.\",\n    \"code\": \"\\t\\tthis.task = SystemConstants.UD_MODE;\\n\\t\\treturn INPUT;\",\n    \"start_line\": 174,\n    \"end_line\": 175\n  }\n]\n```"
  },
  {
    "class_name": "classes.LoginAction",
    "function_name": "execute()",
    "analysis": "### Step 1: Summarise the focal method\n\nThe `execute()` method in the `classes.LoginAction` class is responsible for authenticating a user based on their username and password. It interacts with a Hibernate session to query the database for user credentials. If the user is successfully authenticated, the method stores the user in the session context and returns a success status. Otherwise, it adds an action error message and returns an input status. Logging is performed at various stages to track the execution flow.\n\n### Step 2: List necessary environment settings to run the focal method\n\n#### Invoked Parameters and Fields:\n1. **`this.user.getUsername()`**: Retrieves the username of the user attempting to log in.\n2. **`this.user.getPassword()`**: Retrieves the password of the user attempting to log in.\n3. **`SystemConstants.AUTHENTICATED_USER`**: A constant used to store the authenticated user in the session context.\n\n#### Invoked Methods:\n1. **`HibernateUtil.getSessionFactory()`**: Provides the Hibernate `SessionFactory` to open a session.\n2. **`sess.openSession()`**: Opens a Hibernate session.\n3. **`sess.beginTransaction()`**: Begins a transaction in the Hibernate session.\n4. **`sess.createCriteria(User.class)`**: Creates a criteria query for the `User` entity.\n5. **`criteria.add(Restrictions.idEq(...))`**: Adds a restriction to match the user ID (username).\n6. **`criteria.add(Restrictions.eq(...))`**: Adds a restriction to match the password.\n7. **`criteria.uniqueResult()`**: Executes the query and retrieves a single result.\n8. **`t.commit()`**: Commits the transaction.\n9. **`sess.close()`**: Closes the Hibernate session.\n10. **`ActionContext.getContext().getSession().put(...)`**: Stores the authenticated user in the session context.\n11. **`this.addActionError(this.getText(...))`**: Adds an error message to the action context.\n12. **`logger.info(...)`**: Logs information messages.\n\n---\n\n### Step 3: Decomposition of the focal method into slices",
    "slices": [
      {
        "id": 1,
        "description": "Initialize the method and log the start of execution.",
        "code": "\tpublic String execute() throws Exception {\n\t\tlogger.info( \"Starting execute()\" ); //f:log",
        "start_line": 44,
        "end_line": 45
      },
      {
        "id": 2,
        "description": "Open a Hibernate session and begin a transaction.",
        "code": "\t\tSession sess = HibernateUtil.getSessionFactory().openSession(); //f:hibernate\n\t\tTransaction t = sess.beginTransaction(); //f:hibernate",
        "start_line": 46,
        "end_line": 47
      },
      {
        "id": 3,
        "description": "Create a criteria query for the User entity.",
        "code": "\t\tCriteria criteria = sess.createCriteria( User.class ); //f:hibernate",
        "start_line": 49,
        "end_line": 49
      },
      {
        "id": 4,
        "description": "Add restrictions to the criteria query for username and password matching.",
        "code": "\t\tcriteria.add( Restrictions.idEq( this.user.getUsername() ) ); //f:hibernate\n\t\tcriteria.add( Restrictions.eq( \"password\", this.user.getPassword() ) ); //f:hibernate",
        "start_line": 51,
        "end_line": 52
      },
      {
        "id": 5,
        "description": "Execute the criteria query and retrieve the unique result.",
        "code": "\t\tUser user = (User) criteria.uniqueResult(); //f:hibernate",
        "start_line": 54,
        "end_line": 54
      },
      {
        "id": 6,
        "description": "Commit the transaction and close the Hibernate session.",
        "code": "\t\tt.commit(); //f:hibernate\n\t\tsess.close(); //f:hibernate",
        "start_line": 56,
        "end_line": 57
      },
      {
        "id": 7,
        "description": "Check if the user exists and handle successful authentication.",
        "code": "\t\tif ( user != null ) {\n\t\t\tActionContext.getContext().getSession().put( SystemConstants.AUTHENTICATED_USER, user );\n\t\t\tlogger.info( \"Finishing execute() -- Success\" ); //f:log\n\t\t\treturn SUCCESS;\n\t\t}",
        "start_line": 59,
        "end_line": 63
      },
      {
        "id": 8,
        "description": "Handle authentication failure by adding an error message and logging the failure.",
        "code": "\t\tthis.addActionError( this.getText( \"login.failure\" ) );\n\t\tlogger.info( \"Finishing execute() -- Failure\" ); //f:log\t\t\n\t\treturn INPUT;",
        "start_line": 65,
        "end_line": 67
      }
    ],
    "full_response": "### Step 1: Summarise the focal method\n\nThe `execute()` method in the `classes.LoginAction` class is responsible for authenticating a user based on their username and password. It interacts with a Hibernate session to query the database for user credentials. If the user is successfully authenticated, the method stores the user in the session context and returns a success status. Otherwise, it adds an action error message and returns an input status. Logging is performed at various stages to track the execution flow.\n\n### Step 2: List necessary environment settings to run the focal method\n\n#### Invoked Parameters and Fields:\n1. **`this.user.getUsername()`**: Retrieves the username of the user attempting to log in.\n2. **`this.user.getPassword()`**: Retrieves the password of the user attempting to log in.\n3. **`SystemConstants.AUTHENTICATED_USER`**: A constant used to store the authenticated user in the session context.\n\n#### Invoked Methods:\n1. **`HibernateUtil.getSessionFactory()`**: Provides the Hibernate `SessionFactory` to open a session.\n2. **`sess.openSession()`**: Opens a Hibernate session.\n3. **`sess.beginTransaction()`**: Begins a transaction in the Hibernate session.\n4. **`sess.createCriteria(User.class)`**: Creates a criteria query for the `User` entity.\n5. **`criteria.add(Restrictions.idEq(...))`**: Adds a restriction to match the user ID (username).\n6. **`criteria.add(Restrictions.eq(...))`**: Adds a restriction to match the password.\n7. **`criteria.uniqueResult()`**: Executes the query and retrieves a single result.\n8. **`t.commit()`**: Commits the transaction.\n9. **`sess.close()`**: Closes the Hibernate session.\n10. **`ActionContext.getContext().getSession().put(...)`**: Stores the authenticated user in the session context.\n11. **`this.addActionError(this.getText(...))`**: Adds an error message to the action context.\n12. **`logger.info(...)`**: Logs information messages.\n\n---\n\n### Step 3: Decomposition of the focal method into slices\n\n```json\n[\n  {\n    \"id\": 1,\n    \"description\": \"Initialize the method and log the start of execution.\",\n    \"code\": \"\\tpublic String execute() throws Exception {\\n\\t\\tlogger.info( \\\"Starting execute()\\\" ); //f:log\",\n    \"start_line\": 44,\n    \"end_line\": 45\n  },\n  {\n    \"id\": 2,\n    \"description\": \"Open a Hibernate session and begin a transaction.\",\n    \"code\": \"\\t\\tSession sess = HibernateUtil.getSessionFactory().openSession(); //f:hibernate\\n\\t\\tTransaction t = sess.beginTransaction(); //f:hibernate\",\n    \"start_line\": 46,\n    \"end_line\": 47\n  },\n  {\n    \"id\": 3,\n    \"description\": \"Create a criteria query for the User entity.\",\n    \"code\": \"\\t\\tCriteria criteria = sess.createCriteria( User.class ); //f:hibernate\",\n    \"start_line\": 49,\n    \"end_line\": 49\n  },\n  {\n    \"id\": 4,\n    \"description\": \"Add restrictions to the criteria query for username and password matching.\",\n    \"code\": \"\\t\\tcriteria.add( Restrictions.idEq( this.user.getUsername() ) ); //f:hibernate\\n\\t\\tcriteria.add( Restrictions.eq( \\\"password\\\", this.user.getPassword() ) ); //f:hibernate\",\n    \"start_line\": 51,\n    \"end_line\": 52\n  },\n  {\n    \"id\": 5,\n    \"description\": \"Execute the criteria query and retrieve the unique result.\",\n    \"code\": \"\\t\\tUser user = (User) criteria.uniqueResult(); //f:hibernate\",\n    \"start_line\": 54,\n    \"end_line\": 54\n  },\n  {\n    \"id\": 6,\n    \"description\": \"Commit the transaction and close the Hibernate session.\",\n    \"code\": \"\\t\\tt.commit(); //f:hibernate\\n\\t\\tsess.close(); //f:hibernate\",\n    \"start_line\": 56,\n    \"end_line\": 57\n  },\n  {\n    \"id\": 7,\n    \"description\": \"Check if the user exists and handle successful authentication.\",\n    \"code\": \"\\t\\tif ( user != null ) {\\n\\t\\t\\tActionContext.getContext().getSession().put( SystemConstants.AUTHENTICATED_USER, user );\\n\\t\\t\\tlogger.info( \\\"Finishing execute() -- Success\\\" ); //f:log\\n\\t\\t\\treturn SUCCESS;\\n\\t\\t}\",\n    \"start_line\": 59,\n    \"end_line\": 63\n  },\n  {\n    \"id\": 8,\n    \"description\": \"Handle authentication failure by adding an error message and logging the failure.\",\n    \"code\": \"\\t\\tthis.addActionError( this.getText( \\\"login.failure\\\" ) );\\n\\t\\tlogger.info( \\\"Finishing execute() -- Failure\\\" ); //f:log\\t\\t\\n\\t\\treturn INPUT;\",\n    \"start_line\": 65,\n    \"end_line\": 67\n  }\n]\n```"
  },
  {
    "class_name": "classes.ProductAction",
    "function_name": "find()",
    "analysis": "### Step 1: Summarise the focal method\n\nThe focal method `find()` in the `classes.ProductAction` class is responsible for querying a list of `Product` objects from a database using Hibernate. It performs the following tasks:\n- Logs the start of the method execution.\n- Opens a Hibernate session and begins a transaction.\n- Creates a criteria query based on the `Product` entity and applies filtering conditions.\n- Executes the query to retrieve a list of matching products.\n- Commits the transaction and closes the session.\n- Stores the retrieved list in the request context.\n- Sets a task constant to a predefined mode.\n- Logs the completion of the method execution.\n- Returns a constant input value.\n\n### Step 2: List necessary environment settings to run the focal method\n\n#### Invoked parameters and fields\n1. **`this.product`**: An instance of the `Product` class, which contains fields like `id`, `name`, `price`, and `supply`. It is used to specify filtering criteria for the database query.\n2. **`request`**: A map-like object used to store the retrieved list of products for further use.\n3. **`SystemConstants.CR_MODE`**: A constant value representing a specific mode, which is assigned to `this.task`.\n\n#### Invoked methods\n1. **`HibernateUtil.getSessionFactory()`**: Retrieves the Hibernate `SessionFactory` to open a session.\n2. **`sess.openSession()`**: Opens a Hibernate session.\n3. **`sess.beginTransaction()`**: Begins a transaction in the session.\n4. **`sess.createCriteria(Product.class)`**: Creates a criteria query for the `Product` class.\n5. **`Example.create(this.product)`**: Creates an example query based on the `Product` instance.\n6. **`criteria.add()`**: Adds filtering conditions to the criteria query.\n7. **`criteria.list()`**: Executes the criteria query and retrieves the result list.\n8. **`t.commit()`**: Commits the transaction.\n9. **`sess.close()`**: Closes the Hibernate session.\n\n---\n\n### Step 3: Decompose the focal method into multiple problem-solving steps",
    "slices": [
      {
        "id": 1,
        "description": "Log the start of the method execution.",
        "code": "\t\tlogger.info( \"Starting find()\" ); //f:log",
        "start_line": 89,
        "end_line": 89
      },
      {
        "id": 2,
        "description": "Open a Hibernate session and begin a transaction.",
        "code": "\t\tSession sess = HibernateUtil.getSessionFactory().openSession(); //f:hibernate\n\t\tTransaction t = sess.beginTransaction(); //f:hibernate",
        "start_line": 90,
        "end_line": 91
      },
      {
        "id": 3,
        "description": "Create a criteria query for the Product class.",
        "code": "\t\tCriteria criteria = sess.createCriteria( Product.class ); //f:hibernate",
        "start_line": 93,
        "end_line": 93
      },
      {
        "id": 4,
        "description": "Add filtering conditions to the criteria query based on the Product instance.",
        "code": "\t\tcriteria.add( Example.create( this.product ).excludeZeroes().ignoreCase().enableLike( MatchMode.ANYWHERE ) ); //f:hibernate\n\t\tif ( this.product.getId() != null ) { //f:hibernate\n\t\t\tcriteria.add( Restrictions.idEq( this.product.getId() ) ); //f:hibernate\n\t\t} //f:hibernate",
        "start_line": 95,
        "end_line": 98
      },
      {
        "id": 5,
        "description": "Execute the criteria query and retrieve the result list.",
        "code": "\t\t@SuppressWarnings(\"unchecked\")\n\t\tList<Product> l = (List<Product>) criteria.list(); //f:hibernate",
        "start_line": 100,
        "end_line": 101
      },
      {
        "id": 6,
        "description": "Commit the transaction and close the Hibernate session.",
        "code": "\t\tt.commit(); //f:hibernate\n\t\tsess.close(); //f:hibernate",
        "start_line": 102,
        "end_line": 103
      },
      {
        "id": 7,
        "description": "Store the retrieved list in the request context.",
        "code": "\t\trequest.put( \"list\", l );",
        "start_line": 104,
        "end_line": 104
      },
      {
        "id": 8,
        "description": "Set the task constant to a predefined mode.",
        "code": "\t\tthis.task = SystemConstants.CR_MODE;",
        "start_line": 106,
        "end_line": 106
      },
      {
        "id": 9,
        "description": "Log the completion of the method execution.",
        "code": "\t\tlogger.info( \"Finishing find()\" ); //f:log",
        "start_line": 107,
        "end_line": 107
      },
      {
        "id": 10,
        "description": "Return the constant input value.",
        "code": "\t\treturn INPUT;",
        "start_line": 108,
        "end_line": 108
      }
    ],
    "full_response": "### Step 1: Summarise the focal method\n\nThe focal method `find()` in the `classes.ProductAction` class is responsible for querying a list of `Product` objects from a database using Hibernate. It performs the following tasks:\n- Logs the start of the method execution.\n- Opens a Hibernate session and begins a transaction.\n- Creates a criteria query based on the `Product` entity and applies filtering conditions.\n- Executes the query to retrieve a list of matching products.\n- Commits the transaction and closes the session.\n- Stores the retrieved list in the request context.\n- Sets a task constant to a predefined mode.\n- Logs the completion of the method execution.\n- Returns a constant input value.\n\n### Step 2: List necessary environment settings to run the focal method\n\n#### Invoked parameters and fields\n1. **`this.product`**: An instance of the `Product` class, which contains fields like `id`, `name`, `price`, and `supply`. It is used to specify filtering criteria for the database query.\n2. **`request`**: A map-like object used to store the retrieved list of products for further use.\n3. **`SystemConstants.CR_MODE`**: A constant value representing a specific mode, which is assigned to `this.task`.\n\n#### Invoked methods\n1. **`HibernateUtil.getSessionFactory()`**: Retrieves the Hibernate `SessionFactory` to open a session.\n2. **`sess.openSession()`**: Opens a Hibernate session.\n3. **`sess.beginTransaction()`**: Begins a transaction in the session.\n4. **`sess.createCriteria(Product.class)`**: Creates a criteria query for the `Product` class.\n5. **`Example.create(this.product)`**: Creates an example query based on the `Product` instance.\n6. **`criteria.add()`**: Adds filtering conditions to the criteria query.\n7. **`criteria.list()`**: Executes the criteria query and retrieves the result list.\n8. **`t.commit()`**: Commits the transaction.\n9. **`sess.close()`**: Closes the Hibernate session.\n\n---\n\n### Step 3: Decompose the focal method into multiple problem-solving steps\n\n```json\n[\n  {\n    \"id\": 1,\n    \"description\": \"Log the start of the method execution.\",\n    \"code\": \"\\t\\tlogger.info( \\\"Starting find()\\\" ); //f:log\",\n    \"start_line\": 89,\n    \"end_line\": 89\n  },\n  {\n    \"id\": 2,\n    \"description\": \"Open a Hibernate session and begin a transaction.\",\n    \"code\": \"\\t\\tSession sess = HibernateUtil.getSessionFactory().openSession(); //f:hibernate\\n\\t\\tTransaction t = sess.beginTransaction(); //f:hibernate\",\n    \"start_line\": 90,\n    \"end_line\": 91\n  },\n  {\n    \"id\": 3,\n    \"description\": \"Create a criteria query for the Product class.\",\n    \"code\": \"\\t\\tCriteria criteria = sess.createCriteria( Product.class ); //f:hibernate\",\n    \"start_line\": 93,\n    \"end_line\": 93\n  },\n  {\n    \"id\": 4,\n    \"description\": \"Add filtering conditions to the criteria query based on the Product instance.\",\n    \"code\": \"\\t\\tcriteria.add( Example.create( this.product ).excludeZeroes().ignoreCase().enableLike( MatchMode.ANYWHERE ) ); //f:hibernate\\n\\t\\tif ( this.product.getId() != null ) { //f:hibernate\\n\\t\\t\\tcriteria.add( Restrictions.idEq( this.product.getId() ) ); //f:hibernate\\n\\t\\t} //f:hibernate\",\n    \"start_line\": 95,\n    \"end_line\": 98\n  },\n  {\n    \"id\": 5,\n    \"description\": \"Execute the criteria query and retrieve the result list.\",\n    \"code\": \"\\t\\t@SuppressWarnings(\\\"unchecked\\\")\\n\\t\\tList<Product> l = (List<Product>) criteria.list(); //f:hibernate\",\n    \"start_line\": 100,\n    \"end_line\": 101\n  },\n  {\n    \"id\": 6,\n    \"description\": \"Commit the transaction and close the Hibernate session.\",\n    \"code\": \"\\t\\tt.commit(); //f:hibernate\\n\\t\\tsess.close(); //f:hibernate\",\n    \"start_line\": 102,\n    \"end_line\": 103\n  },\n  {\n    \"id\": 7,\n    \"description\": \"Store the retrieved list in the request context.\",\n    \"code\": \"\\t\\trequest.put( \\\"list\\\", l );\",\n    \"start_line\": 104,\n    \"end_line\": 104\n  },\n  {\n    \"id\": 8,\n    \"description\": \"Set the task constant to a predefined mode.\",\n    \"code\": \"\\t\\tthis.task = SystemConstants.CR_MODE;\",\n    \"start_line\": 106,\n    \"end_line\": 106\n  },\n  {\n    \"id\": 9,\n    \"description\": \"Log the completion of the method execution.\",\n    \"code\": \"\\t\\tlogger.info( \\\"Finishing find()\\\" ); //f:log\",\n    \"start_line\": 107,\n    \"end_line\": 107\n  },\n  {\n    \"id\": 10,\n    \"description\": \"Return the constant input value.\",\n    \"code\": \"\\t\\treturn INPUT;\",\n    \"start_line\": 108,\n    \"end_line\": 108\n  }\n]\n```"
  },
  {
    "class_name": "classes.ProductAction",
    "function_name": "save()",
    "analysis": "### Step 1: Summarize the Focal Method\n\nThe `save()` method in the `classes.ProductAction` class is responsible for persisting a `product` object into a database using Hibernate. The method follows these steps:\n1. Logs the start of the `save()` operation.\n2. Opens a Hibernate session and begins a transaction.\n3. Saves the `product` object to the database.\n4. Commits the transaction and closes the session.\n5. Updates the `task` field to a predefined constant and adds a success message.\n6. Logs the completion of the operation and returns an input constant.\n\n### Step 2: List Necessary Environment Settings to Run the Focal Method\n\n#### Invoked Parameters and Fields:\n- `this.product`: The `product` object that is being saved.\n- `this.task`: A field in the `ProductAction` class updated to `SystemConstants.UD_MODE`.\n- `SystemConstants.UD_MODE`: A constant used to update the `task` field.\n- `this.addActionMessage(String message)`: A method to add a user-facing success message.\n- `this.getText(String key, String[] params)`: A method to retrieve localized text for the success message.\n\n#### Invoked Methods:\n- `HibernateUtil.getSessionFactory()`: Retrieves the Hibernate `SessionFactory` for database operations.\n- `sess.save(Object entity)`: Saves the `product` object to the database.\n- `t.commit()`: Commits the transaction.\n- `sess.close()`: Closes the Hibernate session.\n\n#### Dependent Method Bodies:\n- `HibernateUtil.getSessionFactory()`: Returns the `SessionFactory` instance for Hibernate.\n\n---\n\n### Step 3: Decomposition of the Focal Method",
    "slices": [
      {
        "id": 1,
        "description": "Log the start of the save operation.",
        "code": "\t\tlogger.info( \"Starting save()\" ); //f:log",
        "start_line": 112,
        "end_line": 112
      },
      {
        "id": 2,
        "description": "Open a Hibernate session and begin a transaction.",
        "code": "\t\tSession sess = HibernateUtil.getSessionFactory().openSession(); //f:hibernate\n\t\tTransaction t = sess.beginTransaction(); //f:hibernate",
        "start_line": 113,
        "end_line": 114
      },
      {
        "id": 3,
        "description": "Save the product object to the database using the Hibernate session.",
        "code": "\t\tsess.save( this.product ); //f:hibernate",
        "start_line": 116,
        "end_line": 116
      },
      {
        "id": 4,
        "description": "Commit the transaction and close the Hibernate session.",
        "code": "\t\tt.commit(); //f:hibernate\n\t\tsess.close(); //f:hibernate",
        "start_line": 118,
        "end_line": 119
      },
      {
        "id": 5,
        "description": "Update the task field and add a success message.",
        "code": "\t\tthis.task = SystemConstants.UD_MODE;\n\t\tthis.addActionMessage( this.getText( \"saveSuccessful\", new String[]{\"product\"})  );",
        "start_line": 121,
        "end_line": 122
      },
      {
        "id": 6,
        "description": "Log the completion of the save operation and return the input constant.",
        "code": "\t\tlogger.info( \"Finishing save()\" ); //f:log\n\t\treturn INPUT;",
        "start_line": 124,
        "end_line": 125
      }
    ],
    "full_response": "### Step 1: Summarize the Focal Method\n\nThe `save()` method in the `classes.ProductAction` class is responsible for persisting a `product` object into a database using Hibernate. The method follows these steps:\n1. Logs the start of the `save()` operation.\n2. Opens a Hibernate session and begins a transaction.\n3. Saves the `product` object to the database.\n4. Commits the transaction and closes the session.\n5. Updates the `task` field to a predefined constant and adds a success message.\n6. Logs the completion of the operation and returns an input constant.\n\n### Step 2: List Necessary Environment Settings to Run the Focal Method\n\n#### Invoked Parameters and Fields:\n- `this.product`: The `product` object that is being saved.\n- `this.task`: A field in the `ProductAction` class updated to `SystemConstants.UD_MODE`.\n- `SystemConstants.UD_MODE`: A constant used to update the `task` field.\n- `this.addActionMessage(String message)`: A method to add a user-facing success message.\n- `this.getText(String key, String[] params)`: A method to retrieve localized text for the success message.\n\n#### Invoked Methods:\n- `HibernateUtil.getSessionFactory()`: Retrieves the Hibernate `SessionFactory` for database operations.\n- `sess.save(Object entity)`: Saves the `product` object to the database.\n- `t.commit()`: Commits the transaction.\n- `sess.close()`: Closes the Hibernate session.\n\n#### Dependent Method Bodies:\n- `HibernateUtil.getSessionFactory()`: Returns the `SessionFactory` instance for Hibernate.\n\n---\n\n### Step 3: Decomposition of the Focal Method\n\n```json\n[\n  {\n    \"id\": 1,\n    \"description\": \"Log the start of the save operation.\",\n    \"code\": \"\\t\\tlogger.info( \\\"Starting save()\\\" ); //f:log\",\n    \"start_line\": 112,\n    \"end_line\": 112\n  },\n  {\n    \"id\": 2,\n    \"description\": \"Open a Hibernate session and begin a transaction.\",\n    \"code\": \"\\t\\tSession sess = HibernateUtil.getSessionFactory().openSession(); //f:hibernate\\n\\t\\tTransaction t = sess.beginTransaction(); //f:hibernate\",\n    \"start_line\": 113,\n    \"end_line\": 114\n  },\n  {\n    \"id\": 3,\n    \"description\": \"Save the product object to the database using the Hibernate session.\",\n    \"code\": \"\\t\\tsess.save( this.product ); //f:hibernate\",\n    \"start_line\": 116,\n    \"end_line\": 116\n  },\n  {\n    \"id\": 4,\n    \"description\": \"Commit the transaction and close the Hibernate session.\",\n    \"code\": \"\\t\\tt.commit(); //f:hibernate\\n\\t\\tsess.close(); //f:hibernate\",\n    \"start_line\": 118,\n    \"end_line\": 119\n  },\n  {\n    \"id\": 5,\n    \"description\": \"Update the task field and add a success message.\",\n    \"code\": \"\\t\\tthis.task = SystemConstants.UD_MODE;\\n\\t\\tthis.addActionMessage( this.getText( \\\"saveSuccessful\\\", new String[]{\\\"product\\\"})  );\",\n    \"start_line\": 121,\n    \"end_line\": 122\n  },\n  {\n    \"id\": 6,\n    \"description\": \"Log the completion of the save operation and return the input constant.\",\n    \"code\": \"\\t\\tlogger.info( \\\"Finishing save()\\\" ); //f:log\\n\\t\\treturn INPUT;\",\n    \"start_line\": 124,\n    \"end_line\": 125\n  }\n]\n```"
  },
  {
    "class_name": "classes.ProductAction",
    "function_name": "update()",
    "analysis": "### Step 1: Summarise the focal method\n\nThe `update()` method in the `classes.ProductAction` class is responsible for updating a product entity in the database using Hibernate. It performs the following tasks:\n1. Logs the start of the update operation.\n2. Opens a Hibernate session and begins a transaction.\n3. Updates the product entity in the database.\n4. Commits the transaction and closes the session.\n5. Sets a task mode and adds a success message for the update operation.\n6. Logs the completion of the update operation and returns a constant `INPUT`.\n\n### Step 2: List necessary environment settings to run the focal method\n\n#### Invoked parameters and fields:\n- `this.product`: The product entity to be updated in the database.\n- `this.task`: A field in the `classes.ProductAction` class that stores the task mode.\n- `SystemConstants.UD_MODE`: A constant representing the update mode.\n- `this.addActionMessage(String message)`: A method to add a success message to the action.\n- `this.getText(String key, String[] args)`: A method to retrieve localized text messages.\n\n#### Invoked methods:\n- `HibernateUtil.getSessionFactory()`: Retrieves the Hibernate `SessionFactory` instance.\n- `sess.update(Object entity)`: Updates the specified entity in the database.\n- `t.commit()`: Commits the active transaction.\n- `sess.close()`: Closes the Hibernate session.\n\n#### Dependent method bodies:\n- `HibernateUtil.getSessionFactory()`: Returns the static `SessionFactory` instance.\n\n---\n\n### Step 3: Decomposition of the focal method",
    "slices": [
      {
        "id": 1,
        "description": "Log the start of the update operation.",
        "code": "\t\tlogger.info( \"Starting update()\" ); //f:log",
        "start_line": 129,
        "end_line": 129
      },
      {
        "id": 2,
        "description": "Open a Hibernate session and begin a transaction.",
        "code": "\t\tSession sess = HibernateUtil.getSessionFactory().openSession(); //f:hibernate\n\t\tTransaction t = sess.beginTransaction(); //f:hibernate",
        "start_line": 130,
        "end_line": 131
      },
      {
        "id": 3,
        "description": "Update the product entity in the database.",
        "code": "\t\tsess.update( this.product ); //f:hibernate",
        "start_line": 133,
        "end_line": 133
      },
      {
        "id": 4,
        "description": "Commit the transaction and close the Hibernate session.",
        "code": "\t\tt.commit(); //f:hibernate\n\t\tsess.close(); //f:hibernate",
        "start_line": 135,
        "end_line": 136
      },
      {
        "id": 5,
        "description": "Set the task mode to update and add a success message.",
        "code": "\t\tthis.task = SystemConstants.UD_MODE;\n\t\tthis.addActionMessage( this.getText( \"updateSuccessful\", new String[]{\"product\"})  );",
        "start_line": 138,
        "end_line": 139
      },
      {
        "id": 6,
        "description": "Log the completion of the update operation and return the constant INPUT.",
        "code": "\t\tlogger.info( \"Finishing update()\" ); //f:log\n\t\treturn INPUT;",
        "start_line": 141,
        "end_line": 142
      }
    ],
    "full_response": "### Step 1: Summarise the focal method\n\nThe `update()` method in the `classes.ProductAction` class is responsible for updating a product entity in the database using Hibernate. It performs the following tasks:\n1. Logs the start of the update operation.\n2. Opens a Hibernate session and begins a transaction.\n3. Updates the product entity in the database.\n4. Commits the transaction and closes the session.\n5. Sets a task mode and adds a success message for the update operation.\n6. Logs the completion of the update operation and returns a constant `INPUT`.\n\n### Step 2: List necessary environment settings to run the focal method\n\n#### Invoked parameters and fields:\n- `this.product`: The product entity to be updated in the database.\n- `this.task`: A field in the `classes.ProductAction` class that stores the task mode.\n- `SystemConstants.UD_MODE`: A constant representing the update mode.\n- `this.addActionMessage(String message)`: A method to add a success message to the action.\n- `this.getText(String key, String[] args)`: A method to retrieve localized text messages.\n\n#### Invoked methods:\n- `HibernateUtil.getSessionFactory()`: Retrieves the Hibernate `SessionFactory` instance.\n- `sess.update(Object entity)`: Updates the specified entity in the database.\n- `t.commit()`: Commits the active transaction.\n- `sess.close()`: Closes the Hibernate session.\n\n#### Dependent method bodies:\n- `HibernateUtil.getSessionFactory()`: Returns the static `SessionFactory` instance.\n\n---\n\n### Step 3: Decomposition of the focal method\n\n```json\n[\n  {\n    \"id\": 1,\n    \"description\": \"Log the start of the update operation.\",\n    \"code\": \"\\t\\tlogger.info( \\\"Starting update()\\\" ); //f:log\",\n    \"start_line\": 129,\n    \"end_line\": 129\n  },\n  {\n    \"id\": 2,\n    \"description\": \"Open a Hibernate session and begin a transaction.\",\n    \"code\": \"\\t\\tSession sess = HibernateUtil.getSessionFactory().openSession(); //f:hibernate\\n\\t\\tTransaction t = sess.beginTransaction(); //f:hibernate\",\n    \"start_line\": 130,\n    \"end_line\": 131\n  },\n  {\n    \"id\": 3,\n    \"description\": \"Update the product entity in the database.\",\n    \"code\": \"\\t\\tsess.update( this.product ); //f:hibernate\",\n    \"start_line\": 133,\n    \"end_line\": 133\n  },\n  {\n    \"id\": 4,\n    \"description\": \"Commit the transaction and close the Hibernate session.\",\n    \"code\": \"\\t\\tt.commit(); //f:hibernate\\n\\t\\tsess.close(); //f:hibernate\",\n    \"start_line\": 135,\n    \"end_line\": 136\n  },\n  {\n    \"id\": 5,\n    \"description\": \"Set the task mode to update and add a success message.\",\n    \"code\": \"\\t\\tthis.task = SystemConstants.UD_MODE;\\n\\t\\tthis.addActionMessage( this.getText( \\\"updateSuccessful\\\", new String[]{\\\"product\\\"})  );\",\n    \"start_line\": 138,\n    \"end_line\": 139\n  },\n  {\n    \"id\": 6,\n    \"description\": \"Log the completion of the update operation and return the constant INPUT.\",\n    \"code\": \"\\t\\tlogger.info( \\\"Finishing update()\\\" ); //f:log\\n\\t\\treturn INPUT;\",\n    \"start_line\": 141,\n    \"end_line\": 142\n  }\n]\n```"
  },
  {
    "class_name": "classes.ProductAction",
    "function_name": "delete()",
    "analysis": "### Step 1: Summarise the focal method\n\nThe `delete()` method in the `classes.ProductAction` class is responsible for deleting a product entity from the database using Hibernate. It performs the following key tasks:\n1. Logs the start of the deletion process.\n2. Opens a Hibernate session and begins a transaction.\n3. Deletes the product entity from the database.\n4. Commits the transaction and closes the session.\n5. Updates the task state and adds a success message to the action context.\n6. Logs the completion of the deletion process and returns the result of the `input()` method.\n\n### Step 2: List necessary environment settings to run the focal method\n\n#### Invoked Parameters and Fields\n- `this.product`: The product entity to be deleted.\n- `this.task`: A field updated to indicate the current task state.\n- `SystemConstants.CR_MODE`: A constant used to set the task state.\n- `this.addActionMessage(String)`: A method to add a success message to the action context.\n- `this.getText(String, String[])`: A method to retrieve localized text for the success message.\n\n#### Invoked Methods\n- `HibernateUtil.getSessionFactory()`: A static method to retrieve the Hibernate `SessionFactory`.\n- `sess.delete(Object)`: A Hibernate method to delete an entity.\n- `t.commit()`: A Hibernate method to commit the transaction.\n- `sess.close()`: A Hibernate method to close the session.\n- `logger.info(String)`: A logging method to log information.\n- `this.input()`: A method that returns the result of the action.\n\n---\n\n### Step 3: Decompose the focal method into multiple problem-solving steps",
    "slices": [
      {
        "id": 1,
        "description": "Log the start of the delete() method execution.",
        "code": "\t\tlogger.info( \"Starting delete()\" ); //f:log",
        "start_line": 146,
        "end_line": 146
      },
      {
        "id": 2,
        "description": "Initialize a Hibernate session and begin a transaction.",
        "code": "\t\tSession sess = HibernateUtil.getSessionFactory().openSession(); //f:hibernate\n\t\tTransaction t = sess.beginTransaction(); //f:hibernate",
        "start_line": 147,
        "end_line": 148
      },
      {
        "id": 3,
        "description": "Delete the product entity from the database using the Hibernate session.",
        "code": "\t\tsess.delete( this.product ); //f:hibernate",
        "start_line": 150,
        "end_line": 150
      },
      {
        "id": 4,
        "description": "Commit the transaction and close the Hibernate session.",
        "code": "\t\tt.commit(); //f:hibernate\n\t\tsess.close(); //f:hibernate",
        "start_line": 152,
        "end_line": 153
      },
      {
        "id": 5,
        "description": "Update the task state to indicate the current mode.",
        "code": "\t\tthis.task = SystemConstants.CR_MODE;",
        "start_line": 155,
        "end_line": 155
      },
      {
        "id": 6,
        "description": "Add a success message to the action context.",
        "code": "\t\tthis.addActionMessage( this.getText( \"deleteSuccessful\", new String[]{\"product\"})  );",
        "start_line": 156,
        "end_line": 156
      },
      {
        "id": 7,
        "description": "Log the completion of the delete() method execution.",
        "code": "\t\tlogger.info( \"Finishing delete()\" ); //f:log",
        "start_line": 158,
        "end_line": 158
      },
      {
        "id": 8,
        "description": "Return the result of the input() method.",
        "code": "\t\treturn this.input();",
        "start_line": 159,
        "end_line": 159
      }
    ],
    "full_response": "### Step 1: Summarise the focal method\n\nThe `delete()` method in the `classes.ProductAction` class is responsible for deleting a product entity from the database using Hibernate. It performs the following key tasks:\n1. Logs the start of the deletion process.\n2. Opens a Hibernate session and begins a transaction.\n3. Deletes the product entity from the database.\n4. Commits the transaction and closes the session.\n5. Updates the task state and adds a success message to the action context.\n6. Logs the completion of the deletion process and returns the result of the `input()` method.\n\n### Step 2: List necessary environment settings to run the focal method\n\n#### Invoked Parameters and Fields\n- `this.product`: The product entity to be deleted.\n- `this.task`: A field updated to indicate the current task state.\n- `SystemConstants.CR_MODE`: A constant used to set the task state.\n- `this.addActionMessage(String)`: A method to add a success message to the action context.\n- `this.getText(String, String[])`: A method to retrieve localized text for the success message.\n\n#### Invoked Methods\n- `HibernateUtil.getSessionFactory()`: A static method to retrieve the Hibernate `SessionFactory`.\n- `sess.delete(Object)`: A Hibernate method to delete an entity.\n- `t.commit()`: A Hibernate method to commit the transaction.\n- `sess.close()`: A Hibernate method to close the session.\n- `logger.info(String)`: A logging method to log information.\n- `this.input()`: A method that returns the result of the action.\n\n---\n\n### Step 3: Decompose the focal method into multiple problem-solving steps\n\n```json\n[\n  {\n    \"id\": 1,\n    \"description\": \"Log the start of the delete() method execution.\",\n    \"code\": \"\\t\\tlogger.info( \\\"Starting delete()\\\" ); //f:log\",\n    \"start_line\": 146,\n    \"end_line\": 146\n  },\n  {\n    \"id\": 2,\n    \"description\": \"Initialize a Hibernate session and begin a transaction.\",\n    \"code\": \"\\t\\tSession sess = HibernateUtil.getSessionFactory().openSession(); //f:hibernate\\n\\t\\tTransaction t = sess.beginTransaction(); //f:hibernate\",\n    \"start_line\": 147,\n    \"end_line\": 148\n  },\n  {\n    \"id\": 3,\n    \"description\": \"Delete the product entity from the database using the Hibernate session.\",\n    \"code\": \"\\t\\tsess.delete( this.product ); //f:hibernate\",\n    \"start_line\": 150,\n    \"end_line\": 150\n  },\n  {\n    \"id\": 4,\n    \"description\": \"Commit the transaction and close the Hibernate session.\",\n    \"code\": \"\\t\\tt.commit(); //f:hibernate\\n\\t\\tsess.close(); //f:hibernate\",\n    \"start_line\": 152,\n    \"end_line\": 153\n  },\n  {\n    \"id\": 5,\n    \"description\": \"Update the task state to indicate the current mode.\",\n    \"code\": \"\\t\\tthis.task = SystemConstants.CR_MODE;\",\n    \"start_line\": 155,\n    \"end_line\": 155\n  },\n  {\n    \"id\": 6,\n    \"description\": \"Add a success message to the action context.\",\n    \"code\": \"\\t\\tthis.addActionMessage( this.getText( \\\"deleteSuccessful\\\", new String[]{\\\"product\\\"})  );\",\n    \"start_line\": 156,\n    \"end_line\": 156\n  },\n  {\n    \"id\": 7,\n    \"description\": \"Log the completion of the delete() method execution.\",\n    \"code\": \"\\t\\tlogger.info( \\\"Finishing delete()\\\" ); //f:log\",\n    \"start_line\": 158,\n    \"end_line\": 158\n  },\n  {\n    \"id\": 8,\n    \"description\": \"Return the result of the input() method.\",\n    \"code\": \"\\t\\treturn this.input();\",\n    \"start_line\": 159,\n    \"end_line\": 159\n  }\n]\n```"
  },
  {
    "class_name": "classes.ProductAction",
    "function_name": "edit()",
    "analysis": "### Step 1: Summarise the focal method\n\nThe `edit()` method in the `classes.ProductAction` class is responsible for editing a product entity. It performs the following tasks:\n1. Logs the start of the method execution.\n2. Retrieves the product ID from the request parameters.\n3. Opens a Hibernate session and transaction.\n4. Fetches the product entity from the database using the retrieved ID.\n5. Commits the transaction and closes the session.\n6. Sets the fetched product entity to the current object.\n7. Updates the task field to a constant value (`SystemConstants.UD_MODE`).\n8. Logs the completion of the method execution.\n9. Returns the constant `INPUT`.\n\n### Step 2: List necessary environment settings to run the focal method\n\n#### Invoked parameters and fields:\n- `this.parameters`: A map-like structure containing request parameters, specifically the `id` parameter.\n- `this.task`: A field in the `classes.ProductAction` class, updated to `SystemConstants.UD_MODE`.\n- `this.setProduct(Product p)`: A method to set the fetched product entity to the current object.\n\n#### Invoked methods:\n- `HibernateUtil.getSessionFactory()`: A static method to retrieve the Hibernate `SessionFactory`.\n- `sess.get(Product.class, id)`: A Hibernate session method to fetch the product entity by ID.\n- `t.commit()`: A Hibernate transaction method to commit the transaction.\n- `sess.close()`: A Hibernate session method to close the session.\n\n#### Dependent classes and methods:\n- `classes.HibernateUtil`: Provides the `SessionFactory` for Hibernate sessions.\n  - `getSessionFactory()`: Returns the static `SessionFactory` instance.\n\n---\n\n### Step 3: Decompose the focal method into multiple problem-solving steps",
    "slices": [
      {
        "id": 1,
        "description": "Log the start of the method execution to indicate the beginning of the edit process.",
        "code": "\t\tlogger.info( \"Starting edit()\" ); //f:log",
        "start_line": 163,
        "end_line": 163
      },
      {
        "id": 2,
        "description": "Retrieve the product ID from the request parameters and convert it to an Integer.",
        "code": "\t\tInteger id = Integer.valueOf( this.parameters.get( \"id\" )[0] );",
        "start_line": 164,
        "end_line": 164
      },
      {
        "id": 3,
        "description": "Open a Hibernate session and begin a transaction to interact with the database.",
        "code": "\t\tSession sess = HibernateUtil.getSessionFactory().openSession(); //f:hibernate\n\t\tTransaction t = sess.beginTransaction(); //f:hibernate",
        "start_line": 166,
        "end_line": 167
      },
      {
        "id": 4,
        "description": "Fetch the product entity from the database using the retrieved ID.",
        "code": "\t\tProduct p = (Product) sess.get( Product.class, id ); //f:hibernate",
        "start_line": 169,
        "end_line": 169
      },
      {
        "id": 5,
        "description": "Commit the transaction and close the Hibernate session to finalize database operations.",
        "code": "\t\tt.commit(); //f:hibernate\n\t\tsess.close(); //f:hibernate",
        "start_line": 171,
        "end_line": 172
      },
      {
        "id": 6,
        "description": "Set the fetched product entity to the current object for further processing.",
        "code": "\t\tthis.setProduct( p );",
        "start_line": 174,
        "end_line": 174
      },
      {
        "id": 7,
        "description": "Update the task field to indicate the current mode of operation.",
        "code": "\t\tthis.task = SystemConstants.UD_MODE;",
        "start_line": 177,
        "end_line": 177
      },
      {
        "id": 8,
        "description": "Log the completion of the method execution to indicate the end of the edit process.",
        "code": "\t\tlogger.info( \"Finishing edit()\" ); //f:log",
        "start_line": 178,
        "end_line": 178
      },
      {
        "id": 9,
        "description": "Return the constant INPUT to indicate the result of the method execution.",
        "code": "\t\treturn INPUT;",
        "start_line": 179,
        "end_line": 179
      }
    ],
    "full_response": "### Step 1: Summarise the focal method\n\nThe `edit()` method in the `classes.ProductAction` class is responsible for editing a product entity. It performs the following tasks:\n1. Logs the start of the method execution.\n2. Retrieves the product ID from the request parameters.\n3. Opens a Hibernate session and transaction.\n4. Fetches the product entity from the database using the retrieved ID.\n5. Commits the transaction and closes the session.\n6. Sets the fetched product entity to the current object.\n7. Updates the task field to a constant value (`SystemConstants.UD_MODE`).\n8. Logs the completion of the method execution.\n9. Returns the constant `INPUT`.\n\n### Step 2: List necessary environment settings to run the focal method\n\n#### Invoked parameters and fields:\n- `this.parameters`: A map-like structure containing request parameters, specifically the `id` parameter.\n- `this.task`: A field in the `classes.ProductAction` class, updated to `SystemConstants.UD_MODE`.\n- `this.setProduct(Product p)`: A method to set the fetched product entity to the current object.\n\n#### Invoked methods:\n- `HibernateUtil.getSessionFactory()`: A static method to retrieve the Hibernate `SessionFactory`.\n- `sess.get(Product.class, id)`: A Hibernate session method to fetch the product entity by ID.\n- `t.commit()`: A Hibernate transaction method to commit the transaction.\n- `sess.close()`: A Hibernate session method to close the session.\n\n#### Dependent classes and methods:\n- `classes.HibernateUtil`: Provides the `SessionFactory` for Hibernate sessions.\n  - `getSessionFactory()`: Returns the static `SessionFactory` instance.\n\n---\n\n### Step 3: Decompose the focal method into multiple problem-solving steps\n\n```json\n[\n  {\n    \"id\": 1,\n    \"description\": \"Log the start of the method execution to indicate the beginning of the edit process.\",\n    \"code\": \"\\t\\tlogger.info( \\\"Starting edit()\\\" ); //f:log\",\n    \"start_line\": 163,\n    \"end_line\": 163\n  },\n  {\n    \"id\": 2,\n    \"description\": \"Retrieve the product ID from the request parameters and convert it to an Integer.\",\n    \"code\": \"\\t\\tInteger id = Integer.valueOf( this.parameters.get( \\\"id\\\" )[0] );\",\n    \"start_line\": 164,\n    \"end_line\": 164\n  },\n  {\n    \"id\": 3,\n    \"description\": \"Open a Hibernate session and begin a transaction to interact with the database.\",\n    \"code\": \"\\t\\tSession sess = HibernateUtil.getSessionFactory().openSession(); //f:hibernate\\n\\t\\tTransaction t = sess.beginTransaction(); //f:hibernate\",\n    \"start_line\": 166,\n    \"end_line\": 167\n  },\n  {\n    \"id\": 4,\n    \"description\": \"Fetch the product entity from the database using the retrieved ID.\",\n    \"code\": \"\\t\\tProduct p = (Product) sess.get( Product.class, id ); //f:hibernate\",\n    \"start_line\": 169,\n    \"end_line\": 169\n  },\n  {\n    \"id\": 5,\n    \"description\": \"Commit the transaction and close the Hibernate session to finalize database operations.\",\n    \"code\": \"\\t\\tt.commit(); //f:hibernate\\n\\t\\tsess.close(); //f:hibernate\",\n    \"start_line\": 171,\n    \"end_line\": 172\n  },\n  {\n    \"id\": 6,\n    \"description\": \"Set the fetched product entity to the current object for further processing.\",\n    \"code\": \"\\t\\tthis.setProduct( p );\",\n    \"start_line\": 174,\n    \"end_line\": 174\n  },\n  {\n    \"id\": 7,\n    \"description\": \"Update the task field to indicate the current mode of operation.\",\n    \"code\": \"\\t\\tthis.task = SystemConstants.UD_MODE;\",\n    \"start_line\": 177,\n    \"end_line\": 177\n  },\n  {\n    \"id\": 8,\n    \"description\": \"Log the completion of the method execution to indicate the end of the edit process.\",\n    \"code\": \"\\t\\tlogger.info( \\\"Finishing edit()\\\" ); //f:log\",\n    \"start_line\": 178,\n    \"end_line\": 178\n  },\n  {\n    \"id\": 9,\n    \"description\": \"Return the constant INPUT to indicate the result of the method execution.\",\n    \"code\": \"\\t\\treturn INPUT;\",\n    \"start_line\": 179,\n    \"end_line\": 179\n  }\n]\n```"
  },
  {
    "class_name": "classes.PurchaseOrderAction",
    "function_name": "input()",
    "analysis": "### Step 1: Summarize the focal method\n\nThe focal method `input()` is part of the `classes.PurchaseOrderAction` class. It is an overridden method that appears to be a key entry point for handling some kind of input-related functionality. The method is declared to throw a generic `Exception`, suggesting it may interact with external systems or perform operations that could fail. However, the provided code snippet does not contain the full implementation of the method, so its exact behavior is unclear from the given details.\n\n### Step 2: Necessary environment settings to run the focal method\n\n#### Invoked parameters and fields:\n- The method does not take any parameters directly.\n- It may rely on class-level fields or external dependencies, but these are not explicitly visible in the provided snippet.\n\n#### Invoked methods:\n- The method appears to be self-referential, as it calls `this.input()` on line 78. This suggests that there may be an overloaded or recursive behavior, but the context is insufficient to confirm this.\n\n#### External dependencies:\n- The `HibernateUtil` class is mentioned as a dependency in the provided details. It contains a static field `sessionFactory` and a static method `getSessionFactory()`. These could potentially be used within the `input()` method, though the provided code snippet does not explicitly show their usage.\n\n---\n\n### Step 3: Decomposition of the focal method",
    "slices": [
      {
        "id": 1,
        "description": "Handle recursive or self-referential invocation of the `input()` method.",
        "code": "\t\treturn this.input();",
        "start_line": 78,
        "end_line": 78
      },
      {
        "id": 2,
        "description": "Define the method signature and declare that the method can throw an exception.",
        "code": "\t@Override\n\tpublic String input() throws Exception {",
        "start_line": 81,
        "end_line": 82
      }
    ],
    "full_response": "### Step 1: Summarize the focal method\n\nThe focal method `input()` is part of the `classes.PurchaseOrderAction` class. It is an overridden method that appears to be a key entry point for handling some kind of input-related functionality. The method is declared to throw a generic `Exception`, suggesting it may interact with external systems or perform operations that could fail. However, the provided code snippet does not contain the full implementation of the method, so its exact behavior is unclear from the given details.\n\n### Step 2: Necessary environment settings to run the focal method\n\n#### Invoked parameters and fields:\n- The method does not take any parameters directly.\n- It may rely on class-level fields or external dependencies, but these are not explicitly visible in the provided snippet.\n\n#### Invoked methods:\n- The method appears to be self-referential, as it calls `this.input()` on line 78. This suggests that there may be an overloaded or recursive behavior, but the context is insufficient to confirm this.\n\n#### External dependencies:\n- The `HibernateUtil` class is mentioned as a dependency in the provided details. It contains a static field `sessionFactory` and a static method `getSessionFactory()`. These could potentially be used within the `input()` method, though the provided code snippet does not explicitly show their usage.\n\n---\n\n### Step 3: Decomposition of the focal method\n\n```json\n[\n  {\n    \"id\": 1,\n    \"description\": \"Handle recursive or self-referential invocation of the `input()` method.\",\n    \"code\": \"\\t\\treturn this.input();\",\n    \"start_line\": 78,\n    \"end_line\": 78\n  },\n  {\n    \"id\": 2,\n    \"description\": \"Define the method signature and declare that the method can throw an exception.\",\n    \"code\": \"\\t@Override\\n\\tpublic String input() throws Exception {\",\n    \"start_line\": 81,\n    \"end_line\": 82\n  }\n]\n```"
  },
  {
    "class_name": "classes.PurchaseOrderAction",
    "function_name": "find()",
    "analysis": "### Step 1: Summarize the Focal Method\n\nThe `find()` method in the `PurchaseOrderAction` class is responsible for searching and retrieving a list of `PurchaseOrder` objects from the database based on specific criteria. It uses Hibernate for database interaction and applies filtering conditions based on the `PurchaseOrder` and its associated `Customer` object. The method performs the following key operations:\n1. Logs the start of the method.\n2. Opens a Hibernate session and begins a transaction.\n3. Constructs a `Criteria` query for the `PurchaseOrder` class, applying filters based on the `PurchaseOrder` and `Customer` fields.\n4. Executes the query and retrieves a distinct list of matching `PurchaseOrder` objects.\n5. Commits the transaction, closes the session, and stores the result in a request map.\n6. Logs the completion of the method and returns an `INPUT` string.\n\n---\n\n### Step 2: Necessary Environment Settings to Run the Focal Method\n\n#### Invoked Parameters and Fields\n1. **Fields from `PurchaseOrderAction` class:**\n   - `this.purchaseOrder`: An instance of `PurchaseOrder` containing the search criteria.\n   - `request`: A map-like object used to store the result list.\n   - `this.task`: A field updated to indicate the current task (`SystemConstants.CR_MODE`).\n\n2. **Fields from `HibernateUtil` class:**\n   - `sessionFactory`: A static field used to obtain Hibernate sessions.\n\n3. **Fields from `PurchaseOrder` class:**\n   - `id`: The ID of the purchase order.\n   - `customer`: The associated `Customer` object.\n\n4. **Fields from `Customer` class:**\n   - `id`: The ID of the customer.\n\n#### Invoked Methods\n1. **From `HibernateUtil`:**\n   - `getSessionFactory()`: Returns the `SessionFactory` instance.\n\n2. **From `PurchaseOrder`:**\n   - `getId()`: Retrieves the ID of the purchase order.\n   - `getCustomer()`: Retrieves the associated `Customer` object.\n\n3. **From `Customer`:**\n   - `getId()`: Retrieves the ID of the customer.\n\n4. **Hibernate API:**\n   - `SessionFactory.openSession()`: Opens a new Hibernate session.\n   - `Session.beginTransaction()`: Begins a transaction.\n   - `Session.createCriteria(Class)`: Creates a `Criteria` query for the specified class.\n   - `Criteria.add(Criterion)`: Adds a filtering condition to the query.\n   - `Criteria.setResultTransformer(Transformer)`: Configures the query to return distinct results.\n   - `Criteria.list()`: Executes the query and retrieves the results.\n   - `Transaction.commit()`: Commits the transaction.\n   - `Session.close()`: Closes the session.\n\n---\n\n### Step 3: Decomposition of the Focal Method",
    "slices": [
      {
        "id": 1,
        "description": "Log the start of the method execution.",
        "code": "\t\tlogger.info( \"Starting find()\" ); //f:log",
        "start_line": 110,
        "end_line": 110
      },
      {
        "id": 2,
        "description": "Initialize the Hibernate session and transaction.",
        "code": "\t\tSession sess = HibernateUtil.getSessionFactory().openSession(); //f:hibernate\n\t\tTransaction t = sess.beginTransaction(); //f:hibernate",
        "start_line": 111,
        "end_line": 112
      },
      {
        "id": 3,
        "description": "Create a Criteria query for the PurchaseOrder class.",
        "code": "\t\tCriteria criteria = sess.createCriteria( PurchaseOrder.class ); //f:hibernate",
        "start_line": 114,
        "end_line": 114
      },
      {
        "id": 4,
        "description": "Apply filtering conditions to the Criteria query based on the PurchaseOrder fields.",
        "code": "\t\tcriteria.add( Example.create( this.purchaseOrder ).excludeZeroes().ignoreCase().enableLike( MatchMode.ANYWHERE ) ); //f:hibernate\n\t\tif ( this.purchaseOrder.getId() != null ) { //f:hibernate\n\t\t\tcriteria.add( Restrictions.idEq( this.purchaseOrder.getId() ) ); //f:hibernate\n\t\t} //f:hibernate",
        "start_line": 116,
        "end_line": 119
      },
      {
        "id": 5,
        "description": "Apply filtering conditions to the Criteria query based on the associated Customer fields.",
        "code": "\t\tif ( this.purchaseOrder.getCustomer().getId() != null ) { //f:hibernate\n\t\t\tcriteria.add( Restrictions.eq( \"customer\", this.purchaseOrder.getCustomer() ) ); //f:hibernate\n\t\t} //f:hibernate",
        "start_line": 121,
        "end_line": 123
      },
      {
        "id": 6,
        "description": "Configure the Criteria query to return distinct results and execute it to retrieve the list of matching PurchaseOrder objects.",
        "code": "\t\tcriteria.setResultTransformer( Criteria.DISTINCT_ROOT_ENTITY ); //f:hibernate\n\t\t@SuppressWarnings(\"unchecked\")\n\t\tList<PurchaseOrder> l = (List<PurchaseOrder>) criteria.list(); //f:hibernate",
        "start_line": 125,
        "end_line": 127
      },
      {
        "id": 7,
        "description": "Commit the transaction and close the Hibernate session.",
        "code": "\t\tt.commit(); //f:hibernate\n\t\tsess.close(); //f:hibernate",
        "start_line": 128,
        "end_line": 129
      },
      {
        "id": 8,
        "description": "Store the result list in the request map and update the task field.",
        "code": "\t\trequest.put( \"list\", l );\n\n\t\tthis.task = SystemConstants.CR_MODE;",
        "start_line": 130,
        "end_line": 132
      },
      {
        "id": 9,
        "description": "Log the completion of the method and return the INPUT string.",
        "code": "\t\tlogger.info( \"Finishing input()\" ); //f:log\n\t\treturn INPUT;",
        "start_line": 133,
        "end_line": 134
      }
    ],
    "full_response": "### Step 1: Summarize the Focal Method\n\nThe `find()` method in the `PurchaseOrderAction` class is responsible for searching and retrieving a list of `PurchaseOrder` objects from the database based on specific criteria. It uses Hibernate for database interaction and applies filtering conditions based on the `PurchaseOrder` and its associated `Customer` object. The method performs the following key operations:\n1. Logs the start of the method.\n2. Opens a Hibernate session and begins a transaction.\n3. Constructs a `Criteria` query for the `PurchaseOrder` class, applying filters based on the `PurchaseOrder` and `Customer` fields.\n4. Executes the query and retrieves a distinct list of matching `PurchaseOrder` objects.\n5. Commits the transaction, closes the session, and stores the result in a request map.\n6. Logs the completion of the method and returns an `INPUT` string.\n\n---\n\n### Step 2: Necessary Environment Settings to Run the Focal Method\n\n#### Invoked Parameters and Fields\n1. **Fields from `PurchaseOrderAction` class:**\n   - `this.purchaseOrder`: An instance of `PurchaseOrder` containing the search criteria.\n   - `request`: A map-like object used to store the result list.\n   - `this.task`: A field updated to indicate the current task (`SystemConstants.CR_MODE`).\n\n2. **Fields from `HibernateUtil` class:**\n   - `sessionFactory`: A static field used to obtain Hibernate sessions.\n\n3. **Fields from `PurchaseOrder` class:**\n   - `id`: The ID of the purchase order.\n   - `customer`: The associated `Customer` object.\n\n4. **Fields from `Customer` class:**\n   - `id`: The ID of the customer.\n\n#### Invoked Methods\n1. **From `HibernateUtil`:**\n   - `getSessionFactory()`: Returns the `SessionFactory` instance.\n\n2. **From `PurchaseOrder`:**\n   - `getId()`: Retrieves the ID of the purchase order.\n   - `getCustomer()`: Retrieves the associated `Customer` object.\n\n3. **From `Customer`:**\n   - `getId()`: Retrieves the ID of the customer.\n\n4. **Hibernate API:**\n   - `SessionFactory.openSession()`: Opens a new Hibernate session.\n   - `Session.beginTransaction()`: Begins a transaction.\n   - `Session.createCriteria(Class)`: Creates a `Criteria` query for the specified class.\n   - `Criteria.add(Criterion)`: Adds a filtering condition to the query.\n   - `Criteria.setResultTransformer(Transformer)`: Configures the query to return distinct results.\n   - `Criteria.list()`: Executes the query and retrieves the results.\n   - `Transaction.commit()`: Commits the transaction.\n   - `Session.close()`: Closes the session.\n\n---\n\n### Step 3: Decomposition of the Focal Method\n\n```json\n[\n  {\n    \"id\": 1,\n    \"description\": \"Log the start of the method execution.\",\n    \"code\": \"\\t\\tlogger.info( \\\"Starting find()\\\" ); //f:log\",\n    \"start_line\": 110,\n    \"end_line\": 110\n  },\n  {\n    \"id\": 2,\n    \"description\": \"Initialize the Hibernate session and transaction.\",\n    \"code\": \"\\t\\tSession sess = HibernateUtil.getSessionFactory().openSession(); //f:hibernate\\n\\t\\tTransaction t = sess.beginTransaction(); //f:hibernate\",\n    \"start_line\": 111,\n    \"end_line\": 112\n  },\n  {\n    \"id\": 3,\n    \"description\": \"Create a Criteria query for the PurchaseOrder class.\",\n    \"code\": \"\\t\\tCriteria criteria = sess.createCriteria( PurchaseOrder.class ); //f:hibernate\",\n    \"start_line\": 114,\n    \"end_line\": 114\n  },\n  {\n    \"id\": 4,\n    \"description\": \"Apply filtering conditions to the Criteria query based on the PurchaseOrder fields.\",\n    \"code\": \"\\t\\tcriteria.add( Example.create( this.purchaseOrder ).excludeZeroes().ignoreCase().enableLike( MatchMode.ANYWHERE ) ); //f:hibernate\\n\\t\\tif ( this.purchaseOrder.getId() != null ) { //f:hibernate\\n\\t\\t\\tcriteria.add( Restrictions.idEq( this.purchaseOrder.getId() ) ); //f:hibernate\\n\\t\\t} //f:hibernate\",\n    \"start_line\": 116,\n    \"end_line\": 119\n  },\n  {\n    \"id\": 5,\n    \"description\": \"Apply filtering conditions to the Criteria query based on the associated Customer fields.\",\n    \"code\": \"\\t\\tif ( this.purchaseOrder.getCustomer().getId() != null ) { //f:hibernate\\n\\t\\t\\tcriteria.add( Restrictions.eq( \\\"customer\\\", this.purchaseOrder.getCustomer() ) ); //f:hibernate\\n\\t\\t} //f:hibernate\",\n    \"start_line\": 121,\n    \"end_line\": 123\n  },\n  {\n    \"id\": 6,\n    \"description\": \"Configure the Criteria query to return distinct results and execute it to retrieve the list of matching PurchaseOrder objects.\",\n    \"code\": \"\\t\\tcriteria.setResultTransformer( Criteria.DISTINCT_ROOT_ENTITY ); //f:hibernate\\n\\t\\t@SuppressWarnings(\\\"unchecked\\\")\\n\\t\\tList<PurchaseOrder> l = (List<PurchaseOrder>) criteria.list(); //f:hibernate\",\n    \"start_line\": 125,\n    \"end_line\": 127\n  },\n  {\n    \"id\": 7,\n    \"description\": \"Commit the transaction and close the Hibernate session.\",\n    \"code\": \"\\t\\tt.commit(); //f:hibernate\\n\\t\\tsess.close(); //f:hibernate\",\n    \"start_line\": 128,\n    \"end_line\": 129\n  },\n  {\n    \"id\": 8,\n    \"description\": \"Store the result list in the request map and update the task field.\",\n    \"code\": \"\\t\\trequest.put( \\\"list\\\", l );\\n\\n\\t\\tthis.task = SystemConstants.CR_MODE;\",\n    \"start_line\": 130,\n    \"end_line\": 132\n  },\n  {\n    \"id\": 9,\n    \"description\": \"Log the completion of the method and return the INPUT string.\",\n    \"code\": \"\\t\\tlogger.info( \\\"Finishing input()\\\" ); //f:log\\n\\t\\treturn INPUT;\",\n    \"start_line\": 133,\n    \"end_line\": 134\n  }\n]\n```"
  },
  {
    "class_name": "classes.PurchaseOrderAction",
    "function_name": "save()",
    "analysis": "### Step 1: Summary of the Focal Method\n\nThe `save()` method in the `classes.PurchaseOrderAction` class is responsible for persisting a `PurchaseOrder` object to the database using Hibernate. It performs the following tasks:\n1. Logs the start of the save operation.\n2. Opens a Hibernate session and begins a transaction.\n3. Saves the `PurchaseOrder` object to the database.\n4. Commits the transaction and closes the session.\n5. Updates the `PurchaseOrder` with the current date.\n6. Iterates through the associated `PurchaseOrderItem` objects and sets their parent `PurchaseOrder`.\n7. Updates the task state and adds a success message.\n8. Logs the completion of the save operation and returns a result.\n\n---\n\n### Step 2: Necessary Environment Settings to Run the Focal Method\n\n#### Invoked Parameters and Fields\n1. **Fields in `PurchaseOrderAction`**:\n   - `this.purchaseOrder`: The `PurchaseOrder` object being saved.\n   - `this.task`: A field updated with a constant value.\n   \n2. **Dependent Fields**:\n   - `HibernateUtil.sessionFactory`: Provides the Hibernate `SessionFactory`.\n   - `PurchaseOrder.purchaseOrderItems`: A collection of `PurchaseOrderItem` objects.\n   - `PurchaseOrderItem.purchaseOrder`: A reference to the parent `PurchaseOrder`.\n\n#### Invoked Methods\n1. **From `HibernateUtil`**:\n   - `getSessionFactory()`: Retrieves the `SessionFactory` to create a Hibernate session.\n\n2. **From `PurchaseOrder`**:\n   - `getPurchaseOrderItems()`: Retrieves the associated `PurchaseOrderItem` objects.\n   - `setOrderDate(Date)`: Sets the order date for the `PurchaseOrder`.\n\n3. **From `PurchaseOrderItem`**:\n   - `setPurchaseOrder(PurchaseOrder)`: Sets the parent `PurchaseOrder` for the item.\n\n4. **Logging and Messaging**:\n   - `logger.info(String)`: Logs messages.\n   - `addActionMessage(String)`: Adds a success message to the action.\n\n---\n\n### Step 3: Decomposition of the Focal Method",
    "slices": [
      {
        "id": 1,
        "description": "Log the start of the save operation.",
        "code": "\t\tlogger.info( \"Starting save()\" ); //f:log",
        "start_line": 138,
        "end_line": 138
      },
      {
        "id": 2,
        "description": "Open a Hibernate session and begin a transaction.",
        "code": "\t\tSession sess = HibernateUtil.getSessionFactory().openSession(); //f:hibernate\n\t\tTransaction t = sess.beginTransaction(); //f:hibernate",
        "start_line": 139,
        "end_line": 140
      },
      {
        "id": 3,
        "description": "Save the PurchaseOrder object to the database.",
        "code": "\t\tsess.save( this.purchaseOrder ); //f:hibernate",
        "start_line": 142,
        "end_line": 142
      },
      {
        "id": 4,
        "description": "Commit the transaction and close the Hibernate session.",
        "code": "\t\tt.commit(); //f:hibernate\n\t\tsess.close(); //f:hibernate",
        "start_line": 144,
        "end_line": 145
      },
      {
        "id": 5,
        "description": "Set the order date for the PurchaseOrder to the current date.",
        "code": "\t\tthis.purchaseOrder.setOrderDate( new Date() );",
        "start_line": 147,
        "end_line": 147
      },
      {
        "id": 6,
        "description": "Iterate through the PurchaseOrderItems and set their parent PurchaseOrder.",
        "code": "\t\tfor (PurchaseOrderItem item : this.purchaseOrder.getPurchaseOrderItems()) {  \n\t\t\titem.setPurchaseOrder( this.purchaseOrder );\n\t\t}",
        "start_line": 149,
        "end_line": 151
      },
      {
        "id": 7,
        "description": "Update the task state and add a success message.",
        "code": "\t\tthis.task = SystemConstants.UD_MODE;\n\t\tthis.addActionMessage( this.getText( \"saveSuccessful\", new String[] { \"order\" } ) );",
        "start_line": 153,
        "end_line": 154
      },
      {
        "id": 8,
        "description": "Log the completion of the save operation and return the result.",
        "code": "\t\tlogger.info( \"Finishing save()\" ); //f:log\n\t\treturn INPUT;",
        "start_line": 156,
        "end_line": 157
      }
    ],
    "full_response": "### Step 1: Summary of the Focal Method\n\nThe `save()` method in the `classes.PurchaseOrderAction` class is responsible for persisting a `PurchaseOrder` object to the database using Hibernate. It performs the following tasks:\n1. Logs the start of the save operation.\n2. Opens a Hibernate session and begins a transaction.\n3. Saves the `PurchaseOrder` object to the database.\n4. Commits the transaction and closes the session.\n5. Updates the `PurchaseOrder` with the current date.\n6. Iterates through the associated `PurchaseOrderItem` objects and sets their parent `PurchaseOrder`.\n7. Updates the task state and adds a success message.\n8. Logs the completion of the save operation and returns a result.\n\n---\n\n### Step 2: Necessary Environment Settings to Run the Focal Method\n\n#### Invoked Parameters and Fields\n1. **Fields in `PurchaseOrderAction`**:\n   - `this.purchaseOrder`: The `PurchaseOrder` object being saved.\n   - `this.task`: A field updated with a constant value.\n   \n2. **Dependent Fields**:\n   - `HibernateUtil.sessionFactory`: Provides the Hibernate `SessionFactory`.\n   - `PurchaseOrder.purchaseOrderItems`: A collection of `PurchaseOrderItem` objects.\n   - `PurchaseOrderItem.purchaseOrder`: A reference to the parent `PurchaseOrder`.\n\n#### Invoked Methods\n1. **From `HibernateUtil`**:\n   - `getSessionFactory()`: Retrieves the `SessionFactory` to create a Hibernate session.\n\n2. **From `PurchaseOrder`**:\n   - `getPurchaseOrderItems()`: Retrieves the associated `PurchaseOrderItem` objects.\n   - `setOrderDate(Date)`: Sets the order date for the `PurchaseOrder`.\n\n3. **From `PurchaseOrderItem`**:\n   - `setPurchaseOrder(PurchaseOrder)`: Sets the parent `PurchaseOrder` for the item.\n\n4. **Logging and Messaging**:\n   - `logger.info(String)`: Logs messages.\n   - `addActionMessage(String)`: Adds a success message to the action.\n\n---\n\n### Step 3: Decomposition of the Focal Method\n\n```json\n[\n  {\n    \"id\": 1,\n    \"description\": \"Log the start of the save operation.\",\n    \"code\": \"\\t\\tlogger.info( \\\"Starting save()\\\" ); //f:log\",\n    \"start_line\": 138,\n    \"end_line\": 138\n  },\n  {\n    \"id\": 2,\n    \"description\": \"Open a Hibernate session and begin a transaction.\",\n    \"code\": \"\\t\\tSession sess = HibernateUtil.getSessionFactory().openSession(); //f:hibernate\\n\\t\\tTransaction t = sess.beginTransaction(); //f:hibernate\",\n    \"start_line\": 139,\n    \"end_line\": 140\n  },\n  {\n    \"id\": 3,\n    \"description\": \"Save the PurchaseOrder object to the database.\",\n    \"code\": \"\\t\\tsess.save( this.purchaseOrder ); //f:hibernate\",\n    \"start_line\": 142,\n    \"end_line\": 142\n  },\n  {\n    \"id\": 4,\n    \"description\": \"Commit the transaction and close the Hibernate session.\",\n    \"code\": \"\\t\\tt.commit(); //f:hibernate\\n\\t\\tsess.close(); //f:hibernate\",\n    \"start_line\": 144,\n    \"end_line\": 145\n  },\n  {\n    \"id\": 5,\n    \"description\": \"Set the order date for the PurchaseOrder to the current date.\",\n    \"code\": \"\\t\\tthis.purchaseOrder.setOrderDate( new Date() );\",\n    \"start_line\": 147,\n    \"end_line\": 147\n  },\n  {\n    \"id\": 6,\n    \"description\": \"Iterate through the PurchaseOrderItems and set their parent PurchaseOrder.\",\n    \"code\": \"\\t\\tfor (PurchaseOrderItem item : this.purchaseOrder.getPurchaseOrderItems()) {  \\n\\t\\t\\titem.setPurchaseOrder( this.purchaseOrder );\\n\\t\\t}\",\n    \"start_line\": 149,\n    \"end_line\": 151\n  },\n  {\n    \"id\": 7,\n    \"description\": \"Update the task state and add a success message.\",\n    \"code\": \"\\t\\tthis.task = SystemConstants.UD_MODE;\\n\\t\\tthis.addActionMessage( this.getText( \\\"saveSuccessful\\\", new String[] { \\\"order\\\" } ) );\",\n    \"start_line\": 153,\n    \"end_line\": 154\n  },\n  {\n    \"id\": 8,\n    \"description\": \"Log the completion of the save operation and return the result.\",\n    \"code\": \"\\t\\tlogger.info( \\\"Finishing save()\\\" ); //f:log\\n\\t\\treturn INPUT;\",\n    \"start_line\": 156,\n    \"end_line\": 157\n  }\n]\n```"
  },
  {
    "class_name": "classes.PurchaseOrderAction",
    "function_name": "update()",
    "analysis": "### Step 1: Summarize the focal method\n\nThe `update()` method in the `PurchaseOrderAction` class is responsible for updating a `PurchaseOrder` object in the database using Hibernate. It performs the following tasks:\n1. Logs the start of the update process.\n2. Opens a Hibernate session and begins a transaction.\n3. Updates the `PurchaseOrder` object in the database.\n4. Commits the transaction and closes the session.\n5. Iterates over the `PurchaseOrderItems` associated with the `PurchaseOrder` and sets their parent `PurchaseOrder`.\n6. Updates the task field and adds a success message.\n7. Logs the completion of the update process and returns an input constant.\n\n### Step 2: List necessary environment settings to run the focal method\n\n#### Invoked Parameters and Fields\n1. **Fields in `PurchaseOrderAction`**:\n   - `this.purchaseOrder`: The `PurchaseOrder` object being updated.\n   - `this.task`: A field updated to indicate the task mode.\n   \n2. **Fields in `PurchaseOrder`**:\n   - `purchaseOrderItems`: A collection of `PurchaseOrderItem` objects associated with the `PurchaseOrder`.\n\n3. **Fields in `PurchaseOrderItem`**:\n   - `purchaseOrder`: The parent `PurchaseOrder` object.\n\n#### Invoked Methods\n1. **Hibernate Session Management**:\n   - `HibernateUtil.getSessionFactory()`: Retrieves the Hibernate `SessionFactory`.\n   - `Session.openSession()`: Opens a Hibernate session.\n   - `Session.beginTransaction()`: Begins a transaction.\n   - `Session.update(Object)`: Updates an object in the database.\n   - `Transaction.commit()`: Commits the transaction.\n   - `Session.close()`: Closes the session.\n\n2. **PurchaseOrder Methods**:\n   - `getPurchaseOrderItems()`: Retrieves the collection of associated `PurchaseOrderItem` objects.\n\n3. **PurchaseOrderItem Methods**:\n   - `setPurchaseOrder(PurchaseOrder)`: Sets the parent `PurchaseOrder` for a `PurchaseOrderItem`.\n\n4. **Logging and Messaging**:\n   - `logger.info(String)`: Logs informational messages.\n   - `addActionMessage(String)`: Adds a success message.\n   - `getText(String, String[])`: Retrieves a localized message.\n\n---\n\n### Step 3: Decomposition of the focal method",
    "slices": [
      {
        "id": 1,
        "description": "Log the start of the update process.",
        "code": "\t\tlogger.info( \"Starting update()\" ); //f:log",
        "start_line": 161,
        "end_line": 161
      },
      {
        "id": 2,
        "description": "Open a Hibernate session and begin a transaction.",
        "code": "\t\tSession sess = HibernateUtil.getSessionFactory().openSession(); //f:hibernate\n\t\tTransaction t = sess.beginTransaction(); //f:hibernate",
        "start_line": 162,
        "end_line": 163
      },
      {
        "id": 3,
        "description": "Update the PurchaseOrder object in the database.",
        "code": "\t\tsess.update( this.purchaseOrder ); //f:hibernate",
        "start_line": 164,
        "end_line": 164
      },
      {
        "id": 4,
        "description": "Commit the transaction and close the Hibernate session.",
        "code": "\t\tt.commit(); //f:hibernate\n\t\tsess.close(); //f:hibernate",
        "start_line": 166,
        "end_line": 167
      },
      {
        "id": 5,
        "description": "Set the parent PurchaseOrder for each PurchaseOrderItem in the collection.",
        "code": "\t\tfor (PurchaseOrderItem item : this.purchaseOrder.getPurchaseOrderItems()){\n\t\t\titem.setPurchaseOrder( this.purchaseOrder );\n\t\t}",
        "start_line": 169,
        "end_line": 171
      },
      {
        "id": 6,
        "description": "Update the task field and add a success message.",
        "code": "\t\tthis.task = SystemConstants.UD_MODE;\n\t\tthis.addActionMessage( this.getText( \"updateSuccessful\", new String[] { \"order\" } ) );",
        "start_line": 173,
        "end_line": 174
      },
      {
        "id": 7,
        "description": "Log the completion of the update process and return the input constant.",
        "code": "\t\tlogger.info( \"Finishing update()\" ); //f:log\n\t\treturn INPUT;",
        "start_line": 176,
        "end_line": 177
      }
    ],
    "full_response": "### Step 1: Summarize the focal method\n\nThe `update()` method in the `PurchaseOrderAction` class is responsible for updating a `PurchaseOrder` object in the database using Hibernate. It performs the following tasks:\n1. Logs the start of the update process.\n2. Opens a Hibernate session and begins a transaction.\n3. Updates the `PurchaseOrder` object in the database.\n4. Commits the transaction and closes the session.\n5. Iterates over the `PurchaseOrderItems` associated with the `PurchaseOrder` and sets their parent `PurchaseOrder`.\n6. Updates the task field and adds a success message.\n7. Logs the completion of the update process and returns an input constant.\n\n### Step 2: List necessary environment settings to run the focal method\n\n#### Invoked Parameters and Fields\n1. **Fields in `PurchaseOrderAction`**:\n   - `this.purchaseOrder`: The `PurchaseOrder` object being updated.\n   - `this.task`: A field updated to indicate the task mode.\n   \n2. **Fields in `PurchaseOrder`**:\n   - `purchaseOrderItems`: A collection of `PurchaseOrderItem` objects associated with the `PurchaseOrder`.\n\n3. **Fields in `PurchaseOrderItem`**:\n   - `purchaseOrder`: The parent `PurchaseOrder` object.\n\n#### Invoked Methods\n1. **Hibernate Session Management**:\n   - `HibernateUtil.getSessionFactory()`: Retrieves the Hibernate `SessionFactory`.\n   - `Session.openSession()`: Opens a Hibernate session.\n   - `Session.beginTransaction()`: Begins a transaction.\n   - `Session.update(Object)`: Updates an object in the database.\n   - `Transaction.commit()`: Commits the transaction.\n   - `Session.close()`: Closes the session.\n\n2. **PurchaseOrder Methods**:\n   - `getPurchaseOrderItems()`: Retrieves the collection of associated `PurchaseOrderItem` objects.\n\n3. **PurchaseOrderItem Methods**:\n   - `setPurchaseOrder(PurchaseOrder)`: Sets the parent `PurchaseOrder` for a `PurchaseOrderItem`.\n\n4. **Logging and Messaging**:\n   - `logger.info(String)`: Logs informational messages.\n   - `addActionMessage(String)`: Adds a success message.\n   - `getText(String, String[])`: Retrieves a localized message.\n\n---\n\n### Step 3: Decomposition of the focal method\n\n```json\n[\n  {\n    \"id\": 1,\n    \"description\": \"Log the start of the update process.\",\n    \"code\": \"\\t\\tlogger.info( \\\"Starting update()\\\" ); //f:log\",\n    \"start_line\": 161,\n    \"end_line\": 161\n  },\n  {\n    \"id\": 2,\n    \"description\": \"Open a Hibernate session and begin a transaction.\",\n    \"code\": \"\\t\\tSession sess = HibernateUtil.getSessionFactory().openSession(); //f:hibernate\\n\\t\\tTransaction t = sess.beginTransaction(); //f:hibernate\",\n    \"start_line\": 162,\n    \"end_line\": 163\n  },\n  {\n    \"id\": 3,\n    \"description\": \"Update the PurchaseOrder object in the database.\",\n    \"code\": \"\\t\\tsess.update( this.purchaseOrder ); //f:hibernate\",\n    \"start_line\": 164,\n    \"end_line\": 164\n  },\n  {\n    \"id\": 4,\n    \"description\": \"Commit the transaction and close the Hibernate session.\",\n    \"code\": \"\\t\\tt.commit(); //f:hibernate\\n\\t\\tsess.close(); //f:hibernate\",\n    \"start_line\": 166,\n    \"end_line\": 167\n  },\n  {\n    \"id\": 5,\n    \"description\": \"Set the parent PurchaseOrder for each PurchaseOrderItem in the collection.\",\n    \"code\": \"\\t\\tfor (PurchaseOrderItem item : this.purchaseOrder.getPurchaseOrderItems()){\\n\\t\\t\\titem.setPurchaseOrder( this.purchaseOrder );\\n\\t\\t}\",\n    \"start_line\": 169,\n    \"end_line\": 171\n  },\n  {\n    \"id\": 6,\n    \"description\": \"Update the task field and add a success message.\",\n    \"code\": \"\\t\\tthis.task = SystemConstants.UD_MODE;\\n\\t\\tthis.addActionMessage( this.getText( \\\"updateSuccessful\\\", new String[] { \\\"order\\\" } ) );\",\n    \"start_line\": 173,\n    \"end_line\": 174\n  },\n  {\n    \"id\": 7,\n    \"description\": \"Log the completion of the update process and return the input constant.\",\n    \"code\": \"\\t\\tlogger.info( \\\"Finishing update()\\\" ); //f:log\\n\\t\\treturn INPUT;\",\n    \"start_line\": 176,\n    \"end_line\": 177\n  }\n]\n```"
  },
  {
    "class_name": "classes.PurchaseOrderAction",
    "function_name": "delete()",
    "analysis": "### Step 1: Summarize the focal method\n\nThe `delete()` method in the `classes.PurchaseOrderAction` class is responsible for deleting a `purchaseOrder` object from the database using Hibernate. It performs the following operations:\n1. Logs the start of the method execution.\n2. Opens a Hibernate session and begins a transaction.\n3. Deletes the `purchaseOrder` object from the database.\n4. Commits the transaction and closes the session.\n5. Updates the `task` field to a specific mode (`SystemConstants.CR_MODE`).\n6. Adds a success message to the action context.\n7. Logs the completion of the method execution.\n8. Returns the result of the `input()` method.\n\n### Step 2: Necessary environment settings to run the focal method\n\n#### Invoked parameters and fields:\n1. **Field `this.purchaseOrder`**: Represents the purchase order object to be deleted.\n2. **Field `this.task`**: Updated to `SystemConstants.CR_MODE` after deletion.\n3. **Field `SystemConstants.CR_MODE`**: A constant representing a specific mode.\n4. **Field `logger`**: Used for logging method execution details.\n\n#### Invoked methods:\n1. **`HibernateUtil.getSessionFactory()`**: Retrieves the Hibernate `SessionFactory` instance.\n2. **`sess.delete(this.purchaseOrder)`**: Deletes the purchase order object from the database.\n3. **`t.commit()`**: Commits the transaction.\n4. **`sess.close()`**: Closes the Hibernate session.\n5. **`this.addActionMessage()`**: Adds a success message to the action context.\n6. **`this.getText()`**: Retrieves localized text for the success message.\n7. **`this.input()`**: Returns the result of the `input()` method.\n\n---\n\n### Step 3: Decomposition of the focal method into slices",
    "slices": [
      {
        "id": 1,
        "description": "Log the start of the method execution to indicate the beginning of the delete operation.",
        "code": "\t\tlogger.info( \"Starting delete()\" ); //f:log",
        "start_line": 181,
        "end_line": 181
      },
      {
        "id": 2,
        "description": "Open a Hibernate session and begin a transaction to prepare for database operations.",
        "code": "\t\tSession sess = HibernateUtil.getSessionFactory().openSession(); //f:hibernate\n\t\tTransaction t = sess.beginTransaction(); //f:hibernate",
        "start_line": 182,
        "end_line": 183
      },
      {
        "id": 3,
        "description": "Delete the purchase order object from the database using the Hibernate session.",
        "code": "\t\tsess.delete( this.purchaseOrder ); //f:hibernate",
        "start_line": 185,
        "end_line": 185
      },
      {
        "id": 4,
        "description": "Commit the transaction and close the Hibernate session to finalize the database operations.",
        "code": "\t\tt.commit(); //f:hibernate\n\t\tsess.close(); //f:hibernate",
        "start_line": 187,
        "end_line": 188
      },
      {
        "id": 5,
        "description": "Update the task field to indicate the current mode after deletion.",
        "code": "\t\tthis.task = SystemConstants.CR_MODE;",
        "start_line": 190,
        "end_line": 190
      },
      {
        "id": 6,
        "description": "Add a success message to the action context to notify the user of the successful deletion.",
        "code": "\t\tthis.addActionMessage( this.getText( \"deleteSuccessful\", new String[] { \"order\" } ) );",
        "start_line": 191,
        "end_line": 191
      },
      {
        "id": 7,
        "description": "Log the completion of the method execution to indicate the end of the delete operation.",
        "code": "\t\tlogger.info( \"Finishing delete()\" ); //f:log",
        "start_line": 192,
        "end_line": 192
      },
      {
        "id": 8,
        "description": "Return the result of the input() method to complete the action.",
        "code": "\t\treturn this.input();",
        "start_line": 193,
        "end_line": 193
      }
    ],
    "full_response": "### Step 1: Summarize the focal method\n\nThe `delete()` method in the `classes.PurchaseOrderAction` class is responsible for deleting a `purchaseOrder` object from the database using Hibernate. It performs the following operations:\n1. Logs the start of the method execution.\n2. Opens a Hibernate session and begins a transaction.\n3. Deletes the `purchaseOrder` object from the database.\n4. Commits the transaction and closes the session.\n5. Updates the `task` field to a specific mode (`SystemConstants.CR_MODE`).\n6. Adds a success message to the action context.\n7. Logs the completion of the method execution.\n8. Returns the result of the `input()` method.\n\n### Step 2: Necessary environment settings to run the focal method\n\n#### Invoked parameters and fields:\n1. **Field `this.purchaseOrder`**: Represents the purchase order object to be deleted.\n2. **Field `this.task`**: Updated to `SystemConstants.CR_MODE` after deletion.\n3. **Field `SystemConstants.CR_MODE`**: A constant representing a specific mode.\n4. **Field `logger`**: Used for logging method execution details.\n\n#### Invoked methods:\n1. **`HibernateUtil.getSessionFactory()`**: Retrieves the Hibernate `SessionFactory` instance.\n2. **`sess.delete(this.purchaseOrder)`**: Deletes the purchase order object from the database.\n3. **`t.commit()`**: Commits the transaction.\n4. **`sess.close()`**: Closes the Hibernate session.\n5. **`this.addActionMessage()`**: Adds a success message to the action context.\n6. **`this.getText()`**: Retrieves localized text for the success message.\n7. **`this.input()`**: Returns the result of the `input()` method.\n\n---\n\n### Step 3: Decomposition of the focal method into slices\n\n```json\n[\n  {\n    \"id\": 1,\n    \"description\": \"Log the start of the method execution to indicate the beginning of the delete operation.\",\n    \"code\": \"\\t\\tlogger.info( \\\"Starting delete()\\\" ); //f:log\",\n    \"start_line\": 181,\n    \"end_line\": 181\n  },\n  {\n    \"id\": 2,\n    \"description\": \"Open a Hibernate session and begin a transaction to prepare for database operations.\",\n    \"code\": \"\\t\\tSession sess = HibernateUtil.getSessionFactory().openSession(); //f:hibernate\\n\\t\\tTransaction t = sess.beginTransaction(); //f:hibernate\",\n    \"start_line\": 182,\n    \"end_line\": 183\n  },\n  {\n    \"id\": 3,\n    \"description\": \"Delete the purchase order object from the database using the Hibernate session.\",\n    \"code\": \"\\t\\tsess.delete( this.purchaseOrder ); //f:hibernate\",\n    \"start_line\": 185,\n    \"end_line\": 185\n  },\n  {\n    \"id\": 4,\n    \"description\": \"Commit the transaction and close the Hibernate session to finalize the database operations.\",\n    \"code\": \"\\t\\tt.commit(); //f:hibernate\\n\\t\\tsess.close(); //f:hibernate\",\n    \"start_line\": 187,\n    \"end_line\": 188\n  },\n  {\n    \"id\": 5,\n    \"description\": \"Update the task field to indicate the current mode after deletion.\",\n    \"code\": \"\\t\\tthis.task = SystemConstants.CR_MODE;\",\n    \"start_line\": 190,\n    \"end_line\": 190\n  },\n  {\n    \"id\": 6,\n    \"description\": \"Add a success message to the action context to notify the user of the successful deletion.\",\n    \"code\": \"\\t\\tthis.addActionMessage( this.getText( \\\"deleteSuccessful\\\", new String[] { \\\"order\\\" } ) );\",\n    \"start_line\": 191,\n    \"end_line\": 191\n  },\n  {\n    \"id\": 7,\n    \"description\": \"Log the completion of the method execution to indicate the end of the delete operation.\",\n    \"code\": \"\\t\\tlogger.info( \\\"Finishing delete()\\\" ); //f:log\",\n    \"start_line\": 192,\n    \"end_line\": 192\n  },\n  {\n    \"id\": 8,\n    \"description\": \"Return the result of the input() method to complete the action.\",\n    \"code\": \"\\t\\treturn this.input();\",\n    \"start_line\": 193,\n    \"end_line\": 193\n  }\n]\n```"
  },
  {
    "class_name": "classes.PurchaseOrderAction",
    "function_name": "edit()",
    "analysis": "### Step 1: Summary of the Focal Method\n\nThe `edit()` method in the `classes.PurchaseOrderAction` class is responsible for handling the editing of a `PurchaseOrder` object. It retrieves a `PurchaseOrder` from the database using its ID, sets it as the current `PurchaseOrder` in the action class, and prepares the system for an update operation. The method uses Hibernate for database interaction and logs the start and end of the operation. It also sets a task mode (`UD_MODE`) to indicate the type of operation being performed.\n\n---\n\n### Step 2: Necessary Environment Settings to Run the Focal Method\n\n#### Invoked Parameters and Fields\n1. **`this.parameters`**: A field or map-like structure that contains input parameters, specifically the `id` of the `PurchaseOrder` to be edited.\n2. **`this.setPurchaseOrder()`**: A method to set the retrieved `PurchaseOrder` object into the current action class.\n3. **`this.task`**: A field that is set to `SystemConstants.UD_MODE` to indicate the update mode.\n\n#### Invoked Methods\n1. **`HibernateUtil.getSessionFactory()`**: A static method that provides a Hibernate `SessionFactory` for database operations.\n2. **`sess.get(PurchaseOrder.class, id)`**: A Hibernate method used to retrieve the `PurchaseOrder` object by its ID.\n3. **`sess.beginTransaction()`**: Starts a new database transaction.\n4. **`t.commit()`**: Commits the transaction.\n5. **`sess.close()`**: Closes the Hibernate session.\n\n---\n\n### Step 3: Decomposition of the Focal Method",
    "slices": [
      {
        "id": 1,
        "description": "Log the start of the edit operation.",
        "code": "\t\tlogger.info( \"Starting edit()\" ); //f:log",
        "start_line": 197,
        "end_line": 197
      },
      {
        "id": 2,
        "description": "Retrieve the ID of the PurchaseOrder from the input parameters.",
        "code": "\t\tInteger id = Integer.valueOf( this.parameters.get( \"id\" )[0] );",
        "start_line": 198,
        "end_line": 198
      },
      {
        "id": 3,
        "description": "Open a Hibernate session and begin a transaction.",
        "code": "\t\tSession sess = HibernateUtil.getSessionFactory().openSession(); //f:hibernate\n\t\tTransaction t = sess.beginTransaction(); //f:hibernate",
        "start_line": 200,
        "end_line": 201
      },
      {
        "id": 4,
        "description": "Retrieve the PurchaseOrder object from the database using the provided ID.",
        "code": "\t\tPurchaseOrder po = (PurchaseOrder) sess.get( PurchaseOrder.class, id ); //f:hibernate",
        "start_line": 203,
        "end_line": 203
      },
      {
        "id": 5,
        "description": "Commit the transaction and close the Hibernate session.",
        "code": "\t\tt.commit(); //f:hibernate\n\t\tsess.close(); //f:hibernate",
        "start_line": 205,
        "end_line": 206
      },
      {
        "id": 6,
        "description": "Set the retrieved PurchaseOrder object into the current action class.",
        "code": "\t\tthis.setPurchaseOrder( po );",
        "start_line": 208,
        "end_line": 208
      },
      {
        "id": 7,
        "description": "Set the task mode to update mode.",
        "code": "\t\tthis.task = SystemConstants.UD_MODE;",
        "start_line": 210,
        "end_line": 210
      },
      {
        "id": 8,
        "description": "Log the completion of the edit operation and return the input view.",
        "code": "\t\tlogger.info( \"Finishing edit()\" ); //f:log\n\t\treturn INPUT;",
        "start_line": 211,
        "end_line": 212
      }
    ],
    "full_response": "### Step 1: Summary of the Focal Method\n\nThe `edit()` method in the `classes.PurchaseOrderAction` class is responsible for handling the editing of a `PurchaseOrder` object. It retrieves a `PurchaseOrder` from the database using its ID, sets it as the current `PurchaseOrder` in the action class, and prepares the system for an update operation. The method uses Hibernate for database interaction and logs the start and end of the operation. It also sets a task mode (`UD_MODE`) to indicate the type of operation being performed.\n\n---\n\n### Step 2: Necessary Environment Settings to Run the Focal Method\n\n#### Invoked Parameters and Fields\n1. **`this.parameters`**: A field or map-like structure that contains input parameters, specifically the `id` of the `PurchaseOrder` to be edited.\n2. **`this.setPurchaseOrder()`**: A method to set the retrieved `PurchaseOrder` object into the current action class.\n3. **`this.task`**: A field that is set to `SystemConstants.UD_MODE` to indicate the update mode.\n\n#### Invoked Methods\n1. **`HibernateUtil.getSessionFactory()`**: A static method that provides a Hibernate `SessionFactory` for database operations.\n2. **`sess.get(PurchaseOrder.class, id)`**: A Hibernate method used to retrieve the `PurchaseOrder` object by its ID.\n3. **`sess.beginTransaction()`**: Starts a new database transaction.\n4. **`t.commit()`**: Commits the transaction.\n5. **`sess.close()`**: Closes the Hibernate session.\n\n---\n\n### Step 3: Decomposition of the Focal Method\n\n```json\n[\n  {\n    \"id\": 1,\n    \"description\": \"Log the start of the edit operation.\",\n    \"code\": \"\\t\\tlogger.info( \\\"Starting edit()\\\" ); //f:log\",\n    \"start_line\": 197,\n    \"end_line\": 197\n  },\n  {\n    \"id\": 2,\n    \"description\": \"Retrieve the ID of the PurchaseOrder from the input parameters.\",\n    \"code\": \"\\t\\tInteger id = Integer.valueOf( this.parameters.get( \\\"id\\\" )[0] );\",\n    \"start_line\": 198,\n    \"end_line\": 198\n  },\n  {\n    \"id\": 3,\n    \"description\": \"Open a Hibernate session and begin a transaction.\",\n    \"code\": \"\\t\\tSession sess = HibernateUtil.getSessionFactory().openSession(); //f:hibernate\\n\\t\\tTransaction t = sess.beginTransaction(); //f:hibernate\",\n    \"start_line\": 200,\n    \"end_line\": 201\n  },\n  {\n    \"id\": 4,\n    \"description\": \"Retrieve the PurchaseOrder object from the database using the provided ID.\",\n    \"code\": \"\\t\\tPurchaseOrder po = (PurchaseOrder) sess.get( PurchaseOrder.class, id ); //f:hibernate\",\n    \"start_line\": 203,\n    \"end_line\": 203\n  },\n  {\n    \"id\": 5,\n    \"description\": \"Commit the transaction and close the Hibernate session.\",\n    \"code\": \"\\t\\tt.commit(); //f:hibernate\\n\\t\\tsess.close(); //f:hibernate\",\n    \"start_line\": 205,\n    \"end_line\": 206\n  },\n  {\n    \"id\": 6,\n    \"description\": \"Set the retrieved PurchaseOrder object into the current action class.\",\n    \"code\": \"\\t\\tthis.setPurchaseOrder( po );\",\n    \"start_line\": 208,\n    \"end_line\": 208\n  },\n  {\n    \"id\": 7,\n    \"description\": \"Set the task mode to update mode.\",\n    \"code\": \"\\t\\tthis.task = SystemConstants.UD_MODE;\",\n    \"start_line\": 210,\n    \"end_line\": 210\n  },\n  {\n    \"id\": 8,\n    \"description\": \"Log the completion of the edit operation and return the input view.\",\n    \"code\": \"\\t\\tlogger.info( \\\"Finishing edit()\\\" ); //f:log\\n\\t\\treturn INPUT;\",\n    \"start_line\": 211,\n    \"end_line\": 212\n  }\n]\n```"
  },
  {
    "class_name": "classes.PurchaseOrderAjax",
    "function_name": "getProductPrice(Integer)",
    "analysis": "### Step 1: Summarise the focal method\n\nThe `getProductPrice(Integer idProduct)` method in the `classes.PurchaseOrderAjax` class retrieves the price of a product based on its ID (`idProduct`). It uses Hibernate ORM to interact with the database. The method performs the following tasks:\n1. Logs the start of the operation.\n2. Opens a Hibernate session and begins a transaction.\n3. Creates a criteria query to fetch the price of the product with the given ID.\n4. Executes the query and retrieves the price.\n5. Commits the transaction and closes the session.\n6. Logs the completion of the operation and returns the price.\n\n---\n\n### Step 2: List necessary environment settings to run the focal method\n\n#### Invoked Parameters and Fields:\n- **Parameter:** `Integer idProduct` - The ID of the product whose price is to be fetched.\n- **Field:** `HibernateUtil.getSessionFactory()` - Provides access to the Hibernate `SessionFactory`.\n\n#### Invoked Methods:\n- `HibernateUtil.getSessionFactory()` - Returns the static `SessionFactory` for database interaction.\n- `Session.openSession()` - Opens a Hibernate session.\n- `Session.beginTransaction()` - Begins a transaction within the session.\n- `Session.createCriteria(Class)` - Creates a criteria query for the specified class (`Product`).\n- `Criteria.setProjection(Projections.property(String))` - Specifies the property to retrieve (`price`).\n- `Criteria.add(Restrictions.eq(String, Object))` - Adds a restriction to filter by product ID.\n- `Criteria.uniqueResult()` - Executes the query and retrieves the unique result.\n- `Transaction.commit()` - Commits the transaction.\n- `Session.close()` - Closes the session.\n\n---\n\n### Step 3: Decompose the focal method into multiple problem-solving steps",
    "slices": [
      {
        "id": 1,
        "description": "Log the start of the method execution to indicate the beginning of the operation.",
        "code": "\t\tlogger.info( \"Starting getProductPrice()\" ); //f:log",
        "start_line": 14,
        "end_line": 14
      },
      {
        "id": 2,
        "description": "Open a Hibernate session and begin a transaction to prepare for database interaction.",
        "code": "\t\tSession sess = HibernateUtil.getSessionFactory().openSession(); //f:hibernate\n\t\tTransaction t = sess.beginTransaction(); //f:hibernate",
        "start_line": 15,
        "end_line": 16
      },
      {
        "id": 3,
        "description": "Create a criteria query for the Product class to specify the data retrieval logic.",
        "code": "\t\tCriteria criteria = sess.createCriteria( Product.class ); //f:hibernate",
        "start_line": 18,
        "end_line": 18
      },
      {
        "id": 4,
        "description": "Set the projection to retrieve the 'price' property of the Product entity.",
        "code": "\t\tcriteria.setProjection( Projections.property( \"price\" ) ); //f:hibernate",
        "start_line": 21,
        "end_line": 21
      },
      {
        "id": 5,
        "description": "Add a restriction to filter the query by the product ID provided as a parameter.",
        "code": "\t\tcriteria.add( Restrictions.eq( \"id\", idProduct ) ); //f:hibernate",
        "start_line": 23,
        "end_line": 23
      },
      {
        "id": 6,
        "description": "Execute the criteria query and retrieve the unique result, which is the price of the product.",
        "code": "\t\tDouble price = (Double) criteria.uniqueResult(); //f:hibernate",
        "start_line": 25,
        "end_line": 25
      },
      {
        "id": 7,
        "description": "Commit the transaction and close the Hibernate session to finalize the database interaction.",
        "code": "\t\tt.commit(); //f:hibernate\n\t\tsess.close(); //f:hibernate",
        "start_line": 27,
        "end_line": 28
      },
      {
        "id": 8,
        "description": "Log the completion of the method execution to indicate the operation has finished.",
        "code": "\t\tlogger.info( \"Finishing getProductPrice()\" ); //f:log",
        "start_line": 29,
        "end_line": 29
      },
      {
        "id": 9,
        "description": "Return the retrieved price to the caller.",
        "code": "\t\treturn price;",
        "start_line": 30,
        "end_line": 30
      }
    ],
    "full_response": "### Step 1: Summarise the focal method\n\nThe `getProductPrice(Integer idProduct)` method in the `classes.PurchaseOrderAjax` class retrieves the price of a product based on its ID (`idProduct`). It uses Hibernate ORM to interact with the database. The method performs the following tasks:\n1. Logs the start of the operation.\n2. Opens a Hibernate session and begins a transaction.\n3. Creates a criteria query to fetch the price of the product with the given ID.\n4. Executes the query and retrieves the price.\n5. Commits the transaction and closes the session.\n6. Logs the completion of the operation and returns the price.\n\n---\n\n### Step 2: List necessary environment settings to run the focal method\n\n#### Invoked Parameters and Fields:\n- **Parameter:** `Integer idProduct` - The ID of the product whose price is to be fetched.\n- **Field:** `HibernateUtil.getSessionFactory()` - Provides access to the Hibernate `SessionFactory`.\n\n#### Invoked Methods:\n- `HibernateUtil.getSessionFactory()` - Returns the static `SessionFactory` for database interaction.\n- `Session.openSession()` - Opens a Hibernate session.\n- `Session.beginTransaction()` - Begins a transaction within the session.\n- `Session.createCriteria(Class)` - Creates a criteria query for the specified class (`Product`).\n- `Criteria.setProjection(Projections.property(String))` - Specifies the property to retrieve (`price`).\n- `Criteria.add(Restrictions.eq(String, Object))` - Adds a restriction to filter by product ID.\n- `Criteria.uniqueResult()` - Executes the query and retrieves the unique result.\n- `Transaction.commit()` - Commits the transaction.\n- `Session.close()` - Closes the session.\n\n---\n\n### Step 3: Decompose the focal method into multiple problem-solving steps\n\n```json\n[\n  {\n    \"id\": 1,\n    \"description\": \"Log the start of the method execution to indicate the beginning of the operation.\",\n    \"code\": \"\\t\\tlogger.info( \\\"Starting getProductPrice()\\\" ); //f:log\",\n    \"start_line\": 14,\n    \"end_line\": 14\n  },\n  {\n    \"id\": 2,\n    \"description\": \"Open a Hibernate session and begin a transaction to prepare for database interaction.\",\n    \"code\": \"\\t\\tSession sess = HibernateUtil.getSessionFactory().openSession(); //f:hibernate\\n\\t\\tTransaction t = sess.beginTransaction(); //f:hibernate\",\n    \"start_line\": 15,\n    \"end_line\": 16\n  },\n  {\n    \"id\": 3,\n    \"description\": \"Create a criteria query for the Product class to specify the data retrieval logic.\",\n    \"code\": \"\\t\\tCriteria criteria = sess.createCriteria( Product.class ); //f:hibernate\",\n    \"start_line\": 18,\n    \"end_line\": 18\n  },\n  {\n    \"id\": 4,\n    \"description\": \"Set the projection to retrieve the 'price' property of the Product entity.\",\n    \"code\": \"\\t\\tcriteria.setProjection( Projections.property( \\\"price\\\" ) ); //f:hibernate\",\n    \"start_line\": 21,\n    \"end_line\": 21\n  },\n  {\n    \"id\": 5,\n    \"description\": \"Add a restriction to filter the query by the product ID provided as a parameter.\",\n    \"code\": \"\\t\\tcriteria.add( Restrictions.eq( \\\"id\\\", idProduct ) ); //f:hibernate\",\n    \"start_line\": 23,\n    \"end_line\": 23\n  },\n  {\n    \"id\": 6,\n    \"description\": \"Execute the criteria query and retrieve the unique result, which is the price of the product.\",\n    \"code\": \"\\t\\tDouble price = (Double) criteria.uniqueResult(); //f:hibernate\",\n    \"start_line\": 25,\n    \"end_line\": 25\n  },\n  {\n    \"id\": 7,\n    \"description\": \"Commit the transaction and close the Hibernate session to finalize the database interaction.\",\n    \"code\": \"\\t\\tt.commit(); //f:hibernate\\n\\t\\tsess.close(); //f:hibernate\",\n    \"start_line\": 27,\n    \"end_line\": 28\n  },\n  {\n    \"id\": 8,\n    \"description\": \"Log the completion of the method execution to indicate the operation has finished.\",\n    \"code\": \"\\t\\tlogger.info( \\\"Finishing getProductPrice()\\\" ); //f:log\",\n    \"start_line\": 29,\n    \"end_line\": 29\n  },\n  {\n    \"id\": 9,\n    \"description\": \"Return the retrieved price to the caller.\",\n    \"code\": \"\\t\\treturn price;\",\n    \"start_line\": 30,\n    \"end_line\": 30\n  }\n]\n```"
  },
  {
    "class_name": "classes.ReportAction",
    "function_name": "productReport()",
    "analysis": "### Step 1: Summary of the Focal Method\n\nThe `productReport()` method in the `classes.ReportAction` class is responsible for generating a product report in PDF format using JasperReports. It performs the following tasks:\n1. Logs the start of the method execution.\n2. Retrieves the `ActionContext` and `ServletContext` to access the JasperReports XML template.\n3. Compiles the JasperReports template.\n4. Prepares report parameters.\n5. Interacts with a Hibernate session to fetch product data from the database.\n6. Uses the fetched data to create a data source for the report.\n7. Fills the JasperReports template with the data source and parameters.\n8. Exports the report to a PDF byte array.\n9. Sets the PDF byte array as an input stream for download.\n10. Logs the completion of the method and returns a string indicating the download action.\n\n### Step 2: Necessary Environment Settings to Run the Focal Method\n\n#### Invoked Parameters and Fields\n- `logger`: Used for logging the start and end of the method.\n- `inputStream`: A field in the class where the generated PDF byte array is stored for download.\n\n#### Invoked Methods\n- `ActionContext.getContext()`: Retrieves the current `ActionContext`.\n- `ServletContext.get()`: Accesses the `ServletContext` from the `ActionContext`.\n- `JasperCompileManager.compileReport(InputStream)`: Compiles the JasperReports XML template.\n- `HibernateUtil.getSessionFactory()`: Retrieves the Hibernate `SessionFactory`.\n- `Session.openSession()`: Opens a Hibernate session.\n- `Session.createCriteria(Class)`: Creates a criteria query for the `Product` class.\n- `Criteria.setProjection(Projection)`: Specifies the columns to fetch in the query.\n- `Criteria.list()`: Executes the criteria query and retrieves the result list.\n- `Transaction.commit()`: Commits the Hibernate transaction.\n- `Session.close()`: Closes the Hibernate session.\n- `HibernateQueryResultDataSource`: A custom data source for JasperReports, initialized with the query result.\n- `JasperFillManager.fillReport(JasperReport, Map, JRDataSource)`: Fills the compiled report with data.\n- `JasperExportManager.exportReportToPdf(JasperPrint)`: Exports the filled report to a PDF byte array.\n\n---\n\n### Step 3: Decomposition of the Focal Method",
    "slices": [
      {
        "id": 1,
        "description": "Log the start of the method execution.",
        "code": "\t\tlogger.info( \"Starting productReport()\" ); //f:log",
        "start_line": 66,
        "end_line": 66
      },
      {
        "id": 2,
        "description": "Retrieve the ActionContext and ServletContext to access the JasperReports XML template.",
        "code": "\t\tActionContext ac = ActionContext.getContext();\n\t\tServletContext sc = (ServletContext) ac.get( StrutsStatics.SERVLET_CONTEXT );",
        "start_line": 68,
        "end_line": 69
      },
      {
        "id": 3,
        "description": "Compile the JasperReports template from the XML file.",
        "code": "\t\tJasperReport jasperReport = JasperCompileManager.compileReport( sc.getResourceAsStream( \"/WEB-INF/classes/ProductReport.xml\" ) ); //f:jr",
        "start_line": 71,
        "end_line": 71
      },
      {
        "id": 4,
        "description": "Prepare the parameters for the JasperReports template.",
        "code": "\t\tMap<String, Object> parameters = new HashMap<String, Object>(); //f:jr\n\t\tparameters.put( \"ReportTitle\", \"List of Products\" ); //f:jr\n\t\tparameters.put( \"DataFile\", new Date().toString() ); //f:jr",
        "start_line": 73,
        "end_line": 75
      },
      {
        "id": 5,
        "description": "Open a Hibernate session and begin a transaction.",
        "code": "\t\tSession sess = HibernateUtil.getSessionFactory().openSession(); //f:hibernate\n\t\tTransaction t = sess.beginTransaction(); //f:hibernate",
        "start_line": 77,
        "end_line": 78
      },
      {
        "id": 6,
        "description": "Create a criteria query to fetch product data with specific projections.",
        "code": "\t\tCriteria criteria = sess.createCriteria( Product.class ); //f:hibernate\n\t\tcriteria.setProjection( Projections.projectionList().add( Projections.property( \"id\" ) ).add( Projections.property( \"name\" ) ).add( Projections.property( \"price\" ) ) ); //f:hibernate",
        "start_line": 80,
        "end_line": 82
      },
      {
        "id": 7,
        "description": "Execute the criteria query and retrieve the result list.",
        "code": "\t\t@SuppressWarnings(\"unchecked\")\n\t\tList<Object[]> l = (List<Object[]>) criteria.list(); //f:hibernate",
        "start_line": 85,
        "end_line": 86
      },
      {
        "id": 8,
        "description": "Commit the transaction and close the Hibernate session.",
        "code": "\t\tt.commit(); //f:hibernate\n\t\tsess.close(); //f:hibernate",
        "start_line": 88,
        "end_line": 89
      },
      {
        "id": 9,
        "description": "Create a data source for JasperReports using the query result.",
        "code": "\t\tHibernateQueryResultDataSource ds = new HibernateQueryResultDataSource(l, new String[] { \"Id\", \"Name\", \"Price\" }); //f:jr",
        "start_line": 91,
        "end_line": 91
      },
      {
        "id": 10,
        "description": "Fill the compiled JasperReports template with the data source and parameters.",
        "code": "\t\tJasperPrint jasperPrint = JasperFillManager.fillReport( jasperReport, parameters, ds ); //f:jr",
        "start_line": 93,
        "end_line": 93
      },
      {
        "id": 11,
        "description": "Export the filled report to a PDF byte array.",
        "code": "\t\tbyte b[] = JasperExportManager.exportReportToPdf( jasperPrint ); //f:jr",
        "start_line": 95,
        "end_line": 95
      },
      {
        "id": 12,
        "description": "Set the PDF byte array as an input stream for download.",
        "code": "\t\tthis.inputStream = new ByteArrayInputStream( b );",
        "start_line": 97,
        "end_line": 97
      },
      {
        "id": 13,
        "description": "Log the completion of the method and return the download action.",
        "code": "\t\tlogger.info( \"Finishing productReport()\" ); //f:log\n\t\treturn \"download\";",
        "start_line": 99,
        "end_line": 100
      }
    ],
    "full_response": "### Step 1: Summary of the Focal Method\n\nThe `productReport()` method in the `classes.ReportAction` class is responsible for generating a product report in PDF format using JasperReports. It performs the following tasks:\n1. Logs the start of the method execution.\n2. Retrieves the `ActionContext` and `ServletContext` to access the JasperReports XML template.\n3. Compiles the JasperReports template.\n4. Prepares report parameters.\n5. Interacts with a Hibernate session to fetch product data from the database.\n6. Uses the fetched data to create a data source for the report.\n7. Fills the JasperReports template with the data source and parameters.\n8. Exports the report to a PDF byte array.\n9. Sets the PDF byte array as an input stream for download.\n10. Logs the completion of the method and returns a string indicating the download action.\n\n### Step 2: Necessary Environment Settings to Run the Focal Method\n\n#### Invoked Parameters and Fields\n- `logger`: Used for logging the start and end of the method.\n- `inputStream`: A field in the class where the generated PDF byte array is stored for download.\n\n#### Invoked Methods\n- `ActionContext.getContext()`: Retrieves the current `ActionContext`.\n- `ServletContext.get()`: Accesses the `ServletContext` from the `ActionContext`.\n- `JasperCompileManager.compileReport(InputStream)`: Compiles the JasperReports XML template.\n- `HibernateUtil.getSessionFactory()`: Retrieves the Hibernate `SessionFactory`.\n- `Session.openSession()`: Opens a Hibernate session.\n- `Session.createCriteria(Class)`: Creates a criteria query for the `Product` class.\n- `Criteria.setProjection(Projection)`: Specifies the columns to fetch in the query.\n- `Criteria.list()`: Executes the criteria query and retrieves the result list.\n- `Transaction.commit()`: Commits the Hibernate transaction.\n- `Session.close()`: Closes the Hibernate session.\n- `HibernateQueryResultDataSource`: A custom data source for JasperReports, initialized with the query result.\n- `JasperFillManager.fillReport(JasperReport, Map, JRDataSource)`: Fills the compiled report with data.\n- `JasperExportManager.exportReportToPdf(JasperPrint)`: Exports the filled report to a PDF byte array.\n\n---\n\n### Step 3: Decomposition of the Focal Method\n\n```json\n[\n  {\n    \"id\": 1,\n    \"description\": \"Log the start of the method execution.\",\n    \"code\": \"\\t\\tlogger.info( \\\"Starting productReport()\\\" ); //f:log\",\n    \"start_line\": 66,\n    \"end_line\": 66\n  },\n  {\n    \"id\": 2,\n    \"description\": \"Retrieve the ActionContext and ServletContext to access the JasperReports XML template.\",\n    \"code\": \"\\t\\tActionContext ac = ActionContext.getContext();\\n\\t\\tServletContext sc = (ServletContext) ac.get( StrutsStatics.SERVLET_CONTEXT );\",\n    \"start_line\": 68,\n    \"end_line\": 69\n  },\n  {\n    \"id\": 3,\n    \"description\": \"Compile the JasperReports template from the XML file.\",\n    \"code\": \"\\t\\tJasperReport jasperReport = JasperCompileManager.compileReport( sc.getResourceAsStream( \\\"/WEB-INF/classes/ProductReport.xml\\\" ) ); //f:jr\",\n    \"start_line\": 71,\n    \"end_line\": 71\n  },\n  {\n    \"id\": 4,\n    \"description\": \"Prepare the parameters for the JasperReports template.\",\n    \"code\": \"\\t\\tMap<String, Object> parameters = new HashMap<String, Object>(); //f:jr\\n\\t\\tparameters.put( \\\"ReportTitle\\\", \\\"List of Products\\\" ); //f:jr\\n\\t\\tparameters.put( \\\"DataFile\\\", new Date().toString() ); //f:jr\",\n    \"start_line\": 73,\n    \"end_line\": 75\n  },\n  {\n    \"id\": 5,\n    \"description\": \"Open a Hibernate session and begin a transaction.\",\n    \"code\": \"\\t\\tSession sess = HibernateUtil.getSessionFactory().openSession(); //f:hibernate\\n\\t\\tTransaction t = sess.beginTransaction(); //f:hibernate\",\n    \"start_line\": 77,\n    \"end_line\": 78\n  },\n  {\n    \"id\": 6,\n    \"description\": \"Create a criteria query to fetch product data with specific projections.\",\n    \"code\": \"\\t\\tCriteria criteria = sess.createCriteria( Product.class ); //f:hibernate\\n\\t\\tcriteria.setProjection( Projections.projectionList().add( Projections.property( \\\"id\\\" ) ).add( Projections.property( \\\"name\\\" ) ).add( Projections.property( \\\"price\\\" ) ) ); //f:hibernate\",\n    \"start_line\": 80,\n    \"end_line\": 82\n  },\n  {\n    \"id\": 7,\n    \"description\": \"Execute the criteria query and retrieve the result list.\",\n    \"code\": \"\\t\\t@SuppressWarnings(\\\"unchecked\\\")\\n\\t\\tList<Object[]> l = (List<Object[]>) criteria.list(); //f:hibernate\",\n    \"start_line\": 85,\n    \"end_line\": 86\n  },\n  {\n    \"id\": 8,\n    \"description\": \"Commit the transaction and close the Hibernate session.\",\n    \"code\": \"\\t\\tt.commit(); //f:hibernate\\n\\t\\tsess.close(); //f:hibernate\",\n    \"start_line\": 88,\n    \"end_line\": 89\n  },\n  {\n    \"id\": 9,\n    \"description\": \"Create a data source for JasperReports using the query result.\",\n    \"code\": \"\\t\\tHibernateQueryResultDataSource ds = new HibernateQueryResultDataSource(l, new String[] { \\\"Id\\\", \\\"Name\\\", \\\"Price\\\" }); //f:jr\",\n    \"start_line\": 91,\n    \"end_line\": 91\n  },\n  {\n    \"id\": 10,\n    \"description\": \"Fill the compiled JasperReports template with the data source and parameters.\",\n    \"code\": \"\\t\\tJasperPrint jasperPrint = JasperFillManager.fillReport( jasperReport, parameters, ds ); //f:jr\",\n    \"start_line\": 93,\n    \"end_line\": 93\n  },\n  {\n    \"id\": 11,\n    \"description\": \"Export the filled report to a PDF byte array.\",\n    \"code\": \"\\t\\tbyte b[] = JasperExportManager.exportReportToPdf( jasperPrint ); //f:jr\",\n    \"start_line\": 95,\n    \"end_line\": 95\n  },\n  {\n    \"id\": 12,\n    \"description\": \"Set the PDF byte array as an input stream for download.\",\n    \"code\": \"\\t\\tthis.inputStream = new ByteArrayInputStream( b );\",\n    \"start_line\": 97,\n    \"end_line\": 97\n  },\n  {\n    \"id\": 13,\n    \"description\": \"Log the completion of the method and return the download action.\",\n    \"code\": \"\\t\\tlogger.info( \\\"Finishing productReport()\\\" ); //f:log\\n\\t\\treturn \\\"download\\\";\",\n    \"start_line\": 99,\n    \"end_line\": 100\n  }\n]\n```"
  },
  {
    "class_name": "classes.ReportAction",
    "function_name": "customerReport()",
    "analysis": "### Step 1: Summarize the Focal Method\n\nThe `customerReport()` method in the `classes.ReportAction` class generates a customer report in PDF format using JasperReports and Hibernate. It performs the following tasks:\n1. Logs the start of the method execution.\n2. Retrieves the `ServletContext` and compiles a JasperReports template.\n3. Sets up report parameters.\n4. Queries a database using Hibernate to fetch customer data.\n5. Converts the query results into a data source compatible with JasperReports.\n6. Fills the JasperReport with the data source and parameters.\n7. Exports the filled report to a PDF byte array.\n8. Converts the byte array into an input stream for download.\n9. Logs the completion of the method and returns a string indicating the download action.\n\n### Step 2: Necessary Environment Settings to Run the Focal Method\n\n#### Invoked Parameters and Fields\n1. `logger`: Used for logging the start and end of the method.\n2. `ActionContext.getContext()`: Retrieves the current action context.\n3. `StrutsStatics.SERVLET_CONTEXT`: Used to get the `ServletContext`.\n4. `HibernateUtil.getSessionFactory()`: Provides the Hibernate `SessionFactory`.\n5. `this.inputStream`: A field in the class to store the generated input stream for the PDF.\n\n#### Invoked Methods\n1. `JasperCompileManager.compileReport(InputStream)`: Compiles the JasperReports template.\n2. `JasperFillManager.fillReport(JasperReport, Map<String, Object>, JRDataSource)`: Fills the report with data.\n3. `JasperExportManager.exportReportToPdf(JasperPrint)`: Exports the report to a PDF byte array.\n4. `HibernateUtil.getSessionFactory().openSession()`: Opens a Hibernate session.\n5. `sess.createCriteria(Customer.class)`: Creates a Hibernate `Criteria` for querying the `Customer` table.\n6. `criteria.setProjection(...)`: Specifies the fields to retrieve in the query.\n7. `criteria.list()`: Executes the query and retrieves the results.\n\n---\n\n### Step 3: Decomposition of the Focal Method",
    "slices": [
      {
        "id": 1,
        "description": "Log the start of the method execution.",
        "code": "\t\tlogger.info( \"Starting customerReport()\" ); //f:log",
        "start_line": 105,
        "end_line": 105
      },
      {
        "id": 2,
        "description": "Retrieve the ActionContext and ServletContext for accessing resources.",
        "code": "\t\tActionContext ac = ActionContext.getContext();\n\t\tServletContext sc = (ServletContext) ac.get( StrutsStatics.SERVLET_CONTEXT );",
        "start_line": 107,
        "end_line": 108
      },
      {
        "id": 3,
        "description": "Compile the JasperReports template for generating the report.",
        "code": "\t\tJasperReport jasperReport = JasperCompileManager.compileReport( sc.getResourceAsStream( \"/WEB-INF/classes/CustomerReport.xml\" ) ); //f:jr",
        "start_line": 110,
        "end_line": 110
      },
      {
        "id": 4,
        "description": "Set up the parameters for the JasperReports template, including the report title and current date.",
        "code": "\t\tMap<String, Object> parameters = new HashMap<String, Object>(); //f:jr\n\t\tparameters.put( \"ReportTitle\", \"List of Customers\" ); //f:jr\n\t\tparameters.put( \"DataFile\", new Date().toString() ); //f:jr",
        "start_line": 112,
        "end_line": 114
      },
      {
        "id": 5,
        "description": "Initialize a Hibernate session and transaction for querying the database.",
        "code": "\t\tSession sess = HibernateUtil.getSessionFactory().openSession(); //f:hibernate\n\t\tTransaction t = sess.beginTransaction(); //f:hibernate",
        "start_line": 116,
        "end_line": 117
      },
      {
        "id": 6,
        "description": "Create a Hibernate Criteria to query the Customer table and specify the fields to retrieve.",
        "code": "\t\tCriteria criteria = sess.createCriteria( Customer.class ); //f:hibernate\n\n\t\tcriteria.setProjection( Projections.projectionList().add( Projections.property( \"id\" ) ).add( Projections.property( \"name\" ) ).add( Projections.property( \"phone\" ) ) ); //f:hibernate",
        "start_line": 119,
        "end_line": 121
      },
      {
        "id": 7,
        "description": "Execute the query to retrieve customer data and close the Hibernate transaction and session.",
        "code": "\t\t@SuppressWarnings(\"unchecked\")\n\t\tList<Object[]> l = (List<Object[]>) criteria.list(); //f:hibernate\n\n\t\tt.commit(); //f:hibernate\n\t\tsess.close(); //f:hibernate",
        "start_line": 124,
        "end_line": 128
      },
      {
        "id": 8,
        "description": "Convert the query results into a data source compatible with JasperReports.",
        "code": "\t\tHibernateQueryResultDataSource ds = new HibernateQueryResultDataSource(l, new String[] { \"Id\", \"Name\", \"Phone\" }); //f:jr",
        "start_line": 130,
        "end_line": 130
      },
      {
        "id": 9,
        "description": "Fill the JasperReport with the data source and parameters.",
        "code": "\t\tJasperPrint jasperPrint = JasperFillManager.fillReport( jasperReport, parameters, ds ); //f:jr",
        "start_line": 132,
        "end_line": 132
      },
      {
        "id": 10,
        "description": "Export the filled report to a PDF byte array.",
        "code": "\t\tbyte b[] = JasperExportManager.exportReportToPdf( jasperPrint ); //f:jr",
        "start_line": 134,
        "end_line": 134
      },
      {
        "id": 11,
        "description": "Convert the PDF byte array into an input stream for download.",
        "code": "\t\tthis.inputStream = new ByteArrayInputStream( b );",
        "start_line": 136,
        "end_line": 136
      },
      {
        "id": 12,
        "description": "Log the completion of the method and return the download action.",
        "code": "\t\tlogger.info( \"Finishing customerReport()\" ); //f:log\n\t\treturn \"download\";",
        "start_line": 138,
        "end_line": 139
      }
    ],
    "full_response": "### Step 1: Summarize the Focal Method\n\nThe `customerReport()` method in the `classes.ReportAction` class generates a customer report in PDF format using JasperReports and Hibernate. It performs the following tasks:\n1. Logs the start of the method execution.\n2. Retrieves the `ServletContext` and compiles a JasperReports template.\n3. Sets up report parameters.\n4. Queries a database using Hibernate to fetch customer data.\n5. Converts the query results into a data source compatible with JasperReports.\n6. Fills the JasperReport with the data source and parameters.\n7. Exports the filled report to a PDF byte array.\n8. Converts the byte array into an input stream for download.\n9. Logs the completion of the method and returns a string indicating the download action.\n\n### Step 2: Necessary Environment Settings to Run the Focal Method\n\n#### Invoked Parameters and Fields\n1. `logger`: Used for logging the start and end of the method.\n2. `ActionContext.getContext()`: Retrieves the current action context.\n3. `StrutsStatics.SERVLET_CONTEXT`: Used to get the `ServletContext`.\n4. `HibernateUtil.getSessionFactory()`: Provides the Hibernate `SessionFactory`.\n5. `this.inputStream`: A field in the class to store the generated input stream for the PDF.\n\n#### Invoked Methods\n1. `JasperCompileManager.compileReport(InputStream)`: Compiles the JasperReports template.\n2. `JasperFillManager.fillReport(JasperReport, Map<String, Object>, JRDataSource)`: Fills the report with data.\n3. `JasperExportManager.exportReportToPdf(JasperPrint)`: Exports the report to a PDF byte array.\n4. `HibernateUtil.getSessionFactory().openSession()`: Opens a Hibernate session.\n5. `sess.createCriteria(Customer.class)`: Creates a Hibernate `Criteria` for querying the `Customer` table.\n6. `criteria.setProjection(...)`: Specifies the fields to retrieve in the query.\n7. `criteria.list()`: Executes the query and retrieves the results.\n\n---\n\n### Step 3: Decomposition of the Focal Method\n\n```json\n[\n  {\n    \"id\": 1,\n    \"description\": \"Log the start of the method execution.\",\n    \"code\": \"\\t\\tlogger.info( \\\"Starting customerReport()\\\" ); //f:log\",\n    \"start_line\": 105,\n    \"end_line\": 105\n  },\n  {\n    \"id\": 2,\n    \"description\": \"Retrieve the ActionContext and ServletContext for accessing resources.\",\n    \"code\": \"\\t\\tActionContext ac = ActionContext.getContext();\\n\\t\\tServletContext sc = (ServletContext) ac.get( StrutsStatics.SERVLET_CONTEXT );\",\n    \"start_line\": 107,\n    \"end_line\": 108\n  },\n  {\n    \"id\": 3,\n    \"description\": \"Compile the JasperReports template for generating the report.\",\n    \"code\": \"\\t\\tJasperReport jasperReport = JasperCompileManager.compileReport( sc.getResourceAsStream( \\\"/WEB-INF/classes/CustomerReport.xml\\\" ) ); //f:jr\",\n    \"start_line\": 110,\n    \"end_line\": 110\n  },\n  {\n    \"id\": 4,\n    \"description\": \"Set up the parameters for the JasperReports template, including the report title and current date.\",\n    \"code\": \"\\t\\tMap<String, Object> parameters = new HashMap<String, Object>(); //f:jr\\n\\t\\tparameters.put( \\\"ReportTitle\\\", \\\"List of Customers\\\" ); //f:jr\\n\\t\\tparameters.put( \\\"DataFile\\\", new Date().toString() ); //f:jr\",\n    \"start_line\": 112,\n    \"end_line\": 114\n  },\n  {\n    \"id\": 5,\n    \"description\": \"Initialize a Hibernate session and transaction for querying the database.\",\n    \"code\": \"\\t\\tSession sess = HibernateUtil.getSessionFactory().openSession(); //f:hibernate\\n\\t\\tTransaction t = sess.beginTransaction(); //f:hibernate\",\n    \"start_line\": 116,\n    \"end_line\": 117\n  },\n  {\n    \"id\": 6,\n    \"description\": \"Create a Hibernate Criteria to query the Customer table and specify the fields to retrieve.\",\n    \"code\": \"\\t\\tCriteria criteria = sess.createCriteria( Customer.class ); //f:hibernate\\n\\n\\t\\tcriteria.setProjection( Projections.projectionList().add( Projections.property( \\\"id\\\" ) ).add( Projections.property( \\\"name\\\" ) ).add( Projections.property( \\\"phone\\\" ) ) ); //f:hibernate\",\n    \"start_line\": 119,\n    \"end_line\": 121\n  },\n  {\n    \"id\": 7,\n    \"description\": \"Execute the query to retrieve customer data and close the Hibernate transaction and session.\",\n    \"code\": \"\\t\\t@SuppressWarnings(\\\"unchecked\\\")\\n\\t\\tList<Object[]> l = (List<Object[]>) criteria.list(); //f:hibernate\\n\\n\\t\\tt.commit(); //f:hibernate\\n\\t\\tsess.close(); //f:hibernate\",\n    \"start_line\": 124,\n    \"end_line\": 128\n  },\n  {\n    \"id\": 8,\n    \"description\": \"Convert the query results into a data source compatible with JasperReports.\",\n    \"code\": \"\\t\\tHibernateQueryResultDataSource ds = new HibernateQueryResultDataSource(l, new String[] { \\\"Id\\\", \\\"Name\\\", \\\"Phone\\\" }); //f:jr\",\n    \"start_line\": 130,\n    \"end_line\": 130\n  },\n  {\n    \"id\": 9,\n    \"description\": \"Fill the JasperReport with the data source and parameters.\",\n    \"code\": \"\\t\\tJasperPrint jasperPrint = JasperFillManager.fillReport( jasperReport, parameters, ds ); //f:jr\",\n    \"start_line\": 132,\n    \"end_line\": 132\n  },\n  {\n    \"id\": 10,\n    \"description\": \"Export the filled report to a PDF byte array.\",\n    \"code\": \"\\t\\tbyte b[] = JasperExportManager.exportReportToPdf( jasperPrint ); //f:jr\",\n    \"start_line\": 134,\n    \"end_line\": 134\n  },\n  {\n    \"id\": 11,\n    \"description\": \"Convert the PDF byte array into an input stream for download.\",\n    \"code\": \"\\t\\tthis.inputStream = new ByteArrayInputStream( b );\",\n    \"start_line\": 136,\n    \"end_line\": 136\n  },\n  {\n    \"id\": 12,\n    \"description\": \"Log the completion of the method and return the download action.\",\n    \"code\": \"\\t\\tlogger.info( \\\"Finishing customerReport()\\\" ); //f:log\\n\\t\\treturn \\\"download\\\";\",\n    \"start_line\": 138,\n    \"end_line\": 139\n  }\n]\n```"
  },
  {
    "class_name": "classes.SchedulerAction",
    "function_name": "input()",
    "analysis": "### Step 1: Summarize the focal method\n\nThe focal method `input()` in the `classes.SchedulerAction` class appears to be an overridden method that potentially serves as an entry point for some functionality. It is declared to throw an `Exception`, which suggests that it might involve operations that could fail or require error handling. However, based on the provided code snippet, the method's implementation is incomplete or missing, as only the method signature is visible (`public String input() throws Exception {`) without any functional code following it.\n\n### Step 2: List necessary environment settings to run the focal method\n\n#### Invoked Parameters and Fields:\n- No parameters or fields are explicitly invoked or referenced in the provided code snippet.\n\n#### Invoked Methods:\n- The method `input()` itself is invoked recursively (`return this.input();`) in the code snippet provided at line 50. This recursive call might indicate a placeholder or incomplete implementation.\n\n#### Dependent Method Bodies:\n- No dependent method bodies are provided in the context. The focal method does not seem to call any other methods apart from itself.\n\n---\n\n### Step 3: Decomposition of the focal method",
    "slices": [
      {
        "id": 1,
        "description": "Define the method signature for the overridden `input()` method, which declares that it returns a `String` and can throw an `Exception`.",
        "code": "\t@Override\n\tpublic String input() throws Exception {",
        "start_line": 53,
        "end_line": 54
      },
      {
        "id": 2,
        "description": "Implement the recursive call to the `input()` method, which might serve as a placeholder or incomplete logic.",
        "code": "\t\treturn this.input();",
        "start_line": 50,
        "end_line": 50
      },
      {
        "id": 3,
        "description": "Close the method implementation block with the closing brace.",
        "code": "\t}",
        "start_line": 51,
        "end_line": 51
      }
    ],
    "full_response": "### Step 1: Summarize the focal method\n\nThe focal method `input()` in the `classes.SchedulerAction` class appears to be an overridden method that potentially serves as an entry point for some functionality. It is declared to throw an `Exception`, which suggests that it might involve operations that could fail or require error handling. However, based on the provided code snippet, the method's implementation is incomplete or missing, as only the method signature is visible (`public String input() throws Exception {`) without any functional code following it.\n\n### Step 2: List necessary environment settings to run the focal method\n\n#### Invoked Parameters and Fields:\n- No parameters or fields are explicitly invoked or referenced in the provided code snippet.\n\n#### Invoked Methods:\n- The method `input()` itself is invoked recursively (`return this.input();`) in the code snippet provided at line 50. This recursive call might indicate a placeholder or incomplete implementation.\n\n#### Dependent Method Bodies:\n- No dependent method bodies are provided in the context. The focal method does not seem to call any other methods apart from itself.\n\n---\n\n### Step 3: Decomposition of the focal method\n\n```json\n[\n  {\n    \"id\": 1,\n    \"description\": \"Define the method signature for the overridden `input()` method, which declares that it returns a `String` and can throw an `Exception`.\",\n    \"code\": \"\\t@Override\\n\\tpublic String input() throws Exception {\",\n    \"start_line\": 53,\n    \"end_line\": 54\n  },\n  {\n    \"id\": 2,\n    \"description\": \"Implement the recursive call to the `input()` method, which might serve as a placeholder or incomplete logic.\",\n    \"code\": \"\\t\\treturn this.input();\",\n    \"start_line\": 50,\n    \"end_line\": 50\n  },\n  {\n    \"id\": 3,\n    \"description\": \"Close the method implementation block with the closing brace.\",\n    \"code\": \"\\t}\",\n    \"start_line\": 51,\n    \"end_line\": 51\n  }\n]\n```"
  },
  {
    "class_name": "classes.SchedulerAction",
    "function_name": "schedule()",
    "analysis": "### Step 1: Summarize the focal method\n\nThe `schedule()` method in the `classes.SchedulerAction` class is responsible for configuring and scheduling a Quartz job. It performs the following tasks:\n1. Initializes a Quartz `SchedulerFactory` and retrieves a `Scheduler` instance.\n2. Checks if a specific job (identified by `JobKey`) already exists, and deletes it if present.\n3. Creates a new job (`SupplyMailJob`) with specific configurations, including a time interval passed via `JobDataMap`.\n4. Configures a trigger for the job using a cron schedule based on the time interval.\n5. Schedules the job with the trigger using the `Scheduler` instance.\n6. Logs the start and end of the scheduling process and returns a predefined constant (`INPUT`).\n\n### Step 2: Necessary environment settings to run the focal method\n\n#### Invoked parameters and fields:\n- **`this.timeInterval`**: A field in the `classes.SchedulerAction` class, used to calculate the cron schedule for the job trigger.\n\n#### Invoked methods:\n- **`logger.info(String message)`**: Logs informational messages at the start and end of the method.\n- **`SchedulerFactory sf = new StdSchedulerFactory()`**: Creates a Quartz SchedulerFactory instance.\n- **`Scheduler sc = sf.getScheduler()`**: Retrieves a Scheduler instance from the factory.\n- **`sc.getJobDetail(JobKey.jobKey(String name, String group))`**: Checks if a job exists in the scheduler.\n- **`sc.deleteJob(JobKey.jobKey(String name, String group))`**: Deletes an existing job from the scheduler.\n- **`newJob(Class jobClass).withIdentity(String name, String group).build()`**: Creates a new job with the specified class and identity.\n- **`job.getJobDataMap().put(String key, Object value)`**: Adds data to the job's data map.\n- **`newTrigger().withIdentity(String name, String group).startNow().withSchedule(CronScheduleBuilder.cronSchedule(String cronExpression)).build()`**: Creates a trigger with a cron schedule.\n- **`sc.scheduleJob(JobDetail job, Trigger trigger)`**: Schedules the job with the specified trigger.\n\n---\n\n### Step 3: Decomposition of the focal method into multiple slices",
    "slices": [
      {
        "id": 1,
        "description": "Log the start of the scheduling process.",
        "code": "\t\tlogger.info( \"Starting schedule()\" ); //f:log",
        "start_line": 70,
        "end_line": 70
      },
      {
        "id": 2,
        "description": "Initialize the SchedulerFactory and retrieve a Scheduler instance.",
        "code": "\t\tSchedulerFactory sf = new StdSchedulerFactory(); //f:quartz\n\t\tScheduler sc = sf.getScheduler(); //f:quartz",
        "start_line": 72,
        "end_line": 73
      },
      {
        "id": 3,
        "description": "Check if the job with the specified JobKey exists and delete it if present.",
        "code": "\t\tJobDetail job = sc.getJobDetail( JobKey.jobKey( \"supplyMailJob\", \"group\" ) ); //f:quartz\n\n\t\tif ( job != null ) { //f:quartz\n\t\t\tsc.deleteJob( JobKey.jobKey( \"supplyMailJob\", \"group\" ) ); //f:quartz\n\t\t} //f:quartz",
        "start_line": 75,
        "end_line": 79
      },
      {
        "id": 4,
        "description": "Create a new job instance and configure its JobDataMap with the time interval.",
        "code": "\t\tjob = newJob( SupplyMailJob.class ).withIdentity( \"supplyMailJob\", \"group\" ).build(); //f:quartz\n\t\tjob.getJobDataMap().put( \"timeInterval\", this.timeInterval ); //f:quartz",
        "start_line": 81,
        "end_line": 82
      },
      {
        "id": 5,
        "description": "Create a trigger for the job using a cron schedule based on the time interval.",
        "code": "\t\tTrigger trigger = newTrigger().withIdentity( \"supplyMailTrigger\", \"group\" ).startNow().withSchedule( CronScheduleBuilder.cronSchedule( \"0 0/\"\n\t\t\t\t+ (this.timeInterval * 60) + \" * * * ?\" ) ).build(); //f:quartz",
        "start_line": 84,
        "end_line": 85
      },
      {
        "id": 6,
        "description": "Schedule the job with the configured trigger using the Scheduler instance.",
        "code": "\t\tsc.scheduleJob( job, trigger ); //f:quartz",
        "start_line": 87,
        "end_line": 87
      },
      {
        "id": 7,
        "description": "Log the end of the scheduling process and return the predefined constant INPUT.",
        "code": "\t\tlogger.info( \"Finishing schedule()\" ); //f:log\n\t\treturn INPUT;",
        "start_line": 89,
        "end_line": 90
      }
    ],
    "full_response": "### Step 1: Summarize the focal method\n\nThe `schedule()` method in the `classes.SchedulerAction` class is responsible for configuring and scheduling a Quartz job. It performs the following tasks:\n1. Initializes a Quartz `SchedulerFactory` and retrieves a `Scheduler` instance.\n2. Checks if a specific job (identified by `JobKey`) already exists, and deletes it if present.\n3. Creates a new job (`SupplyMailJob`) with specific configurations, including a time interval passed via `JobDataMap`.\n4. Configures a trigger for the job using a cron schedule based on the time interval.\n5. Schedules the job with the trigger using the `Scheduler` instance.\n6. Logs the start and end of the scheduling process and returns a predefined constant (`INPUT`).\n\n### Step 2: Necessary environment settings to run the focal method\n\n#### Invoked parameters and fields:\n- **`this.timeInterval`**: A field in the `classes.SchedulerAction` class, used to calculate the cron schedule for the job trigger.\n\n#### Invoked methods:\n- **`logger.info(String message)`**: Logs informational messages at the start and end of the method.\n- **`SchedulerFactory sf = new StdSchedulerFactory()`**: Creates a Quartz SchedulerFactory instance.\n- **`Scheduler sc = sf.getScheduler()`**: Retrieves a Scheduler instance from the factory.\n- **`sc.getJobDetail(JobKey.jobKey(String name, String group))`**: Checks if a job exists in the scheduler.\n- **`sc.deleteJob(JobKey.jobKey(String name, String group))`**: Deletes an existing job from the scheduler.\n- **`newJob(Class jobClass).withIdentity(String name, String group).build()`**: Creates a new job with the specified class and identity.\n- **`job.getJobDataMap().put(String key, Object value)`**: Adds data to the job's data map.\n- **`newTrigger().withIdentity(String name, String group).startNow().withSchedule(CronScheduleBuilder.cronSchedule(String cronExpression)).build()`**: Creates a trigger with a cron schedule.\n- **`sc.scheduleJob(JobDetail job, Trigger trigger)`**: Schedules the job with the specified trigger.\n\n---\n\n### Step 3: Decomposition of the focal method into multiple slices\n\n```json\n[\n  {\n    \"id\": 1,\n    \"description\": \"Log the start of the scheduling process.\",\n    \"code\": \"\\t\\tlogger.info( \\\"Starting schedule()\\\" ); //f:log\",\n    \"start_line\": 70,\n    \"end_line\": 70\n  },\n  {\n    \"id\": 2,\n    \"description\": \"Initialize the SchedulerFactory and retrieve a Scheduler instance.\",\n    \"code\": \"\\t\\tSchedulerFactory sf = new StdSchedulerFactory(); //f:quartz\\n\\t\\tScheduler sc = sf.getScheduler(); //f:quartz\",\n    \"start_line\": 72,\n    \"end_line\": 73\n  },\n  {\n    \"id\": 3,\n    \"description\": \"Check if the job with the specified JobKey exists and delete it if present.\",\n    \"code\": \"\\t\\tJobDetail job = sc.getJobDetail( JobKey.jobKey( \\\"supplyMailJob\\\", \\\"group\\\" ) ); //f:quartz\\n\\n\\t\\tif ( job != null ) { //f:quartz\\n\\t\\t\\tsc.deleteJob( JobKey.jobKey( \\\"supplyMailJob\\\", \\\"group\\\" ) ); //f:quartz\\n\\t\\t} //f:quartz\",\n    \"start_line\": 75,\n    \"end_line\": 79\n  },\n  {\n    \"id\": 4,\n    \"description\": \"Create a new job instance and configure its JobDataMap with the time interval.\",\n    \"code\": \"\\t\\tjob = newJob( SupplyMailJob.class ).withIdentity( \\\"supplyMailJob\\\", \\\"group\\\" ).build(); //f:quartz\\n\\t\\tjob.getJobDataMap().put( \\\"timeInterval\\\", this.timeInterval ); //f:quartz\",\n    \"start_line\": 81,\n    \"end_line\": 82\n  },\n  {\n    \"id\": 5,\n    \"description\": \"Create a trigger for the job using a cron schedule based on the time interval.\",\n    \"code\": \"\\t\\tTrigger trigger = newTrigger().withIdentity( \\\"supplyMailTrigger\\\", \\\"group\\\" ).startNow().withSchedule( CronScheduleBuilder.cronSchedule( \\\"0 0/\\\"\\n\\t\\t\\t\\t+ (this.timeInterval * 60) + \\\" * * * ?\\\" ) ).build(); //f:quartz\",\n    \"start_line\": 84,\n    \"end_line\": 85\n  },\n  {\n    \"id\": 6,\n    \"description\": \"Schedule the job with the configured trigger using the Scheduler instance.\",\n    \"code\": \"\\t\\tsc.scheduleJob( job, trigger ); //f:quartz\",\n    \"start_line\": 87,\n    \"end_line\": 87\n  },\n  {\n    \"id\": 7,\n    \"description\": \"Log the end of the scheduling process and return the predefined constant INPUT.\",\n    \"code\": \"\\t\\tlogger.info( \\\"Finishing schedule()\\\" ); //f:log\\n\\t\\treturn INPUT;\",\n    \"start_line\": 89,\n    \"end_line\": 90\n  }\n]\n```"
  },
  {
    "class_name": "classes.SupplyMailJob",
    "function_name": "execute(JobExecutionContext)",
    "analysis": "### Step 1: Summarize the Focal Method\n\nThe `execute(JobExecutionContext)` method in the `SupplyMailJob` class performs the following tasks:\n1. Logs the start of the job execution.\n2. Opens a Hibernate session and retrieves a list of `Product` entities with a supply less than 5.\n3. If the list of products is not empty, it prepares and sends an email notification about the low-supply products.\n4. Logs the completion of the job execution.\n\nThe method interacts with Hibernate for database operations and JavaMail for sending email notifications. Additionally, it uses logging to track the execution flow.\n\n---\n\n### Step 2: List Necessary Environment Settings to Run the Focal Method\n\n#### Invoked Parameters and Fields\n1. **Parameters**:\n   - `JobExecutionContext context`: The context of the job execution (not directly used in the method).\n2. **Fields**:\n   - `this.host`: SMTP host for sending emails.\n   - `this.from`: Sender's email address.\n   - `this.to`: Recipient's email address.\n\n#### Invoked Methods\n1. **Hibernate-related**:\n   - `HibernateUtil.getSessionFactory()`: Retrieves the Hibernate `SessionFactory`.\n   - `sess.createCriteria(Product.class)`: Creates a criteria query for the `Product` class.\n   - `criteria.add(Restrictions.lt(\"supply\", 5))`: Adds a restriction to filter products with a supply less than 5.\n   - `criteria.list()`: Executes the query and retrieves the list of products.\n   - `sess.beginTransaction()`, `t.commit()`, `sess.close()`: Transaction management and session closure.\n2. **Product-related**:\n   - `Product.getName()`: Retrieves the name of a product.\n   - `Product.getSupply()`: Retrieves the supply quantity of a product.\n3. **JavaMail-related**:\n   - `javax.mail.Session.getInstance(Properties)`: Creates a mail session with the specified properties.\n   - `MimeMessage`: Constructs an email message.\n   - `Transport.send(Message)`: Sends the email message.\n\n---\n\n### Step 3: Decompose the Focal Method into Multiple Problem-Solving Steps",
    "slices": [
      {
        "id": 1,
        "description": "Log the start of the job execution.",
        "code": "\t\tlogger.info( \"Starting execute() in job\" ); //f:log",
        "start_line": 31,
        "end_line": 31
      },
      {
        "id": 2,
        "description": "Open a Hibernate session, begin a transaction, and retrieve products with supply less than 5.",
        "code": "\t\torg.hibernate.Session sess = HibernateUtil.getSessionFactory().openSession(); //f:hibernate\n\t\tTransaction t = sess.beginTransaction(); //f:hibernate\n\n\t\tCriteria criteria = sess.createCriteria( Product.class ); //f:hibernate\n\t\tcriteria.add( Restrictions.lt( \"supply\", 5 ) ); //f:hibernate\n\n\t\t@SuppressWarnings(\"unchecked\")\n\t\tList<Product> l = (List<Product>) criteria.list(); //f:hibernate\n\t\tt.commit(); //f:hibernate\n\t\tsess.close(); //f:hibernate",
        "start_line": 33,
        "end_line": 42
      },
      {
        "id": 3,
        "description": "Check if the list of products is not empty and initialize a StringBuilder for the email content.",
        "code": "\t\tif ( !l.isEmpty() ) {\n\t\t\tStringBuilder str = new StringBuilder();\n\t\t\tstr.append( \"The following products are getting over:\\n\" );",
        "start_line": 44,
        "end_line": 46
      },
      {
        "id": 4,
        "description": "Set up email properties for the SMTP server.",
        "code": "\t\t\tProperties props = new Properties(); //f:mail\n\t\t\tprops.setProperty( \"mail.smtp.submitter\", \"terra\" ); //f:mail\n\t\t\tprops.setProperty( \"mail.smtp.auth\", \"false\" ); //f:mail\n\t\t\tprops.setProperty( \"mail.smtp.host\", this.host ); //f:mail\n\t\t\tprops.setProperty( \"mail.smtp.port\", \"25\" ); //f:mail",
        "start_line": 48,
        "end_line": 52
      },
      {
        "id": 5,
        "description": "Create a mail session and construct the email message.",
        "code": "\t\t\tjavax.mail.Session session = javax.mail.Session.getInstance( props ); //f:mail\n\n\t\t\ttry { //f:mail\n\t\t\t\tMessage msg = new MimeMessage( session ); //f:mail\n\n\t\t\t\tmsg.setFrom( new InternetAddress( this.from ) ); //f:mail\n\t\t\t\tInternetAddress[] address = { new InternetAddress( this.to ) }; //f:mail\n\t\t\t\tmsg.setRecipients( Message.RecipientType.TO, address ); //f:mail\n\t\t\t\tmsg.setSubject( \"Low Supply of Products\" ); //f:mail\n\t\t\t\tmsg.setSentDate( new Date() ); //f:mail\n\n\t\t\t\tmsg.setText( str.toString() ); //f:mail",
        "start_line": 54,
        "end_line": 65
      },
      {
        "id": 6,
        "description": "Send the email and handle potential exceptions.",
        "code": "\t\t\t\tTransport.send( msg ); //f:mail\n\t\t\t} catch (MessagingException mex) {\n\t\t\t\tmex.printStackTrace();\n\t\t\t}",
        "start_line": 67,
        "end_line": 70
      },
      {
        "id": 7,
        "description": "Append details of the low-supply products to the StringBuilder.",
        "code": "\t\t\tfor ( Product p : l ) {\n\t\t\t\tstr.append( p.getName() + \"\\t\\t\" + p.getSupply() + \"\\n\" );\n\t\t\t}",
        "start_line": 72,
        "end_line": 74
      },
      {
        "id": 8,
        "description": "Log the completion of the job execution.",
        "code": "\t\tlogger.info( \"Finishing execute() in job\" ); //f:log",
        "start_line": 77,
        "end_line": 77
      }
    ],
    "full_response": "### Step 1: Summarize the Focal Method\n\nThe `execute(JobExecutionContext)` method in the `SupplyMailJob` class performs the following tasks:\n1. Logs the start of the job execution.\n2. Opens a Hibernate session and retrieves a list of `Product` entities with a supply less than 5.\n3. If the list of products is not empty, it prepares and sends an email notification about the low-supply products.\n4. Logs the completion of the job execution.\n\nThe method interacts with Hibernate for database operations and JavaMail for sending email notifications. Additionally, it uses logging to track the execution flow.\n\n---\n\n### Step 2: List Necessary Environment Settings to Run the Focal Method\n\n#### Invoked Parameters and Fields\n1. **Parameters**:\n   - `JobExecutionContext context`: The context of the job execution (not directly used in the method).\n2. **Fields**:\n   - `this.host`: SMTP host for sending emails.\n   - `this.from`: Sender's email address.\n   - `this.to`: Recipient's email address.\n\n#### Invoked Methods\n1. **Hibernate-related**:\n   - `HibernateUtil.getSessionFactory()`: Retrieves the Hibernate `SessionFactory`.\n   - `sess.createCriteria(Product.class)`: Creates a criteria query for the `Product` class.\n   - `criteria.add(Restrictions.lt(\"supply\", 5))`: Adds a restriction to filter products with a supply less than 5.\n   - `criteria.list()`: Executes the query and retrieves the list of products.\n   - `sess.beginTransaction()`, `t.commit()`, `sess.close()`: Transaction management and session closure.\n2. **Product-related**:\n   - `Product.getName()`: Retrieves the name of a product.\n   - `Product.getSupply()`: Retrieves the supply quantity of a product.\n3. **JavaMail-related**:\n   - `javax.mail.Session.getInstance(Properties)`: Creates a mail session with the specified properties.\n   - `MimeMessage`: Constructs an email message.\n   - `Transport.send(Message)`: Sends the email message.\n\n---\n\n### Step 3: Decompose the Focal Method into Multiple Problem-Solving Steps\n\n```json\n[\n  {\n    \"id\": 1,\n    \"description\": \"Log the start of the job execution.\",\n    \"code\": \"\\t\\tlogger.info( \\\"Starting execute() in job\\\" ); //f:log\",\n    \"start_line\": 31,\n    \"end_line\": 31\n  },\n  {\n    \"id\": 2,\n    \"description\": \"Open a Hibernate session, begin a transaction, and retrieve products with supply less than 5.\",\n    \"code\": \"\\t\\torg.hibernate.Session sess = HibernateUtil.getSessionFactory().openSession(); //f:hibernate\\n\\t\\tTransaction t = sess.beginTransaction(); //f:hibernate\\n\\n\\t\\tCriteria criteria = sess.createCriteria( Product.class ); //f:hibernate\\n\\t\\tcriteria.add( Restrictions.lt( \\\"supply\\\", 5 ) ); //f:hibernate\\n\\n\\t\\t@SuppressWarnings(\\\"unchecked\\\")\\n\\t\\tList<Product> l = (List<Product>) criteria.list(); //f:hibernate\\n\\t\\tt.commit(); //f:hibernate\\n\\t\\tsess.close(); //f:hibernate\",\n    \"start_line\": 33,\n    \"end_line\": 42\n  },\n  {\n    \"id\": 3,\n    \"description\": \"Check if the list of products is not empty and initialize a StringBuilder for the email content.\",\n    \"code\": \"\\t\\tif ( !l.isEmpty() ) {\\n\\t\\t\\tStringBuilder str = new StringBuilder();\\n\\t\\t\\tstr.append( \\\"The following products are getting over:\\\\n\\\" );\",\n    \"start_line\": 44,\n    \"end_line\": 46\n  },\n  {\n    \"id\": 4,\n    \"description\": \"Set up email properties for the SMTP server.\",\n    \"code\": \"\\t\\t\\tProperties props = new Properties(); //f:mail\\n\\t\\t\\tprops.setProperty( \\\"mail.smtp.submitter\\\", \\\"terra\\\" ); //f:mail\\n\\t\\t\\tprops.setProperty( \\\"mail.smtp.auth\\\", \\\"false\\\" ); //f:mail\\n\\t\\t\\tprops.setProperty( \\\"mail.smtp.host\\\", this.host ); //f:mail\\n\\t\\t\\tprops.setProperty( \\\"mail.smtp.port\\\", \\\"25\\\" ); //f:mail\",\n    \"start_line\": 48,\n    \"end_line\": 52\n  },\n  {\n    \"id\": 5,\n    \"description\": \"Create a mail session and construct the email message.\",\n    \"code\": \"\\t\\t\\tjavax.mail.Session session = javax.mail.Session.getInstance( props ); //f:mail\\n\\n\\t\\t\\ttry { //f:mail\\n\\t\\t\\t\\tMessage msg = new MimeMessage( session ); //f:mail\\n\\n\\t\\t\\t\\tmsg.setFrom( new InternetAddress( this.from ) ); //f:mail\\n\\t\\t\\t\\tInternetAddress[] address = { new InternetAddress( this.to ) }; //f:mail\\n\\t\\t\\t\\tmsg.setRecipients( Message.RecipientType.TO, address ); //f:mail\\n\\t\\t\\t\\tmsg.setSubject( \\\"Low Supply of Products\\\" ); //f:mail\\n\\t\\t\\t\\tmsg.setSentDate( new Date() ); //f:mail\\n\\n\\t\\t\\t\\tmsg.setText( str.toString() ); //f:mail\",\n    \"start_line\": 54,\n    \"end_line\": 65\n  },\n  {\n    \"id\": 6,\n    \"description\": \"Send the email and handle potential exceptions.\",\n    \"code\": \"\\t\\t\\t\\tTransport.send( msg ); //f:mail\\n\\t\\t\\t} catch (MessagingException mex) {\\n\\t\\t\\t\\tmex.printStackTrace();\\n\\t\\t\\t}\",\n    \"start_line\": 67,\n    \"end_line\": 70\n  },\n  {\n    \"id\": 7,\n    \"description\": \"Append details of the low-supply products to the StringBuilder.\",\n    \"code\": \"\\t\\t\\tfor ( Product p : l ) {\\n\\t\\t\\t\\tstr.append( p.getName() + \\\"\\\\t\\\\t\\\" + p.getSupply() + \\\"\\\\n\\\" );\\n\\t\\t\\t}\",\n    \"start_line\": 72,\n    \"end_line\": 74\n  },\n  {\n    \"id\": 8,\n    \"description\": \"Log the completion of the job execution.\",\n    \"code\": \"\\t\\tlogger.info( \\\"Finishing execute() in job\\\" ); //f:log\",\n    \"start_line\": 77,\n    \"end_line\": 77\n  }\n]\n```"
  }
]