{
  "fullClassName": "CH.ifa.draw.samples.nothing.NothingApp",
  "className": "NothingApp",
  "index": 85,
  "modifier": "[public ]",
  "extend": "[DrawApplication]",
  "implement": "[]",
  "packageName": "CH.ifa.draw.samples.nothing",
  "packageDeclaration": "package CH.ifa.draw.samples.nothing;",
  "classSignature": "public  class NothingApp",
  "hasConstructor": true,
  "isPublic": true,
  "isInterface": false,
  "isAbstract": false,
  "imports": [
    "import javax.swing.*;",
    "import java.awt.*;",
    "import java.util.*;",
    "import java.io.*;",
    "import CH.ifa.draw.framework.*;",
    "import CH.ifa.draw.standard.*;",
    "import CH.ifa.draw.figures.*;",
    "import CH.ifa.draw.contrib.*;",
    "import CH.ifa.draw.util.*;",
    "import CH.ifa.draw.application.*;"
  ],
  "fields": [],
  "superClasses": [
    "DrawApplication"
  ],
  "implementedTypes": [],
  "methodSigs": {
    "createTools(JToolBar)": "0",
    "main(String[])": "1",
    "NothingApp()": "2"
  },
  "methodsBrief": [
    "protected void createTools(JToolBar palette){}",
    "public static void main(String[] args){}",
    "NothingApp(){}"
  ],
  "constructorSigs": [
    "NothingApp()"
  ],
  "constructorBrief": [
    "NothingApp(){}"
  ],
  "getterSetterSigs": [],
  "getterSetterBrief": [],
  "constructorDeps": {},
  "compilationUnitCode": "/*\n * @(#)NothingApp.java 5.2\n *\n */\npackage CH.ifa.draw.samples.nothing;\n\nimport javax.swing.*;\nimport java.awt.*;\nimport java.util.*;\nimport java.io.*;\nimport CH.ifa.draw.framework.*;\nimport CH.ifa.draw.standard.*;\nimport CH.ifa.draw.figures.*;\nimport CH.ifa.draw.contrib.*;\nimport CH.ifa.draw.util.*;\nimport CH.ifa.draw.application.*;\n\npublic class NothingApp extends DrawApplication {\n\n    NothingApp() {\n        super(\"Nothing\");\n    }\n\n    protected void createTools(JToolBar palette) {\n        super.createTools(palette);\n        Tool tool = new TextTool(view(), new TextFigure());\n        palette.add(createToolButton(IMAGES + \"TEXT\", \"Text Tool\", tool));\n        tool = new CreationTool(view(), new RectangleFigure());\n        palette.add(createToolButton(IMAGES + \"RECT\", \"Rectangle Tool\", tool));\n        tool = new CreationTool(view(), new RoundRectangleFigure());\n        palette.add(createToolButton(IMAGES + \"RRECT\", \"Round Rectangle Tool\", tool));\n        tool = new CreationTool(view(), new EllipseFigure());\n        palette.add(createToolButton(IMAGES + \"ELLIPSE\", \"Ellipse Tool\", tool));\n        tool = new CreationTool(view(), new LineFigure());\n        palette.add(createToolButton(IMAGES + \"LINE\", \"Line Tool\", tool));\n        tool = new PolygonTool(view());\n        palette.add(createToolButton(IMAGES + \"POLYGON\", \"Polygon Tool\", tool));\n        tool = new ConnectionTool(view(), new LineConnection());\n        palette.add(createToolButton(IMAGES + \"CONN\", \"Connection Tool\", tool));\n        tool = new ConnectionTool(view(), new ElbowConnection());\n        palette.add(createToolButton(IMAGES + \"OCONN\", \"Elbow Connection Tool\", tool));\n    }\n\n    // -- main -----------------------------------------------------------\n    public static void main(String[] args) {\n        DrawApplication window = new NothingApp();\n        window.open();\n    }\n}\n",
  "classDeclarationCode": "public class NothingApp extends DrawApplication {\n\n    NothingApp() {\n        super(\"Nothing\");\n    }\n\n    protected void createTools(JToolBar palette) {\n        super.createTools(palette);\n        Tool tool = new TextTool(view(), new TextFigure());\n        palette.add(createToolButton(IMAGES + \"TEXT\", \"Text Tool\", tool));\n        tool = new CreationTool(view(), new RectangleFigure());\n        palette.add(createToolButton(IMAGES + \"RECT\", \"Rectangle Tool\", tool));\n        tool = new CreationTool(view(), new RoundRectangleFigure());\n        palette.add(createToolButton(IMAGES + \"RRECT\", \"Round Rectangle Tool\", tool));\n        tool = new CreationTool(view(), new EllipseFigure());\n        palette.add(createToolButton(IMAGES + \"ELLIPSE\", \"Ellipse Tool\", tool));\n        tool = new CreationTool(view(), new LineFigure());\n        palette.add(createToolButton(IMAGES + \"LINE\", \"Line Tool\", tool));\n        tool = new PolygonTool(view());\n        palette.add(createToolButton(IMAGES + \"POLYGON\", \"Polygon Tool\", tool));\n        tool = new ConnectionTool(view(), new LineConnection());\n        palette.add(createToolButton(IMAGES + \"CONN\", \"Connection Tool\", tool));\n        tool = new ConnectionTool(view(), new ElbowConnection());\n        palette.add(createToolButton(IMAGES + \"OCONN\", \"Elbow Connection Tool\", tool));\n    }\n\n    // -- main -----------------------------------------------------------\n    public static void main(String[] args) {\n        DrawApplication window = new NothingApp();\n        window.open();\n    }\n}",
  "subClasses": []
}