{
  "className": "FigureAttributes",
  "methodName": "read",
  "brief": "public void read(StorableInput dr) throws IOException{}",
  "methodSignature": "read(StorableInput)",
  "sourceCode": "public void read(StorableInput dr) throws IOException {\n        String s = dr.readString();\n        if (!s.toLowerCase().equals(\"attributes\"))\n            throw new IOException(\"Attributes expected\");\n\n        fMap = new Hashtable();\n        int size = dr.readInt();\n        for (int i=0; i<size; i++) {\n            String key = dr.readString();\n            String valtype = dr.readString();\n            Object val = null;\n            if (valtype.equals(\"Color\"))\n                val = new Color(dr.readInt(), dr.readInt(), dr.readInt());\n            else if (valtype.equals(\"Boolean\"))\n                val = new Boolean(dr.readString());\n            else if (valtype.equals(\"String\"))\n                val = dr.readString();\n            else if (valtype.equals(\"Int\"))\n                val = new Integer(dr.readInt());\n            else if (valtype.equals(\"Storable\"))\n                val = dr.readStorable();\n            else if (valtype.equals(Figure.POPUP_MENU)) {\n                // read String but don't store it\n            \tcontinue;\n            }\n            else if (valtype.equals(\"UNKNOWN\"))\n                continue;\n            fMap.put(key,val);\n        }\n    }",
  "useField": true,
  "isConstructor": false,
  "isGetSet": false,
  "isPublic": true,
  "isBoolean": false,
  "isAbstract": false,
  "parameters": [
    "StorableInput"
  ],
  "dependentMethods": {
    "CH.ifa.draw.util.StorableInput": [
      "readInt()",
      "readString()",
      "readStorable()"
    ],
    "java.lang.String": [
      "equals(Object)",
      "toLowerCase()"
    ],
    "java.util.Hashtable": [
      "put(K, V)"
    ]
  },
  "full_method_info": "/**\n * Reads the attributes from a StorableInput.\n * FigureAttributes store the following types directly:\n * Color, Boolean, String, Int. Other attribute types\n * have to implement the Storable interface or they\n * have to be wrapped by an object that implements Storable.\n * @see Storable\n * @see #write\n */\npublic void read(StorableInput dr) throws IOException {\n    String s = dr.readString();\n    if (!s.toLowerCase().equals(\"attributes\"))\n        throw new IOException(\"Attributes expected\");\n    fMap = new Hashtable();\n    int size = dr.readInt();\n    for (int i = 0; i < size; i++) {\n        String key = dr.readString();\n        String valtype = dr.readString();\n        Object val = null;\n        if (valtype.equals(\"Color\"))\n            val = new Color(dr.readInt(), dr.readInt(), dr.readInt());\n        else if (valtype.equals(\"Boolean\"))\n            val = new Boolean(dr.readString());\n        else if (valtype.equals(\"String\"))\n            val = dr.readString();\n        else if (valtype.equals(\"Int\"))\n            val = new Integer(dr.readInt());\n        else if (valtype.equals(\"Storable\"))\n            val = dr.readStorable();\n        else if (valtype.equals(Figure.POPUP_MENU)) {\n            // read String but don't store it\n            continue;\n        } else if (valtype.equals(\"UNKNOWN\"))\n            continue;\n        fMap.put(key, val);\n    }\n}",
  "method_comment": "\n     * Reads the attributes from a StorableInput.\n     * FigureAttributes store the following types directly:\n     * Color, Boolean, String, Int. Other attribute types\n     * have to implement the Storable interface or they\n     * have to be wrapped by an object that implements Storable.\n     * @see Storable\n     * @see #write\n     ",
  "method_annotation": ""
}